"building_short_description_texts_short_description_twr2_rome_barbarian_Farm_short"	"If we take care of the land, it will take care of us."	"True"
"building_short_description_texts_short_description_twr2_rome_carthage_Shrine_of_eshmun_short"	"Eshmun is the god of healing and renewal, and worthy of praise."	"True"
"building_short_description_texts_short_description_barb_craftsmen"	"A lifetime of smashing things is oddly good practice for making them."	"True"
"building_short_description_texts_short_description_pirates_illyrian_shrine_thana_short"	"Over the shadowy hills and windy peaks she draws her bow."	"True"
"building_short_description_texts_short_description_twr2_rome_rome_Shrine_of_Minerva_short"	"Pray to the daughter of Jupiter that she will guide you through life’s challenges."	"True"
"building_short_description_texts_short_description_twr2_rome_greek_Hamlet_short"	"Small communities thrive through shared endeavour."	"True"
"building_short_description_texts_short_description_twr2_rome_barbarian_Blacksmith_short"	"Through his knowledge of the Otherworld he creates power from the earth itself."	"True"
"building_short_description_texts_short_description_inv_etr_main_administration_wealth_9"	"Chosen by few to rule many from here."	"True"
"building_short_description_texts_short_description_inv_etr_main_administration_wealth_7"	"A proper home for a proper man."	"True"
"building_short_description_texts_short_description_inv_etr_main_administration_wealth_6"	"Some are always more equal than others."	"True"
"building_short_description_texts_short_description_twr2_rome_rome_Cohort_Barracks_short"	"Soldiers must be separated from civilians, and imbued with discipline."	"True"
"building_short_description_texts_short_description_inv_nur_agriculture_orchard_2_short"	"Few rows of grapes, hundreds of cups of wine."	"True"
"building_short_description_texts_short_description_inv_nur_agriculture_orchard_3_short"	"Even small vineyards can bring great pleasure."	"True"
"building_short_description_texts_short_description_inv_nur_agriculture_orchard_4_short"	"Nuragic farms provided for the entire people."	"True"
"building_short_description_texts_short_description_glass_maker"	"Expert glassware represents form and function in perfect harmony."	"True"
"building_short_description_texts_short_description_twr2_rome_rome_Circus_Maximus_short"	"It's more than racing: supporting a team is life, death and eternal loyalty for the fans…"	"True"
"building_short_description_texts_short_description_inv_nur_religion_well_4_short"	"Water is the bringer of life and must be worshipped."	"True"
"building_short_description_texts_short_description_twr2_rome_carthage_Shrine_of_baal_zephon_short"	"A shrine to the lord of storms and bringer of the rains."	"True"
"building_short_description_texts_short_description_twr2_rome_rome_Temple_of_Jupiter_short"	"No honest Roman city should lack a temple to Jupiter, the bringer of order…"	"True"
"building_short_description_texts_short_description_twr2_rome_celts_Grove_of_epona_short"	"Lady Epona: guardian of all noble steeds."	"True"
"building_short_description_texts_short_description_twr2_rome_barbarian_Great_hall_short"	"Power is a curious thing: it must be seen to be believed."	"True"
"building_short_description_texts_short_description_twr2_rome_italic_shrine_mamers_short"	"Stern-faced Mamers should be suitably honoured by such a warlike people."	"True"
"building_short_description_texts_short_description_inv_nur_religion_tomb_2_short"	"Belief and faith bring people together, even in death."	"True"
"building_short_description_texts_short_description_inv_nur_religion_tomb_3_short"	"A shrine to honoured ancestors and a reminder of history."	"True"
"building_short_description_texts_short_description_inv_nur_religion_tomb_4_short"	"A proper gate to the Otherworld."	"True"
"building_short_description_texts_short_description_twr2_rome_barbarian_City_short"	"Together we are stronger."	"True"
"building_short_description_texts_short_description_twr2_rome_carthage_Temple_of_eshmun_short"	"For those seeking healing and protection what better places is there\?"	"True"
"building_short_description_texts_short_description_twr2_rome_eastern_Fire_temple_short"	"The sacred flame holds back the night and disorder."	"True"
"building_short_description_texts_short_description_pirates_dacian_grove_zalmoxis_short"	"A grove to worship the supreme god."	"True"
"building_short_description_texts_short_description_twr2_rome_rome_Public_Baths_short"	"There is nothing more Roman than cleanliness and gossip in the baths."	"True"
"building_short_description_texts_short_description_twr2_rome_carthage_Dockshed_short"	"Command of the seas comes from Carthage's great fleet."	"True"
"building_short_description_texts_short_description_twr2_rome_rome_Ludus_Magnus_short"	"Any fool can swing a sword. A gladiator is taught to fight well and to die well."	"True"
"building_short_description_texts_short_description_twr2_rome_celts_Shrine_of_cernunnos_short"	"Honest toil in the fields is rewarded by Cernunnos."	"True"
"building_short_description_texts_short_description_3c_palmyra_religious_ShrineBaalshamin"	"Any offering works if your intentions are true."	"True"
"building_short_description_texts_short_description_inv_etr_minor_religion_short"	"A sacred place for whispered prayers."	"True"
"building_short_description_texts_short_description_pel_goat_pens"	"You can never miss the goat pens. Just follow the bleats."	"True"
"building_short_description_texts_short_description_twr2_rome_carthage_Temple_of_baal_zephon_short"	"Those who honour Ba'al Zephon are protected from hunger."	"True"
"building_short_description_texts_short_description_twr2_rome_rome_Shrine_of_Jupiter_short"	"Jupiter, king of the gods, watches over all men and judges their acts."	"True"
"building_short_description_texts_short_description_twr2_rome_carthage_Precinct_of_melqart_short"	"Pilgrims and traders come to receive Melqart's blessings and aid."	"True"
"building_short_description_texts_short_description_twr2_rome_dlc_nomadic_Shrine_of_Api_short"	"Give thanks to Api, and honour her earth."	"True"
"building_short_description_texts_short_description_twr2_rome_barbarian_Mint_short"	"Coins mean less bloodletting come market day."	"True"
"building_short_description_texts_short_description_east_satrap_large_city"	"Sometimes, autonomy comes at the cost of status."	"True"
"building_short_description_texts_short_description_twr2_rome_greek_Shrine_of_athena_short"	"The daughter of Zeus, patron goddess of Athens, is worshipped for her courage and wisdom."	"True"
"building_short_description_texts_short_description_twr2_rome_rome_Slave_Trader_short"	"Slaves are the sinews of an empire. Nothing can be achieved without them."	"True"
"building_short_description_texts_short_description_barb_enameller"	"Through which plain, dull metal can be transformed into a shimmering rainbow."	"True"
"building_short_description_texts_short_description_greek_gathering_place"	"The agora embodies the heart, mind and soul of the city."	"True"
"building_short_description_texts_short_description_dk_ara_caravanserai_2_short"	"Everyone is welcome, as long as they pay!"	"True"
"building_short_description_texts_short_description_dk_ara_caravanserai_3_short"	"A place to buy and sell, where everyone profits."	"True"
"building_short_description_texts_short_description_dk_ara_caravanserai_5_short"	"A palace for caravans, a safe haven for their owners."	"True"
"building_short_description_texts_short_description_3c_rom_admin_VigilesUrbani"	"The efforts of the few guarantee the security of the many."	"True"
"building_short_description_texts_short_description_twr2_rome_rome_Public_Forum_short"	"More than just a marketplace, the forum is the hub of all society."	"True"
"building_short_description_texts_short_description_twr2_rome_dlc_nomadic_Large_Herd_short"	"The riches of the steppe cannot be measured, only admired."	"True"
"building_short_description_texts_short_description_twr2_rome_rome_Wine_Shop_short"	"An honest wine merchant is always happy to drink his own wares."	"True"
"building_short_description_texts_short_description_twr2_rome_greek_Fountain_short"	"A fountain is an echo of the ever-changing tranquillity of Olympus."	"True"
"building_short_description_texts_short_description_twr2_rome_barbarian_Meeting_hall_short"	"A tribe that drinks together, stays together!"	"True"
"building_short_description_texts_short_description_twr2_rome_rome_Temple_of_Minerva_short"	"Minerva helps those who listen to her wisdom, and do her proper honour."	"True"
"building_short_description_texts_short_description_twr2_rome_barbarian_Fishmarket_short"	"The gods provide the bounty of the oceans."	"True"
"building_short_description_texts_short_description_twr2_rome_egypt_Royal_mausoleion_short"	"Even in death, royalty have power."	"True"
"building_short_description_texts_short_description_twr2_rome_germanic_Shrine_of_frijjo_short"	"Children are the blessings and joy of Frijjo."	"True"
"building_short_description_texts_short_description_twr2_rome_germanic_Shrine_of_teiwaz_short"	"All warriors should honour mighty Teiwaz."	"True"
"building_short_description_texts_short_description_3c_east_admin_GizirBarracks"	"The streets are much safer when the guards are doing their rounds."	"True"
"building_short_description_texts_short_description_twr2_rome_eastern_Windcatcher_short"	"A tower that cunningly channels the breeze to cool a building's occupants."	"True"
"building_short_description_texts_short_description_gaul_roman_monumental_architect_short"	"Architects and artisans to oversee the grandest of designs."	"True"
"building_short_description_texts_short_description_inv_etr_main_religion_nethuns_6_short"	"Nethuns, god of the sea, helps all sailors who properly honour him."	"True"
"building_short_description_texts_short_description_inv_etr_main_religion_nethuns_7_short"	"All water flows from Nethuns, especially when he is shown due deference."	"True"
"building_short_description_texts_short_description_inv_etr_main_religion_nethuns_9_short"	"This mighty temple to Nethuns ensures that all seaborne enterprises go well."	"True"
"building_short_description_texts_short_description_twr2_rome_dlc_nomadic_Sanctuary_of_Api_short"	"Honour the earth-mother, and give thanks for her bounty."	"True"
"building_short_description_texts_short_description_twr2_rome_greek_Wine_market_short"	"When the merchant goes to so much trouble, isn't it rude not to drink his wares\?"	"True"
"building_short_description_texts_short_description_twr2_rome_rome_Urbs_short"	"All the world is in a city, a stroll from your front door."	"True"
"building_short_description_texts_short_description_twr2_rome_barbarian_Horse_pens_short"	"The noble horse has much to teach us."	"True"
"building_short_description_texts_short_description_rome_market_settlement"	"Wine breeds friendship, just as grain brings profit."	"True"
"building_short_description_texts_short_description_twr2_rome_egypt_Great_library_short"	"As an archive and centre of learning, nothing rivals the Great Library."	"True"
"building_short_description_texts_short_description_pirates_illyrian_shrine_vidasus_short"	"Vidasus provides for those who honour him."	"True"
"building_short_description_texts_short_description_pun_iberian_Grove_Nabia_short"	"A bubbling brook travels where it is needed…"	"True"
"building_short_description_texts_short_description_pirates_illyrian_shrine_armatus_short"	"Armatus delights in war and blood."	"True"
"building_short_description_texts_short_description_inv_etr_main_agriculture_10_food_short"	"The fields here can feed thousands of families."	"True"
"building_short_description_texts_short_description_twr2_rome_rome_Amphora_Factory_short"	"One measure of wine is good, so how much better ten thousand\?"	"True"
"building_short_description_texts_short_description_twr2_rome_rome_Town_short"	"Wherever there is a town, there is the Roman world."	"True"
"building_short_description_texts_short_description_twr2_rome_rome_Delicatessen_short"	"Where would a Roman be without the finer things in life to adorn his dinner table\?"	"True"
"building_short_description_texts_short_description_twr2_rome_barbarian_Cattle_ranch_short"	"Much can be learnt about a man from his bulls."	"True"
"building_short_description_texts_short_description_twr2_rome_barbarian_Great_fair_short"	"Goods from the furthest reaches come to many shores."	"True"
"building_short_description_texts_short_description_twr2_rome_greek_Siege_engineers_workshop_short"	"All generals use siege weapons to break the enemy's will."	"True"
"building_short_description_texts_short_description_east_wrestling_field"	"A place for the people to gather and enjoy a test of physical skill."	"True"
"building_short_description_texts_short_description_twr2_rome_carthage_Precinct_of_Kore"	"Only Kore's initiates understand. It has to be that way."	"True"
"building_short_description_texts_short_description_wine_master_winemaker"	"A master vintner reserves the finest grapes. The rest are left for the masses."	"True"
"building_short_description_texts_short_description_twr2_rome_egypt_Precinct_of_zeus_ammon_short"	"Zeus Ammon, the father of Alexander the Great, looks after his faithful followers."	"True"
"building_short_description_texts_short_description_twr2_rome_greek_Emporion_short"	"If something cannot be bought or sold here, no one wants it!"	"True"
"building_short_description_texts_short_description_twr2_rome_eastern_Nobles_quarter_short"	"Nobility should buy its privileges with unflinching service in war."	"True"
"building_short_description_texts_short_description_twr2_rome_greek_Brick_dryer_short"	"Large scale sun-drying needs entire fields, not just brickyards."	"True"
"building_short_description_texts_short_description_twr2_rome_egypt_Cattle_pens_short"	"Cattle and oxen must be held somewhere before slaughter."	"True"
"building_short_description_texts_short_description_gaul_roman_stone_cutter_short"	"Dressed stone, shaped and prepared for construction on site."	"True"
"building_short_description_texts_short_description_dk_all_city_5_short"	"The jewel of the desert."	"True"
"building_short_description_texts_short_description_inv_etr_main_religion_tinia_10_short"	"There is wisdom to be found in the cosmic thunderbolts."	"True"
"building_short_description_texts_short_description_twr2_rome_italic_sheep_short"	"Allowed to graze freely, sheep provide good meat and wool."	"True"
"building_short_description_texts_short_description_twr2_rome_eastern_Nisean_stables_short"	"There are princes, even among horses."	"True"
"building_short_description_texts_short_description_twr2_rome_greek_Temple_of_athena_short"	"Athena grants wisdom, military strategy, and courage in battle to the faithful."	"True"
"building_short_description_texts_short_description_twr2_rome_greek_Subterrain_aqueduct_short"	"Water is the lifeblood of the land, moving unseen."	"True"
"building_short_description_texts_short_description_twr2_rome_celts_Shrine_of_nodens_short"	"Those who honour Nodens will never go hungry."	"True"
"building_short_description_texts_short_description_inv_greek_syracuse_mercenary_5"	"To the largest purse, the strongest sword!"	"True"
"building_short_description_texts_short_description_twr2_rome_celts_Sanctuary_of_rosmerta_short"	"Rosmerta provides for the weary traveller."	"True"
"building_short_description_texts_short_description_twr2_rome_eastern_Adobe_maker_short"	"Simple clay makes greatness possible."	"True"
"building_short_description_texts_short_description_3c_palmyra_citycentre_GreatColonnade"	"The spine of the magnificent beast that is Palmyra; the colonnade is awe-inspiring."	"True"
"building_short_description_texts_short_description_twr2_rome_rome_Doctor_Saggitariorum_short"	"Skill can be passed on, but what of the master's feel for bow, breeze, and arrow\?"	"True"
"building_short_description_texts_short_description_gaul_roman_shaft_mine_short"	"Galleries and shafts to access valuable mineral and metal deposits."	"True"
"building_short_description_texts_short_description_pel_preservation_room"	"Salting or smoking meat and fish ensures we will live through the harsh winter ahead."	"True"
"building_short_description_texts_short_description_twr2_rome_egypt_Mouseion_short"	"The Muses guide the hands and thoughts of those who look for beauty and wisdom."	"True"
"building_short_description_texts_short_description_twr2_rome_rome_Port_short"	"A port is a gateway to the world of trade and military adventure."	"True"
"building_short_description_texts_short_description_twr2_rome_greek_Armourer_short"	"The armourer is remembered every time a blow is turned aside."	"True"
"building_short_description_texts_short_description_twr2_rome_rome_Temple_of_Mercury_short"	"The wing-footed messenger of the gods should be given his due honours."	"True"
"building_short_description_texts_short_description_twr2_rome_greek_Training_field_short"	"Drilled and disciplined, soldiers are only as good as their training."	"True"
"building_short_description_texts_short_description_twr2_rome_barbarian_Souterrain_short"	"The depths of the earth are a safe place to store food."	"True"
"building_short_description_texts_short_description_inv_gre_city_5"	"The enlightment shines brighter than a thousand suns."	"True"
"building_short_description_texts_short_description_inv_gre_major_city_5"	"Enlightment shines brighter than a thousand suns."	"True"
"building_short_description_texts_short_description_twr2_rome_barbarian_Village_short"	"The village is the heart of the people."	"True"
"building_short_description_texts_short_description_twr2_rome_eastern_Animal_breeder_short"	"Trade and war both demand the right animals."	"True"
"building_short_description_texts_short_description_3c_palmyra_religious_AltarBaalshamin"	"Believers come from far and wide to utter prayers to the Great One."	"True"
"building_short_description_texts_short_description_twr2_rome_rome_Cattle_Ranch_short"	"The demand for meat can be met by turning over land to cattle."	"True"
"building_short_description_texts_short_description_twr2_rome_eastern_Craftmans_quarter_short"	"Cunning makes many things, both beautiful and dangerous."	"True"
"building_short_description_texts_short_description_twr2_rome_greek_Hieron_ton_megalon_theon_short"	"The old mysteries should never be ignored."	"True"
"building_short_description_texts_short_description_twr2_rome_barbarian_Commons_short"	"A little common ground is vital in any settlement."	"True"
"building_short_description_texts_short_description_dk_afr_grain_3_short"	"A beehive, buzzing with activity, where the grain merchants ply their trade."	"True"
"building_short_description_texts_short_description_pel_temple_hephaestus"	"The volcanic Hephaestus inspires burning creativity in men."	"True"
"building_short_description_texts_short_description_twr2_rome_rome_Combat_Posts_short"	"Strength in battle does not come without effort and sacrifice."	"True"
"building_short_description_texts_short_description_twr2_rome_eastern_Light_horse_studs_short"	"Swift horses for light cavalry to harry and chase the enemy."	"True"
"building_short_description_texts_short_description_twr2_rome_barbarian_Bronze_forge_short"	"A warrior needs a weapon he can rely on."	"True"
"building_short_description_texts_short_description_twr2_rome_barbarian_Well_short"	"From beneath the ground comes life giving water."	"True"
"building_short_description_texts_short_description_twr2_rome_barbarian_Slave_trader_short"	"Captives are the spoils of war."	"True"
"building_short_description_texts_short_description_twr2_rome_greek_Fishmongers_short"	"A fresh catch gets a good price in both town and city."	"True"
"building_short_description_texts_short_description_twr2_rome_greek_Shrine_of_hermes_short"	"Hermes protects those who travel far, and those athletes who run quickly!"	"True"
"building_short_description_texts_short_description_east_marksmens_range"	"The sound of drawing bows is the enemy's funeral dirge."	"True"
"building_short_description_texts_short_description_amber_shore"	"The sun sheds its golden tears into the ocean."	"True"
"building_short_description_texts_short_description_gaul_barbarian_quarry_short"	"Open-air and fire-setting to wrest materials from the earth."	"True"
"building_short_description_texts_short_description_twr2_rome_greek_Herding_ground_short"	"Animals are prized for their milk, hides and wool as well as their meat."	"True"
"building_short_description_texts_short_description_twr2_rome_greek_Royal_barracks_short"	"The training and quartering of elite troops requires the proper surroundings."	"True"
"building_short_description_texts_short_description_twr2_rome_germanic_Shrine_of_Austro_short"	"Those who honour Austro do not fear the harsh winter."	"True"
"building_short_description_texts_short_description_3c_barb_religious_GroveGaut"	"The Gothi's great ancestor always aids his children."	"True"
"building_short_description_texts_short_description_twr2_rome_celts_Sanctuary_of_gobannus_short"	"Gobannus, lord of fire and iron, is honoured by all who need metal."	"True"
"building_short_description_texts_short_description_twr2_rome_eastern_Weaponsmith_short"	"Battle is the test of quality."	"True"
"building_short_description_texts_short_description_twr2_rome_germanic_Shrine_of_thunaraz_short"	"Those who work the fields would do well to honour Thunaraz."	"True"
"building_short_description_texts_short_description_gaul_roman_sluiced_mine_short"	"Water flushed from tanks or reservoirs reveals rich ore veins."	"True"
"building_short_description_texts_short_description_gaul_civilised_quarry_short"	"Vast quarries, providing the raw materials to build and expand."	"True"
"building_short_description_texts_short_description_twr2_rome_carthage_Temple_of_baal_hammon_short"	"Honour the god of the sky, and accept Ba'al's blessings in return."	"True"
"building_short_description_texts_short_description_twr2_rome_rome_Shrine_of_Neptune_short"	"Neptune, god of the sea, helps all sailors who properly honour him."	"True"
"building_short_description_texts_short_description_twr2_rome_barbarian_Port_short"	"The landlubber finds sea legs in the same place as gold and glory."	"True"
"building_short_description_texts_short_description_twr2_rome_barbarian_Woodworker_short"	"The trees provide much for those who know their secrets."	"True"
"building_short_description_texts_short_description_wine_winemaker"	"Even a poor wine can be improved with a little art."	"True"
"building_short_description_texts_short_description_twr2_rome_grove_kerres_short"	"An altar to Kerres, goddess of nature and mother of the people."	"True"
"building_short_description_texts_short_description_3c_barb_religious_OakTeiws"	"The humming whisper of a thousand long-dead warriors whirls around the ancient tree."	"True"
"building_short_description_texts_short_description_twr2_rome_rome_Amphitheatre_short"	"A good death met with dignity shows the virtues of a proper Roman life."	"True"
"building_short_description_texts_short_description_pirates_dacian_shrine_pleistoros_short"	"The brave shall heed the call of Pleistoros."	"True"
"building_short_description_texts_short_description_twr2_rome_barbarian_Bronze_workshop_short"	"Skilled metalsmiths make the deadliest weapons."	"True"
"building_short_description_texts_short_description_pel_goat_ranch"	"Goats are simple, and unassuming, but they provide a living."	"True"
"building_short_description_texts_short_description_pirates_thracian_shrine_cabeiri_short"	"Flames of the furnace, and fires of passion, both alight in Cabeiri."	"True"
"building_short_description_texts_short_description_twr2_rome_rome_Forum_Vinarium_short"	"Grapes grow everywhere, but wine flows only where it is bought."	"True"
"building_short_description_texts_short_description_twr2_rome_dlc_nomadic_Wagon_Camp_short"	"The people travel as one, and fight as one."	"True"
"building_short_description_texts_short_description_twr2_rome_greek_Travellers_lodge_short"	"Inns, or pandocheion, cater to the needs of weary travellers."	"True"
"building_short_description_texts_short_description_pirates_dacian_shrine_gebeleizis_short"	"Pray to the storm god, lest you be swept away."	"True"
"building_short_description_texts_short_description_twr2_rome_dlc_nomadic_Grove_of_Papaios_short"	"The father's wisdom is never wasted."	"True"
"building_short_description_texts_short_description_twr2_rome_greek_Temple_of_hermes_short"	"Many, particularly traders and thieves, should ask Hermes for his protection."	"True"
"building_short_description_texts_short_description_twr2_rome_barbarian_Brine_distiller_short"	"The mighty ocean provides more than fish."	"True"
"building_short_description_texts_short_description_olive_grove"	"Athena's gift to us all."	"True"
"building_short_description_texts_short_description_twr2_rome_eastern_Farm_estate_short"	"From abundance comes wealth."	"True"
"building_short_description_texts_short_description_pirates_illyrian_shrine_bindus_short"	"A wise seaman offers homage to mighty Bindus."	"True"
"building_short_description_texts_short_description_twr2_rome_carthage_Precinct_of_astarte_short"	"All should give deserved praise to the Evening Star."	"True"
"building_short_description_texts_short_description_twr2_rome_carthage_Shrine_of_baal_hammon_short"	"Ba'al's shrines are open to the sky, and do him honour."	"True"
"building_short_description_texts_short_description_twr2_rome_rome_Temple_of_Neptune_short"	"All water flows from Neptune, especially when he is given due deference."	"True"
"building_short_description_texts_short_description_3c_palmyra_religious_TempleBaalshamin"	"The halls are kept cool by the breath of Baalshamin himself."	"True"
"building_short_description_texts_short_description_twr2_rome_barbarian_Hundred_short"	"Stout walls keep out many unwanted visitors."	"True"
