"building_short_description_texts_short_description_twr2_rome_carthage_Temple_of_tanit_short"	"The worship of the mother goddess, beloved of her people, brings bounty to a settlement."	"True"
"building_short_description_texts_short_description_twr2_rome_shrine_kerres_short"	"The blessed Kerres protects and nurtures her followers."	"True"
"building_short_description_texts_short_description_twr2_rome_eastern_Blacksmith_short"	"The world is hammered into shape on many forges."	"True"
"building_short_description_texts_short_description_amber_road"	"Why trade in slaves when amber is worth more than flesh\?"	"True"
"building_short_description_texts_short_description_twr2_rome_carthage_Hadast_short"	"The city is the heart of the Carthaginian people, their religion and trade."	"True"
"building_short_description_texts_short_description_twr2_rome_barbarian_Iron_workshop_short"	"The strength of iron makes fine weapons."	"True"
"building_short_description_texts_short_description_pel_shrine"	"The power of a god, held within its image."	"True"
"building_short_description_texts_short_description_twr2_rome_rome_Practice_Castrum_short"	"A soldier needs more than skill with the blade. The shovel is important too."	"True"
"building_short_description_texts_short_description_twr2_rome_greek_Hippeis_stables_short"	"Men able to afford and stable horses still need training in the arts of war."	"True"
"building_short_description_texts_short_description_twr2_rome_dlc_nomadic_Sanctuary_of_Agin_short"	"Honour the war god with the blood of your enemies!"	"True"
"building_short_description_texts_short_description_black_sea_greek_water_asclepius_4"	"Panacea for all, be they men, gods or kings."	"True"
"building_short_description_texts_short_description_black_sea_greek_water_asclepius_3"	"In your dreams, Asclepius heals your body and mind."	"True"
"building_short_description_texts_short_description_pun_iberian_Sanctuary_Bandua_short"	"If we hold our oath to Bandua, she will do her part."	"True"
"building_short_description_texts_short_description_pirates_illyrian_sanctuary_medaurus_short"	"May his lance protect those who honour his name."	"True"
"building_short_description_texts_short_description_twr2_rome_eastern_Arabaya_stables_short"	"The finest battle steeds require special attention."	"True"
"building_short_description_texts_short_description_gaul_civilised_trench_mine_short"	"Large scale, open-air mining, cutting through hills and valleys."	"True"
"building_short_description_texts_short_description_twr2_rome_dlc_nomadic_Sanctuary_of_Tabiti_short"	"Look to the goddess in times of danger! Preserve your homes and families."	"True"
"building_short_description_texts_short_description_twr2_rome_barbarian_Storage_pit_short"	"A full belly is most welcome in the depths of winter."	"True"
"building_short_description_texts_short_description_twr2_rome_celts_Shrine_of_gobannus_short"	"Strong arms need strong weapons."	"True"
"building_short_description_texts_short_description_twr2_rome_eastern_Cavalry_stables_short"	"Fleet horses outpace and outmanoeuvre the enemy."	"True"
"building_short_description_texts_short_description_greek_silver_mint"	"Croesus himself would have envied such production."	"True"
"building_short_description_texts_short_description_pun_iberian_Shrine_Ataegina_short"	"The shrine comes alive with the new season, as if the goddess herself were reborn…"	"True"
"building_short_description_texts_short_description_3c_rom_navalbuff_SailorsQuarters"	"A place to rest after the rigours of the sea."	"True"
"building_short_description_texts_short_description_pirates_thracian_altar_zibelthiurdos_short"	"With thunder and lightning, Zibelthiurdos makes known his will."	"True"
"building_short_description_texts_short_description_twr2_rome_dlc_nomadic_Weaver_short"	"Honest homespun is better than the finest foreign robes."	"True"
"building_short_description_texts_short_description_twr2_rome_eastern_Danesgah_short"	"The wisdom of the kings and their advisors must be preserved for all."	"True"
"building_short_description_texts_short_description_twr2_rome_rome_Range_short"	"Arrows do not shoot themselves, nor rocks hurl themselves at the enemy."	"True"
"building_short_description_texts_short_description_twr2_rome_rome_Fire_Watch_short"	"A wise man watches for wolves in the wilds, and fires in the city."	"True"
"building_short_description_texts_short_description_iron_shieldmaker"	"A good shield defends. An excellent shield is a weapon in itself."	"True"
"building_short_description_texts_short_description_twr2_rome_greek_Irrigation_ditches_short"	"Water increases crop production, and improves the soil."	"True"
"building_short_description_texts_short_description_twr2_rome_rome_Scriptorium_short"	"A book copied is a civilisation strengthened."	"True"
"building_short_description_texts_short_description_greek_farming_town"	"A profitable surplus is the work of many hands."	"True"
"building_short_description_texts_short_description_pirates_dacian_grove_bendis_short"	"Power is not striking hard or often, but striking true."	"True"
"building_short_description_texts_short_description_gold_shaft_mine"	"Rich veins of ore can be accessed via deep tunnels and shafts."	"True"
"building_short_description_texts_short_description_pun_iberian_Grove_Ataegina_short"	"Far away from the bustle of men's lives, a tranquil place to pray for the land."	"True"
"building_short_description_texts_short_description_greek_storage_room"	"A place for mercantile activity as well as grain storage."	"True"
"building_short_description_texts_short_description_twr2_rome_dlc_nomadic_Shrine_of_Agrimpasa_short"	"The human spirit is nourished by love, as well as honesty."	"True"
"building_short_description_texts_short_description_twr2_rome_rome_Basilica_Equestris_short"	"Horsemanship and status are intertwined; the common man walks."	"True"
"building_short_description_texts_short_description_east_trade_town"	"A bustling hotspot, alive with the hoots of water-sellers and camel traders."	"True"
"building_short_description_texts_short_description_twr2_rome_carthage_Gardens_short"	"In the stone heart of the city an oasis is always welcome."	"True"
"building_short_description_texts_short_description_inv_rom_city_center_inn_3"	"Inns cater to the needs of weary travellers."	"True"
"building_short_description_texts_short_description_dk_all_agriculture_granary"	"A wise man prepares for a poor harvest and dry weather."	"True"
"building_short_description_texts_short_description_pel_temple"	"Look upon the faces of the gods and feel dwarfed by their majesty."	"True"
"building_short_description_texts_short_description_twr2_rome_barbarian_Bardic_circle_short"	"Through song and poetry the glorious dead are honoured."	"True"
"building_short_description_texts_short_description_east_grain_silo"	"A tall silo and libations to the rat god ensure bountiful grain supplies."	"True"
"building_short_description_texts_short_description_twr2_rome_barbarian_Bronze_furnace_short"	"Fire destroys but it can also create."	"True"
"building_short_description_texts_short_description_twr2_rome_carthage_Shrine_of_tanit_short"	"Tanit is the consort of Ba'al, and the mother of Carthaginians."	"True"
"building_short_description_texts_short_description_twr2_rome_rome_Cattle_Trader_short"	"The easiest way of keeping meat fresh is to keep it alive."	"True"
"building_short_description_texts_short_description_twr2_rome_eastern_Small_town_short"	"A thriving community with trade to attract new settlers."	"True"
"building_short_description_texts_short_description_twr2_rome_celts_Sanctuary_of_tuotatis"	"The protection of the gods always has a price."	"True"
"building_short_description_texts_short_description_inv_ven_sanctuary_diomedes"	"The white stallion heads towards the eternal pastures."	"True"
"building_short_description_texts_short_description_all_mine"	"The extraction of useful metals directly powers an empire."	"True"
"building_short_description_texts_short_description_twr2_rome_rome_Consecrated_Ground_short"	"Tread carefully all who enter here."	"True"
"building_short_description_texts_short_description_twr2_rome_barbarian_Enclosed_land_short"	"The creature that does not wander is safe."	"True"
"building_short_description_texts_short_description_barb_trumpet_maker"	"On the battlefield, a trumpet is the general’s only voice."	"True"
"building_short_description_texts_short_description_twr2_rome_eastern_Fountain_short"	"Water, in abundance, brings joy as well as life."	"True"
"building_short_description_texts_short_description_east_mint"	"Where the golden blood of empire is forged."	"True"
"building_short_description_texts_short_description_pirates_thracian_sanctuary_sabazios_short"	"This Thracian hero rides on horseback, brandishing his staff of power."	"True"
"building_short_description_texts_short_description_twr2_rome_greek_Nymphaion_short"	"Here are the answers to many questions for those who listen, and respect the trees…"	"True"
"building_short_description_texts_short_description_gaul_carthage_quarry_short"	"Raw materials with which to build and trade."	"True"
"building_short_description_texts_short_description_east_chapa_khaneh"	"A world without tax is a world without order."	"True"
"building_short_description_texts_short_description_lead_sluiced_mine"	"Water reveals what stone conceals."	"True"
"building_short_description_texts_short_description_gold_sluiced_mine"	"Controlling the flow of water scours the soil to reveal ore deposits."	"True"
"building_short_description_texts_short_description_inv_ven_sanctuary_reitia"	"Reitia helps those who listen to her wisdom, and honour her correctly."	"True"
"building_short_description_texts_short_description_twr2_rome_barbarian_Clay_pit_short"	"Many beautiful items can be made from simple clay."	"True"
"building_short_description_texts_short_description_twr2_rome_carthage_Precinct_of_tanit_short"	"'The Great Mother' blesses her followers according to their worth."	"True"
"building_short_description_texts_short_description_3c_barb_religious_GroveFairguneis"	"The god of thunder is a mighty ally in battle."	"True"
"building_short_description_texts_short_description_twr2_rome_italic_sanctuary_mamers_short"	"Honouring Mamers brings a martial spirit to the tribes."	"True"
"building_short_description_texts_short_description_twr2_rome_rome_Veterinary_short"	"Sensible care of valuable animals saves much effort and money."	"True"
"building_short_description_texts_short_description_twr2_rome_rome_Basilica_of_Vulcan_short"	"Honouring Vulcan brings his favour to smiths and craftsmen."	"True"
"building_short_description_texts_short_description_twr2_rome_greek_Wine_shop_short"	"Much of what is wrong with life can be cured by good wine."	"True"
"building_short_description_texts_short_description_twr2_rome_rome_Villa_short"	"Nothing enriches the land quite as well as its master’s eye."	"True"
"building_short_description_texts_short_description_leather_workshop"	"Good, hardened leather can turn a blow and keep a man from death."	"True"
"building_short_description_texts_short_description_twr2_rome_greek_Homestead_short"	"The land breeds men fit for the fight: strong of arm and will."	"True"
"building_short_description_texts_short_description_twr2_rome_germanic_Sanctuary_of_wodanaz_short"	"The knowledge of the gods will be revealed to the pure of heart."	"True"
"building_short_description_texts_short_description_twr2_rome_eastern_Military_pier_short"	"Where warships gather, and armies embark for conquest and spoils."	"True"
"building_short_description_texts_short_description_twr2_rome_dlc_nomadic_Flock_of_Sheep_short"	"Shepherds become like sheep, and sheep the shepherds."	"True"
"building_short_description_texts_short_description_pirates_illyrian_sanctuary_anzotica_short"	"The summit of beauty and love. Anzotica is her name."	"True"
"building_short_description_texts_short_description_pirates_dacian_grove_kotys_short"	"The god of slaughter, born of blood and battle."	"True"
"building_short_description_texts_short_description_pun_iberian_Sanctuary_Neto_short"	"The glory of a victorious war, made real."	"True"
"building_short_description_texts_short_description_pel_trader"	"Everything, and everyone, has a price."	"True"
"building_short_description_texts_short_description_twr2_rome_carthage_Arboretum_short"	"The wealthy and the elite are entitled to their perfect gardens."	"True"
"building_short_description_texts_short_description_twr2_rome_rome_Docks_short"	"Trade is the lifeblood of an empire, even more than military might."	"True"
"building_short_description_texts_short_description_black_sea_greek_city_centre_library_5_pergamon"	"Behold! The greatest library in the world! Almost…"	"True"
"building_short_description_texts_short_description_twr2_rome_barbarian_Warlords_hold_short"	"With great power comes great responsibility."	"True"
"building_short_description_texts_short_description_rome_auditorium"	"Painstaking geometric design produces flawless acoustics."	"True"
"building_short_description_texts_short_description_twr2_rome_greek_Shrine_of_poseidon_short"	"Only a fool goes to sea without the blessings of Poseidon, lord of the deep."	"True"
"building_short_description_texts_short_description_twr2_rome_eastern_Fire_alter_short"	"The purity of fire warms the spirit and the heart."	"True"
"building_short_description_texts_short_description_inv_etr_main_military_recruitment_10_short"	"Laran watches over our warriors and keeps them safe during times of war."	"True"
"building_short_description_texts_short_description_east_weaving_house"	"To the wise, a clacking loom is the same as a clinking purse."	"True"
"building_short_description_texts_short_description_pirates_illyrian_sanctuary_armatus_short"	"Armatus protects the brave and true."	"True"
"building_short_description_texts_short_description_twr2_rome_rome_Municipium_short"	"A growing town reflects the prosperity and loyalty of a province."	"True"
"building_short_description_texts_short_description_pirates_illyrian_sanctuary_vidasus_short"	"Those who honour Vidasus never hunger."	"True"
"building_short_description_texts_short_description_twr2_rome_barbarian_Builders_hall_short"	"Great engines of war are crafted from strong oaks."	"True"
"building_short_description_texts_short_description_twr2_rome_greek_Amphora_factory_short"	"Amphorae are needed in huge numbers to carry goods across the world."	"True"
"building_short_description_texts_short_description_twr2_rome_eastern_Slave_auctioneer_short"	"The world is carried on backs sold to the highest bidder."	"True"
"building_short_description_texts_short_description_olive_mola_olieria"	"The application of science can turn a farm into a factory."	"True"
"building_short_description_texts_short_description_twr2_rome_eastern_Hamspah_barracks_short"	"A permanent garrison gives the safety needed for growth and trade."	"True"
"building_short_description_texts_short_description_inv_etr_main_administration_growth_10"	"Behold! The greatest library in the world! Almost…"	"True"
"building_short_description_texts_short_description_twr2_rome_germanic_Grove_of_Austro_short"	"Austro! As bright as the dawn; as beautiful as spring!"	"True"
"building_short_description_texts_short_description_twr2_rome_rome_Slums_short"	"The downfall of every empire begins here."	"True"
"building_short_description_texts_short_description_twr2_rome_dlc_nomadic_Shrine_of_Agin_short"	"Through the sacrifice of prisoners, the war god gains strength."	"True"
"building_short_description_texts_short_description_twr2_rome_eastern_Yakhchal_short"	"A domed storage building, cooled by water evaporation."	"True"
"building_short_description_texts_short_description_twr2_rome_dlc_nomadic_Yurt_Maker_short"	"Flaps should always face away from the wind."	"True"
"building_short_description_texts_short_description_twr2_rome_rome_Fishing_Port_short"	"Fish are always good, but fish sauce is more welcome still to a good Roman!"	"True"
"building_short_description_texts_short_description_twr2_rome_rome_Tile_Factory_short"	"Bricks and mortar last longer than political ambitions."	"True"
"building_short_description_texts_short_description_rome_horrerum"	"Behind every empire and hungry army there is a granary."	"True"
"building_short_description_texts_short_description_twr2_rome_rome_Shrine_of_Mars_short"	"Behold the god of war marches before us!"	"True"
"building_short_description_texts_short_description_twr2_rome_egypt_Precinct_of_serapis_short"	"Serapis, god of Egyptians and Greeks, gives his blessings to all equally."	"True"
"building_short_description_texts_short_description_pirates_dacian_high_kings_hold"	"A hold and hall fit for a king above all others."	"True"
"building_short_description_texts_short_description_pirates_illyrian_shrine_medaurus_short"	"A swift steed brings joy to Medaurus."	"True"
"building_short_description_texts_short_description_twr2_rome_eastern_Spice_market_short"	"The spice must flow."	"True"
"building_short_description_texts_short_description_twr2_rome_greek_Temple_of_zeus_short"	"'The Thunderer' should be properly honoured by all mortal men."	"True"
"building_short_description_texts_short_description_twr2_rome_greek_Ranch_short"	"Great herds of sheep, goats and cattle drive out simple farmers."	"True"
"building_short_description_texts_short_description_twr2_rome_greek_Range_short"	"Skill with bow, sling or javelin comes only through constant practice."	"True"
"building_short_description_texts_short_description_twr2_rome_germanic_Sanctuary_of_frijjo_short"	"Lady Frijjo, beauty of the gods and protector of the home!"	"True"
"building_short_description_texts_short_description_twr2_rome_germanic_Sanctuary_of_teiwaz_short"	"Teiwaz strengthens the hearts of the brave and true."	"True"
"building_short_description_texts_short_description_pirates_thracian_sanctuary_zibelthiurdos_short"	"Death is the sound of distant thunder."	"True"
"building_short_description_texts_short_description_twr2_rome_eastern_Siege_workshop_short"	"Cunning and forethought can breach enemy walls."	"True"
"building_short_description_texts_short_description_rome_theatre"	"Most places stock goods, but the theatre sells emotion."	"True"
"building_short_description_texts_short_description_pun_iberian_Grove_Endovelicus_short"	"A quiet space to give praise and find peace in the shade of the protector."	"True"
"building_short_description_texts_short_description_greek_jeweller"	"Noblewomen bicker over his gems like the Graeae fighting for the eye."	"True"
"building_short_description_texts_short_description_twr2_rome_eastern_Farm_short"	"The humble farmer carries everyone on his back."	"True"
"building_short_description_texts_short_description_east_herding_estate"	"A large herd of livestock estate is pure gold. Walking, breeding gold."	"True"
"building_short_description_texts_short_description_marble_quarry"	"A good quarrymaster gleans the balance between quality and quantity."	"True"
"building_short_description_texts_short_description_barb_proving_ground"	"A proficient warrior bears scars before his first battle has begun."	"True"
"building_short_description_texts_short_description_inv_rom_roma"	"The eternal city."	"True"
"building_short_description_texts_short_description_twr2_rome_dlc_nomadic_Sanctuary_of_Goitosyros_short"	"Speak truth, and truth alone, in the service of Goitosyros."	"True"
"building_short_description_texts_short_description_all_pit_mine"	"Quarries provide the raw materials with which to build and expand."	"True"
"building_short_description_texts_short_description_3c_barb_religious_ShrineGaut"	"Honour his memory and you honour your people."	"True"
"building_short_description_texts_short_description_pirates_thracian_altar_sabazios_short"	"God in the sky, temple on earth."	"True"
"building_short_description_texts_short_description_pel_mousaion"	"A repository of information; everything the Muses teach us, laid down."	"True"
"building_short_description_texts_short_description_twr2_rome_dlc_nomadic_Grove_of_Agrimpasa_short"	"Blessed are the followers of Agrimpasa, for they have the love of the goddess."	"True"
"building_short_description_texts_short_description_twr2_rome_egypt_Precinct_of_hathor_and_maat_short"	"Honour, by your devotions, the goddesses Hathor and Maat."	"True"
"building_short_description_texts_short_description_twr2_rome_dlc_nomadic_Consecrated_Ground_short"	"There is power in a place the gods have touched."	"True"
"building_short_description_texts_short_description_twr2_rome_rome_Village_short"	"Beyond the grandeur, the Roman world is one of villages, not great cities."	"True"
"building_short_description_texts_short_description_twr2_rome_greek_Odeon_short"	"Music and poetry should have a home in a civilised city."	"True"
"building_short_description_texts_short_description_twr2_rome_barbarian_Goldsmith_short"	"The beauty of gold is more than its worth."	"True"
"building_short_description_texts_short_description_iron_armourer"	"Mail, segmentata, cuirass: each has its strength, and each its weakness."	"True"
"building_short_description_texts_short_description_pirates_dacian_grove_derzerlas_short"	"Cornucopia in hand, Derzelas nourishes us all."	"True"
"building_short_description_texts_short_description_twr2_rome_eastern_Levy_camp_short"	"Where levied citizens and subjects muster, and train to become soldiers."	"True"
"building_short_description_texts_short_description_black_sea_trade_centre"	"A bustling hub of activity and commerce."	"True"
"building_short_description_texts_short_description_twr2_rome_greek_Shrine_of_ares_short"	"Those wanting success in war would do well to honour Ares."	"True"
"building_short_description_texts_short_description_grain_estate"	"Conquest and politics are not the only routes to wealth and power."	"True"
"building_short_description_texts_short_description_twr2_rome_eastern_City_short"	"The city is the heart of a people, and the birthing place of civilisation."	"True"
"building_short_description_texts_short_description_twr2_rome_rome_Forum_Piscarium_short"	"The bounty of Neptune's depths feeds both gourmets and gutter-trash."	"True"
"building_short_description_texts_short_description_marble_cutter"	"It takes years of apprenticeship to perfect the art of stonemasonry."	"True"
"building_short_description_texts_short_description_dk_saba_camel_2_short"	"A camel is a bizarre beast, yet has its advantages in battle."	"True"
"building_short_description_texts_short_description_dk_saba_camel_3_short"	"Few animals are as ideally suited to the desert life as the camel."	"True"
"building_short_description_texts_short_description_dk_saba_camel_4_short"	"Camel's unpredictability gives them an edge."	"True"
"building_short_description_texts_short_description_east_granary"	"A splendid granary is the true temple of Mithra."	"True"
"building_short_description_texts_short_description_horse_trainer"	"Only a horse is worth more broken."	"True"
"building_short_description_texts_short_description_amber_trader"	"“A cure for age and madness, no less!”"	"True"
"building_short_description_texts_short_description_horse_breeder"	"Without selective breeding, heavy cavalry would not exist."	"True"
"building_short_description_texts_short_description_east_trade_settlement"	"Local traders are the first pillar of any community."	"True"
"building_short_description_texts_short_description_twr2_rome_rome_Training_Field_short"	"Drill should be a bloodless battle."	"True"
"building_short_description_texts_short_description_twr2_rome_rome_Colonia_short"	"A colonia, no matter how small, is a new Rome rendered in bricks and mortar."	"True"
"building_short_description_texts_short_description_twr2_rome_germanic_Grove_of_wodanaz_short"	"Hail Wodanaz! Bringer of knowledge and wisdom!"	"True"
"building_short_description_texts_short_description_greek_granary"	"A splendid granary is the true temple of Demeter."	"True"
"building_short_description_texts_short_description_twr2_rome_greek_Agora_short"	"The agora is a place of politics, religion and trade."	"True"
"building_short_description_texts_short_description_inv_etr_main_religion_tinia_7_short"	"Revere Tinia, god of thunder."	"True"
"building_short_description_texts_short_description_inv_etr_main_religion_tinia_8_short"	"'The Thunderer' should be properly honoured by all mortal men."	"True"
"building_short_description_texts_short_description_inv_etr_main_religion_tinia_9_short"	"Tinia protects all his followers."	"True"
"building_short_description_texts_short_description_twr2_rome_eastern_Trading_port_short"	"A bustling centre of trade moving goods from east and west."	"True"
"building_short_description_texts_short_description_twr2_rome_egypt_Precinct_of_isis_short"	"The blessed Isis protects and nurtures her true followers."	"True"
"building_short_description_texts_short_description_twr2_rome_eastern_Satraps_palace_short"	"The satrap speaks in the king's voice; lesser men listen carefully."	"True"
"building_short_description_texts_short_description_pirates_thracian_shrine_dionysus_short"	"Perhaps a touch more of the shine, my dear\?"	"True"
"building_short_description_texts_short_description_twr2_rome_eastern_Dakhma_short"	"The dead must not sully earth, fire or water."	"True"
"building_short_description_texts_short_description_pirates_dacian_sanctuary_bendis_short"	"May the gods be ever in your favour."	"True"
"building_short_description_texts_short_description_lumber_loggers"	"Give a man an axe, and winter loses its sting."	"True"
"building_short_description_texts_short_description_pirates_illyrian_sanctuary_thana_short"	"She is the queen of all our hearts."	"True"
"building_short_description_texts_short_description_twr2_rome_eastern_Spice_bazaar_short"	"Exotic spices and wonders from afar bring wealth and marvels!"	"True"
"building_short_description_texts_short_description_east_trade_large_town"	"In the greatest bazaars, anything can be bought... and it's a seller's market."	"True"
