"building_short_description_texts_short_description_dk_kush_hunters_2_short"	"In touch with the ground. On the hunt."	"True"
"building_short_description_texts_short_description_dk_kush_hunters_3_short"	"We are the hunters, not the hunted."	"True"
"building_short_description_texts_short_description_dk_kush_hunters_4_short"	"The hunter takes his prey, the law of the nature he obeys."	"True"
"building_short_description_texts_short_description_inv_gre_military_polemistes_short"	"There is an art to warfare that requires practice."	"True"
"building_short_description_texts_short_description_twr2_rome_rome_Water_Tank_short"	"A prudent ruler allows for times of shortage in all things, even the simplest."	"True"
"building_short_description_texts_short_description_purple_dye_master_works"	"Only the richest Tyrian purple is worthy of an emperor."	"True"
"building_short_description_texts_short_description_pel_temple_apollo"	"He is the warmth and light of the sun; the truth of what will be."	"True"
"building_short_description_texts_short_description_twr2_rome_barbarian_Fishermen's_huts_short"	"The salmon of wisdom calls to fishermen."	"True"
"building_short_description_texts_short_description_twr2_rome_greek_Grain_market_short"	"Grain feeds the city; well-fed men do their betters' bidding."	"True"
"building_short_description_texts_short_description_twr2_rome_rome_Manipular_Barracks_short"	"Legionaries must be housed and trained, so that they may stand in harm's way."	"True"
"building_short_description_texts_short_description_gaul_civilised_monumental_architect_short"	"Great builders, working for the glory of their gods and people."	"True"
"building_short_description_texts_short_description_twr2_rome_eastern_Wrestling_arena_short"	"The earliest of spectator sports, wrestling is an ancient tradition."	"True"
"building_short_description_texts_short_description_barb_horn_maker"	"May your horn sound the charge but never the retreat."	"True"
"building_short_description_texts_short_description_twr2_rome_egypt_Temple_of_zeus_ammon_short"	"Zeus Ammon is widely revered by Greeks and Egyptians."	"True"
"building_short_description_texts_short_description_twr2_rome_egypt_Shrine_of_horus_short"	"Horus, bringer of the dawn and of wisdom, gives much to the people."	"True"
"building_short_description_texts_short_description_twr2_rome_eastern_Village_short"	"An established village, growing by hard toil and devout effort."	"True"
"building_short_description_texts_short_description_twr2_rome_rome_Brick_Kiln_short"	"Let lesser people, not Romans, build in wood."	"True"
"building_short_description_texts_short_description_twr2_rome_celts_Shrine_of_andaste_short"	"All who seek glory in battle should honour Andraste."	"True"
"building_short_description_texts_short_description_twr2_rome_eastern_Royal_mausoleum_short"	"For great rulers, death is a reminder of greatness."	"True"
"building_short_description_texts_short_description_twr2_rome_dlc_nomadic_Enaree_Tent_short"	"More than a man's fate may be read from the linden tree."	"True"
"building_short_description_texts_short_description_inv_ita_religious_kerres_4_short"	"The worship of the mother, beloved of her people, brings bounty to the tribes."	"True"
"building_short_description_texts_short_description_inv_etr_minor_port_short"	"The sea is a fluid border."	"True"
"building_short_description_texts_short_description_east_master_trader"	"The shrewd trader shares arak and renews old friendships before the purse is opened."	"True"
"building_short_description_texts_short_description_twr2_rome_germanic_Shrine_of_fraujaz_short"	"Those who hope for strong sons honour Fraujaz."	"True"
"building_short_description_texts_short_description_pel_food_warehouse"	"There may be abundance now, but who knows what hardships the gods may send our way\?"	"True"
"building_short_description_texts_short_description_twr2_rome_egypt_Shrine_of_hathor_and_maat_short"	"Joy and love, truth and justice: all are celebrated."	"True"
"building_short_description_texts_short_description_twr2_rome_eastern_Irrigated_farms_short"	"With careful planning water brings abundance."	"True"
"building_short_description_texts_short_description_gaul_roman_quarry_short"	"Raw materials for the advancement and magnificence of Rome."	"True"
"building_short_description_texts_short_description_amber_collector"	"“This gem contains a fly that Achilles swatted at the gates of Troy, you know...”"	"True"
"building_short_description_texts_short_description_twr2_rome_greek_Shrine_of_hephaistos_short"	"Hephaistos is patron of smithing and sculpture, and men do well to honour his works."	"True"
"building_short_description_texts_short_description_twr2_rome_rome_Basilica_of_Mars_short"	"Honouring Mars brings a martial spirit to the city."	"True"
"building_short_description_texts_short_description_inv_ven_religious_diomedes_4_short"	"The white stallion heads towards the eternal pastures."	"True"
"building_short_description_texts_short_description_gaul_civilised_stone_cutter_short"	"Artisans and skilled labourers, working and shaping stone in-situ."	"True"
"building_short_description_texts_short_description_twr2_rome_egypt_Shrine_of_zeus_ammon_short"	"Praise be to Zeus Ammon, father of Alexander."	"True"
"building_short_description_texts_short_description_twr2_rome_greek_Horse_corral_short"	"Regular practice and training conditions both riders and horses for war."	"True"
"building_short_description_texts_short_description_twr2_rome_greek_Skirmisher_camp_short"	"There is an art to skirmishing that requires practice."	"True"
"building_short_description_texts_short_description_twr2_rome_egypt_Temple_of_imhotep_short"	"Give honour to Imhotep, wisest of the wise, and healer of healers!"	"True"
"building_short_description_texts_short_description_gaul_barbarian_sluiced_mine_short"	"Controlling water levels and flow to uncover ore veins."	"True"
"building_short_description_texts_short_description_3c_east_admin_TownGuard"	"A spear and a shield is all it takes to lay criminals low."	"True"
"building_short_description_texts_short_description_3c_east_navalbuff_SailorsTents"	"When you need to quickly gather a crew, even humble quarters will suffice."	"True"
"building_short_description_texts_short_description_3c_rom_admin_Rationalis"	"The river of money flows through this place on its way to the Imperial treasury."	"True"
"building_short_description_texts_short_description_twr2_rome_celts_Sanctuary_of_epona_short"	"The wisdom of Epona is shared with those who do her honour."	"True"
"building_short_description_texts_short_description_twr2_rome_barbarian_Hamlet_short"	"From tiny acorns great oaks grow."	"True"
"building_short_description_texts_short_description_twr2_rome_greek_Blacksmith_short"	"Blacksmiths forged the ancient world, in bronze, iron and steel."	"True"
"building_short_description_texts_short_description_twr2_rome_carthage_Temple_of_melqart_short"	"Merchants and trade flourish where Melqart is honoured."	"True"
"building_short_description_texts_short_description_twr2_rome_egypt_Shrine_of_serapis_short"	"Egyptians and Greeks can worship Serapis in equality."	"True"
"building_short_description_texts_short_description_pirates_illyrian_sanctuary_bindus_short"	"Wind and wave are his to command."	"True"
"building_short_description_texts_short_description_pirates_dacian_sanctuary_zalmoxis_short"	"Oh, Zalmoxis! Receive our messenger, delivered at spearpoint."	"True"
"building_short_description_texts_short_description_inv_etr_minor_town_short"	"Where civilisation is born."	"True"
"building_short_description_texts_short_description_east_canal"	"Where the waters flow, life flourishes."	"True"
"building_short_description_texts_short_description_twr2_rome_barbarian_Canals_short"	"To bend water to our will is a great power indeed."	"True"
"building_short_description_texts_short_description_twr2_rome_greek_Temple_of_hephaistos_short"	"The fire god Hephaistos helps those workers who honour him."	"True"
"building_short_description_texts_short_description_twr2_rome_greek_Kleroukhia_short"	"A shining centre of politics, religion and trade for the people."	"True"
"building_short_description_texts_short_description_twr2_rome_rome_Pantheon_short"	"Pay your respects to all the gods and they shall bless you in return."	"True"
"building_short_description_texts_short_description_barb_carnyx_maker"	"The trumpet is given shape to match its roar."	"True"
"building_short_description_texts_short_description_twr2_rome_egypt_Shrine_of_imhotep_short"	"The worship of Imhotep, Brother of Thoth, is a righteous path to wisdom and healing."	"True"
"building_short_description_texts_short_description_pel_megas_limen"	"From the city walls to the shore and beyond, we extend our power."	"True"
"building_short_description_texts_short_description_twr2_rome_carthage_Shrine_of_melqart_short"	"A shrine to Melqart, the god of trade and the underworld."	"True"
"building_short_description_texts_short_description_twr2_rome_greek_Fishmarket_short"	"Once dried and salted, fish can be traded far and wide."	"True"
"building_short_description_texts_short_description_twr2_rome_rome_Shrine_of_Vulcan_short"	"Fear the might of the fire god dwelling in the heart of the volcano."	"True"
"building_short_description_texts_short_description_twr2_rome_rome_Emporium_short"	"What cannot be bought is not worth buying."	"True"
"building_short_description_texts_short_description_east_satrap_kerta"	"A flourishing province brings its governor prosperity."	"True"
"building_short_description_texts_short_description_twr2_rome_celts_Grove_of_tuotatis_short"	"Toutatis offers his protection to those who honour him."	"True"
"building_short_description_texts_short_description_3c_rom_navalbuff_NautaeBarracks"	"The work of a marine is never over."	"True"
"building_short_description_texts_short_description_twr2_rome_greek_Pasture_short"	"Animals require large areas of land to be given over for their care."	"True"
"building_short_description_texts_short_description_twr2_rome_greek_Cistern_short"	"Water is life, and it pays to guard it as you would your own."	"True"
"building_short_description_texts_short_description_twr2_rome_greek_Shipwright_short"	"Sea legs can be found when there is glory and gold to be gained."	"True"
"building_short_description_texts_short_description_twr2_rome_egypt_Bibliothekai_short"	"The man who can read sees beyond the horizon."	"True"
"building_short_description_texts_short_description_twr2_rome_dlc_nomadic_Shrine_of_Papaios_short"	"Listen to the father of the gods and learn much of what should be…"	"True"
"building_short_description_texts_short_description_pun_iberian_Shrine_Bandua_short"	"Spoils could be worse spent than in modest tribute to a worthy god."	"True"
"building_short_description_texts_short_description_twr2_rome_eastern_Marksmens_range_short"	"Expertise comes only with diligent practice."	"True"
"building_short_description_texts_short_description_twr2_rome_eastern_Drydock_short"	"The home of the fleet, where mastery of the sea is planned."	"True"
"building_short_description_texts_short_description_gaul_carthage_monumental_architect_short"	"The design of grand edifices and temples dedicated to the gods."	"True"
"building_short_description_texts_short_description_east_coin_maker"	"Like the sun, coins sustain life."	"True"
"building_short_description_texts_short_description_barb_coin_maker"	"In an ugly world, beauty dictates value."	"True"
"building_short_description_texts_short_description_twr2_rome_barbarian_Bards_grove_short"	"Many voices raised as one: the voice of the people."	"True"
"building_short_description_texts_short_description_twr2_rome_egypt_Temple_of_Serapis_short"	"Serapis will help those who honour him properly."	"True"
"building_short_description_texts_short_description_twr2_rome_celts_Grove_of_rosmerta_short"	"'The Great Provider' watches over the faithful."	"True"
"building_short_description_texts_short_description_twr2_rome_rome_Basilica_of_Neptune_short"	"This mighty temple to Neptune ensures that all enterprises at sea go well."	"True"
"building_short_description_texts_short_description_twr2_rome_greek_Hippodrome_short"	"Is there anything more exciting than a day at the races\?"	"True"
"building_short_description_texts_short_description_twr2_rome_greek_Horse_pens_short"	"Cavalry require serious training to attack and manoeuvre on the field."	"True"
"building_short_description_texts_short_description_twr2_rome_rome_Gladiator_School_short"	"Whipped with rods, burned by fire, and taught to handle the blade."	"True"
"building_short_description_texts_short_description_twr2_rome_rome_Armourer_short"	"Armour is not cowardice. Every stroke turned aside weakens the foe."	"True"
"building_short_description_texts_short_description_twr2_rome_dlc_nomadic_Sanctuary_of_Papaios_short"	"Honour the father of the gods and earn his protection."	"True"
"building_short_description_texts_short_description_twr2_rome_greek_Port_short"	"A gateway to the world, the colonies, trade and to war's terrors."	"True"
"building_short_description_texts_short_description_twr2_rome_greek_Oracle_of_dondona_short"	"Destiny is shaped by breeze and branch."	"True"
"building_short_description_texts_short_description_twr2_rome_eastern_Harbour_short"	"Safe haven from pirates and storms, and a place to trade."	"True"
"building_short_description_texts_short_description_twr2_rome_greek_Slave_trader_short"	"Born or sold into service, the plight of slaves remains the same."	"True"
"building_short_description_texts_short_description_twr2_rome_rome_Cattle_Pens_short"	"Pens. For cattle."	"True"
"building_short_description_texts_short_description_east_garrison_town"	"A garrison's stability nurtures a growing town."	"True"
"building_short_description_texts_short_description_black_sea_greek_town_centre_5_rose_marl"	"The rose hue of these buildings is a unique sight."	"True"
"building_short_description_texts_short_description_pun_iberian_Sanctuary_Nabia_short"	"The strongest river is a force without equal, carrying life and strength before it."	"True"
"building_short_description_texts_short_description_twr2_rome_greek_Temple_of_poseidon_hippios_short"	"Poseidon rules the deeps, shakes the earth, and is master of horses. No sensible man ignores him."	"True"
"building_short_description_texts_short_description_twr2_rome_rome_Temple_of_Vulcan_short"	"The god of smiths should be honoured by all honest toiling folk."	"True"
"building_short_description_texts_short_description_pel_temple_muses"	"Knowledge and inspiration inform and enhance one another."	"True"
"building_short_description_texts_short_description_twr2_rome_egypt_Temple_of_hathor_and_maat_short"	"All praise to Hathor, goddess of love and motherhood, and Maat, weigher of the soul."	"True"
"building_short_description_texts_short_description_inv_nur_religion_sardus_2_short"	"Honour his memory and you honour your people."	"True"
"building_short_description_texts_short_description_inv_nur_religion_sardus_3_short"	"In honour of Sardus, in the hope of his continued favour."	"True"
"building_short_description_texts_short_description_inv_nur_religion_sardus_4_short"	"The hero who gave his life and name to the land."	"True"
"building_short_description_texts_short_description_twr2_rome_barbarian_Horse_ranch_short"	"A well-trained horse is worth its weight in cattle."	"True"
"building_short_description_texts_short_description_twr2_rome_barbarian_Cattle_farm_short"	"When food is plentiful there is money to be made in cattle."	"True"
"building_short_description_texts_short_description_twr2_rome_barbarian_Sacred_enclosure_short"	"The gods need a place to call their own."	"True"
"building_short_description_texts_short_description_twr2_rome_barbarian_Oppidium_short"	"All a man could want is within."	"True"
"building_short_description_texts_short_description_gaul_carthage_stone_cutter_short"	"Shaped and prepared stone for construction or sale."	"True"
"building_short_description_texts_short_description_gaul_barbarian_stone_quarry_short"	"Raw materials for great monuments and structures."	"True"
"building_short_description_texts_short_description_twr2_rome_greek_Library_short"	"Knowledge and philosophy feed the soul."	"True"
"building_short_description_texts_short_description_barb_sacred_spring"	"The spring is proof of the Mother’s love for her children."	"True"
"building_short_description_texts_short_description_twr2_rome_celts_Nemeton_short"	"The voices of the gods are heard more clearly in the open air."	"True"
"building_short_description_texts_short_description_twr2_rome_greek_Town_short"	"For settlers and traders, towns are home to opportunities undreamt of in villages."	"True"
"building_short_description_texts_short_description_gaul_carthage_sluiced_mine_short"	"Controlling water flow to scour the soil and reveal deposits."	"True"
"building_short_description_texts_short_description_rome_garrison_municipum"	"The wise man obeys the law, or pays the price."	"True"
"building_short_description_texts_short_description_twr2_rome_barbarian_Fortified_city_short"	"A strong tribe deserves a strong home."	"True"
"building_short_description_texts_short_description_pel_shrine_muses"	"Whispers of history and myth, within which the Muses speak to us."	"True"
"building_short_description_texts_short_description_gaul_civilised_stone_quarry_short"	"Granite and marble, alabaster and diorite, to construct the civilised world."	"True"
"building_short_description_texts_short_description_dk_nab_dhushara_3_short"	"The mighty Dhu Shara, chief among the gods, must have a suitable home."	"True"
"building_short_description_texts_short_description_dk_nab_dhushara_4_short"	"The lord of the mountain, ruler of gods and men alike, demands reverence."	"True"
"building_short_description_texts_short_description_twr2_rome_greek_Makra_stoa_short"	"A great colonnade, where grain merchants can ply their trade."	"True"
"building_short_description_texts_short_description_twr2_rome_rome_Forum_Boarium_short"	"If it walks upon four legs, the discerning gourmand can find it here."	"True"
"building_short_description_texts_short_description_twr2_rome_greek_Village_short"	"For most people, their village is the whole world."	"True"
"building_short_description_texts_short_description_twr2_rome_eastern_Royal_stables_short"	"Noble horses are fitting mounts for the best of cavalrymen."	"True"
"building_short_description_texts_short_description_twr2_rome_greek_Metropolis_short"	"Full of life and opportunity, the greatest city forever reinvents itself."	"True"
"building_short_description_texts_short_description_twr2_rome_eastern_Large_City_short"	"A centre of trade, politics and military power, bringing glory to the people."	"True"
"building_short_description_texts_short_description_pirates_dacian_shrine_bendis_short"	"When the night falls, loneliness calls."	"True"
"building_short_description_texts_short_description_inv_etr_main_port_4_short"	"A harbour is a gateway to the world of trade and military adventure."	"True"
"building_short_description_texts_short_description_inv_ita_religious_mamers_3_short"	"Stern-faced Mamers should be suitably honoured by such a warlike people."	"True"
"building_short_description_texts_short_description_inv_ita_religious_mamers_4_short"	"Honouring Mars brings a martial spirit to the tribes."	"True"
"building_short_description_texts_short_description_twr2_rome_greek_Foundry_short"	"The forges turn out arms and armour in great numbers."	"True"
"building_short_description_texts_short_description_twr2_rome_greek_Alytarches_short"	"Managing water is vital for survival during droughts and sieges."	"True"
"building_short_description_texts_short_description_3c_barb_religious_SanctuaryGaut"	"The cold of the great North emanates from the stones themselves."	"True"
"building_short_description_texts_short_description_twr2_rome_eastern_Temple_of_great_fires_short"	"A beacon in the darkness, bringing light and order to the world."	"True"
"building_short_description_texts_short_description_dk_num_sun_3_short"	"The sun can be made to shine its light upon your life."	"True"
"building_short_description_texts_short_description_twr2_rome_greek_Grove_nymphs_short"	"A doorway beyond the mortal realm, home to nymphs and lesser gods…"	"True"
"building_short_description_texts_short_description_twr2_rome_barbarian_Potters_workshop_short"	"Many hands make light work."	"True"
"building_short_description_texts_short_description_inv_etr_main_city_2_short"	"A tree grows branches, a city grows streets."	"True"
"building_short_description_texts_short_description_inv_etr_main_city_3_short"	"Once founded, a city needs protection."	"True"
"building_short_description_texts_short_description_inv_etr_main_city_5_short"	"The capital is the hub around which the entire state rotates."	"True"
"building_short_description_texts_short_description_inv_etr_main_city_6_short"	"Streets bustling with activity are a sure sign of grandeur."	"True"
"building_short_description_texts_short_description_inv_etr_main_city_8_short"	"It's no surprise that the people here think all outsiders inferior."	"True"
"building_short_description_texts_short_description_inv_etr_main_city_9_short"	"Even the gods would be proud to live in such a city."	"True"
"building_short_description_texts_short_description_twr2_rome_rome_Small_Town_short"	"Small towns breed ambitious men."	"True"
"building_short_description_texts_short_description_twr2_rome_celts_Grove_of_gobannus_short"	"Through his knowledge the smiths make weapons to protect our people."	"True"
"building_short_description_texts_short_description_inv_etr_main_agriculture_1_short"	"The working day starts at dawn and ends at sunset."	"True"
"building_short_description_texts_short_description_inv_etr_main_agriculture_2_short"	"Look after your land and enjoy its gratitude."	"True"
"building_short_description_texts_short_description_twr2_rome_carthage_Temple_of_astarte_short"	"Worship the goddess if you would have success on the battlefield, or in the bedroom!"	"True"
"building_short_description_texts_short_description_east_satrap_karka"	"A satrapy is a kingdom in all but name."	"True"
"building_short_description_texts_short_description_twr2_rome_rome_Basilica_of_Jupiter_short"	"The basilica properly honours Jupiter and makes clear the virtue of Roman good order."	"True"
"building_short_description_texts_short_description_twr2_rome_germanic_Shrine_of_wodanaz_short"	"Inspiration comes to those who honour Wodanaz."	"True"
"building_short_description_texts_short_description_twr2_rome_greek_Trading_port_short"	"Ships from far away lands bring necessities and luxuries to trade."	"True"
"building_short_description_texts_short_description_twr2_rome_dlc_nomadic_Grove_of_Api_short"	"The earth-mother protects her children."	"True"
"building_short_description_texts_short_description_twr2_rome_greek_Combat_posts_short"	"Weapon practice for soldiers is essential if oaths are to be fulfilled."	"True"
"building_short_description_texts_short_description_twr2_rome_rome_Auxiliary_Garrison_short"	"Auxiliaries are the second fist of the Roman Empire, and vital to its wars."	"True"
"building_short_description_texts_short_description_greek_enameller"	"Enamel saves metals from Chronos' corrosive touch."	"True"
"building_short_description_texts_short_description_east_target_stands"	"You can miss 1000 times if it leads to that one perfect shot…"	"True"
"building_short_description_texts_short_description_twr2_rome_rome_Archives_short"	"When all is recorded and remembered, society can be organised."	"True"
"building_short_description_texts_short_description_inv_salt_1"	"Salt is worth more than gold."	"True"
"building_short_description_texts_short_description_inv_salt_2"	"The cure for anything is salt water: sweat, tears or the sea."	"True"
"building_short_description_texts_short_description_inv_ven_religious_reitia_2_short"	"'The One Who Writes' watches over the faithful."	"True"
"building_short_description_texts_short_description_inv_ven_religious_reitia_3_short"	"To gain a little you must give much."	"True"
"building_short_description_texts_short_description_inv_ven_religious_reitia_4_short"	"Reitia helps those who listen to her wisdom, and honour her correctly."	"True"
"building_short_description_texts_short_description_twr2_rome_greek_Lykeion_short"	"Argument and debate may grow heated, but in that fire knowledge is forged."	"True"
"building_short_description_texts_short_description_twr2_rome_barbarian_Smoke_house_short"	"A live calf may not last the winter. A smoked one will."	"True"
"building_short_description_texts_short_description_twr2_rome_carthage_Precinct_of_baal_hammon_short"	"Sacrifice to Ba'al, and await his blessings."	"True"
"building_short_description_texts_short_description_twr2_rome_carthage_Shrine_of_astarte_short"	"Astarte is goddess of war and love, but not necessarily at the same time!"	"True"
"building_short_description_texts_short_description_twr2_rome_egypt_Temple_of_horus_short"	"The rising sun and light of dawn bring renewal every day."	"True"
"building_short_description_texts_short_description_twr2_rome_barbarian_Cattle_pens_short"	"A herd provides more than food."	"True"
"building_short_description_texts_short_description_twr2_rome_greek_City_short"	"The city is the heart of a people, where culture and learning flourish."	"True"
"building_short_description_texts_short_description_gaul_civilised_shaft_mine_short"	"Deep tunnels and shafts to access rich veins of ore."	"True"
"building_short_description_texts_short_description_pun_greek_Threatre_Syracuse_short"	"You may laugh, you may cry. It may change your life. No refunds."	"True"
"building_short_description_texts_short_description_twr2_rome_greek_Drydock_short"	"Drydocks enable speedy production of even the greatest warships."	"True"
