"campaign_map_tooltip_texts_tooltip_text_rome2_tltip_main_non_player_agent"	"%S"	"True"
"campaign_map_tooltip_texts_tooltip_text_rome2_tltip_non_player_minor_settlement_port_occupied_self"	"Οικισμός με λιμάνι"	"True"
"campaign_map_tooltip_texts_tooltip_text_rome2_tltip_non_player_minor_settlement_port_unoccupied_self"	"Οικισμός με λιμάνι"	"True"
"campaign_map_tooltip_texts_tooltip_text_rome2_tltip_player_minor_settlement_self"	"Οικισμός σας"	"True"
"campaign_map_tooltip_texts_tooltip_text_rome2_tltip_player_minor_settlement_port_occupied_self"	"Οικισμός σας με λιμάνι"	"True"
"campaign_map_tooltip_texts_tooltip_text_rome2_tltip_player_minor_settlement_port_unoccupied_self"	"Οικισμός σας με λιμάνι"	"True"
"campaign_map_tooltip_texts_tooltip_text_rome2_tltip_region_self"	"Περιφέρεια σας"	"True"
"campaign_map_tooltip_texts_tooltip_text_rome2_tltip_must_break_blockade"	"Πρέπει να γίνει λύση του αποκλεισμού πρώτα."	"True"
"campaign_map_tooltip_texts_tooltip_text_rome2_tltip_must_break_siege"	"Πρέπει να λύσεις την πολιορκία πρώτα."	"True"
"campaign_map_tooltip_texts_tooltip_text_rome2_tltip_main_non_player_admiral"	"Στόλος με επικεφαλή τον: %S"	"True"
"campaign_map_tooltip_texts_tooltip_text_rome2_tltip_non_player_navy_escort_self"	"Στόλος που συνοδέυει μεταγωγικά πλοία."	"True"
"campaign_map_tooltip_texts_tooltip_text_rome2_tltip_player_navy_transport_self"	"Τα μεταγωγικά σας είναι ευάλωτα σε ναυτικές δυνάμεις.Μπορούν να τα αποβιβάσεις στην στεριά ή να επιτεθείς ευθέως σε παραθαλλάσιους οικισμούς μέσω των λιμανιών τους."	"True"
"campaign_map_tooltip_texts_tooltip_text_rome2_tltip_main_player_general_on_sea"	"Τα μεταγωγικά σου με επικεφαλή τον: %S"	"True"
"campaign_map_tooltip_texts_tooltip_text_rome2_tltip_warning_port_occupied"	"Το λιμάνι είναι ήδη κατειλημμένο."	"True"
"campaign_map_tooltip_texts_tooltip_text_rome2_tltip_main_own_sea_region"	"Φιλικά ύδατα"	"True"
