"building_flavour_texts_flavour_twr2_rome_greek_Blacksmith_flavour"	"Smithing was an essential trade in the ancient world. Since the Bronze Age fires had been used to smelt metal, and the skill of the smith forged swords and spear heads. With the arrival of iron blacksmiths sprang up in every town and city of Greece. Ploughs, axes, tools of every kind, and even jewellery were created. Yet even though smiths were skilled and necessary, theirs was a lowly trade, and never attained the status of armourers and masons. Hephaestus, the crippled son of Zeus, was the patron god of smithing. Like the trade itself, he was considered ugly and unglamorous."	"True"
"building_flavour_texts_flavour_twr2_rome_eastern_Adobe_maker_flavour"	"Adobe has been used as a versatile and durable building material for thousands of years. It is formed from clay, sand and water, with some fibrous, organic binding matter such as straw or manure. It can be made on site as a continuous structure or turned into bricks by using wooden frames. The substance has several useful properties, and slowly absorbs and releases heat; adobe buildings stay cool in the day, and warm at night in arid, desert conditions. Traditionally, adobe was allowed to dry naturally in the sun, but bricks and tiles could also be fired in kilns. Because of its ingredients, adobe makers could easily construct temporary works next to large building sites. In large cities, where space was at a premium, some would almost always be given over to adobe production."	"True"
"building_flavour_texts_flavour_inv_etr_religion"	"The early Etruscan ‘tmia’ (or ‘sanctuary’) were usually open-air enclosures marked off from the rest of a settlement. This changed around 600BC when the Etruscans, through Greek influence, started building monumental temples. In a sacred context, and in contrast with Greek temples, Etruscan ones showed a clear differentiation between front and back, with a columnated deep front porch and an inner chamber or ‘cella’, which was flush with the podium on which the temple stood. When building their cemeteries and necropolises, the Etruscans went to great lengths to make their dead comfortable; their tombs were constructed in a similar way to houses designed for the living, and featured many equivalent details. Later-period tombs found in the city of Caere, for example, have windows, doors, columns and ceiling beams, and also came complete with furniture."	"True"
"building_flavour_texts_flavour_3c_rom_navalbuff"	"Seaborne fleets were instrumental in Rome's naval dominance which led to the Mediterranean being lovingly dubbed "Mare Nostrum" or "Our Sea" in the early days of the Empire. Roman ships saw little to no action during the 2nd century AD and whenever a fleet had to intervene it was almost always used to support  ground troops. The Crisis of the 3rd Century abruptly changed the situation. As the Empire cracked apart from internal instability, the Saxoni launched coastal raids against Britannia, while the Gothi sailed across the Black Sea to torch the lands to the south. Rome's naval command had grown complacent with the long peace and so the marauding barbarians inflicted terrible casualties and destroyed much of its fleet. The writing was on the wall: the recruitment of properly-trained crews must be paramount if there was to be any hope of withstanding future invasions."	"True"
"building_flavour_texts_flavour_twr2_rome_rome_Hamlet_flavour"	"Wherever the Romans went they not only conquered but also settled and built communities. They used stone and brick to construct colonies that were meant to last. Colonial towns developed from small hamlets and villages, some of which already existed, becoming centres of regional administration and commerce. The planned provincial towns or 'civitates' were built in a square grid pattern with stone peripheral walls for protection. The smaller 'vici' were less formal, often growing up outside Roman army camps in order to supply soldiers with the comforts and pleasures of home."	"True"
"building_flavour_texts_flavour_twr2_rome_eastern_Infantry_tents_flavour"	"Mustering a force required careful planning. Levies were often expected to provide their own arms, such as spear and shield, or javelins and even bows. If this was not done, they would have to be outfitted at the expense of the state treasury. This took time, and the easiest way to get everyone organised and equipped was in temporary camps. Dependent on circumstances and population, permanent quarters or barracks for levies would be built. Barrack-based troops could be used to supplement town watches or to patrol borders and guard trade routes. Even so, conscript levies were usually poorly trained, and more lightly equipped than noble, professional or mercenary soldiers."	"True"
"building_flavour_texts_flavour_twr2_rome_greek_Field_engineers_workshop_flavour"	"As empires expanded so technologies developed to enable attacks on defensive positions and lay siege to large cities. Field engineers became adept in the arts of using whatever resources were to hand to construct catapults, siege towers and battering rams to break down the enemy’s defences. The scorpion, a crossbow-like spear-thrower, the fire-raiser, a burning cauldron attached to a long beam on wheels, and the sambuca, a type of covered troop ladder, were early innovations in siege engineering. Philip V of Macedon used catapults along with field works in his defence of the Aous Valley in 198BC, where the Romans lost many men. Towering, literally, above all these were the huge siege towers needed to assault high walls. The Helepolis used against Rhodes in 304BC stood some forty metres high and apparently required 3,000 men to operate it!"	"True"
"building_flavour_texts_flavour_twr2_rome_egypt_Great_library_flavour"	"The most famous of all ancient libraries was founded in 288BC as part of the Alexandrian Museum by Demetrius of Phaleron. Originally based on the library of Athens, it housed mainly Greek scrolls but was open to poets, scientists, scholars and philosophers from all peoples. It was the vision of Alexander, as Aristotle’s pupil, to bring together all the knowledge in the known world under one roof, and some 70,000 scrolls were held. Much medical, scientific and scholarly work was undertaken, including the first star atlas. Aristarchus, a scholar using the library, worked out that the world revolved around the sun nearly 2,000 years before Copernicus, and it was here that the Old Testament was first translated into Greek. For six centuries the Great Library embodied academic research and study. It declined after the Roman occupation and was destroyed by fire in AD272."	"True"
"building_flavour_texts_flavour_twr2_rome_greek_Odeon_flavour"	"An odeon was a small, intimate theatre that was ideal for musical concerts and smaller works. While plays were performed, the acoustics favoured musical concerts, as shown by the name which means 'singing place'. Poets competed for prizes and many performances of epic classics such as the Iliad and Odyssey were given to sophisticated audiences. The oldest known odeon was built in Skias in Sparta around 600BC. One of the largest and most impressive remaining examples is the one built in AD161 by Herodes of Atticus, a rich Athenian magnate. Its beamed roof was made of cedar and it was decorated with works of art. It stands by the Acropolis and seated up to 5,000 for musical concerts."	"True"
"building_flavour_texts_flavour_pun_iberian_Neto_flavour"	"As a god of war, Neto was known as 'lord of the ray' for his ability to harness the blistering heat and energy of the sun. Solar deities such as Neto were revered for this power, as the Sun was considered to be the mightiest of all things. As such, his symbol of worship was a bull, denoting the raw strength possessed of it. Neto is referenced on the Botorrita plaques of Zaragoza, and is thought to be linked to the Celtic war god Neit, who was worshipped in Ireland at around the same time. As the Iberian equivalent of the Greek god Apollo, linked to the Sun, and the Roman god of war, Mars (another name for Neto was 'Mars Neto'), it is implied that Neto represented order, security and knowledge, rather than the more chaotic violence of his direct equivalent, the Greek war god, Ares."	"True"
"building_flavour_texts_flavour_twr2_rome_egypt_Shrine_of_horus_flavour"	"Horus was commonly depicted as a falcon-headed man, or just as a falcon, but he had many aspects and responsibilities. During the time of the Ptolemaic dynasty and under the Romans he was worshipped as the son of Osiris and Isis, and as the god of the sky. He was also a god of war and a divine vengeance taker, due to his war against Set to avenge Osiris’ death. In another aspect, Horus the Elder was worshipped as the patron of pharaohs, a giver of great wisdom. Many temples, such as the Temple of Horus the Elder at Kom Ombo were rebuilt by the Ptolemaic pharaohs. Ptolemy VI Philometor is the earliest ruler named in any inscriptions at the complex; construction probably began under him, but certainly finished after his reign. Ptolemy VI Philometor was, of course, Greek, but was wise enough to follow local traditions."	"True"
"building_flavour_texts_flavour_black_sea_greek_city_centre_library_5_pergamon"	"The Library of Pergamon was one of the largest in the ancient world. Second only to the great Library at Alexandria, the Attalid dynasty constructed it in direct emulation of its Alexandrian equivalent. It contained some 200,000 volumes of text, documented on early parchment known as 'pergaminus', as opposed to the Egyptian papyrus used at Alexandria. This caused the Alexandrians (who controlled the flow of Papyrus) no small amount of envy. The Library was designed with a gap between the outer walls and the bookshelves to aid air circulation, intended to prevent the region's natural humidity affecting the parchment. Legend says that Mark Antony, at the behest of Cleopatra, cleared the library of its entire catalogue and gifted it to his lover, ruining the collection and shrouding its true scope in mystery."	"True"
"building_flavour_texts_flavour_twr2_rome_barbarian_Hamlet_flavour"	"Roman and Greek historians often described the barbarian tribes as wandering people who lived for the hunt and knew little of farming and construction. Nothing could be further from the truth. A number of structures have been discovered that show that so-called 'barbarians' had a firm grasp of building techniques and were able to construct homes and defences that have survived for thousands of years. Brochs, dry stone buildings found in Scotland, survived the harsh weather and provide interesting information about the people who built them. Many were multi-storey dwellings and historians still debate their use: some believe they were defensive structures; others argue they may have been prestige buildings, symbols of wealth and power."	"True"
"building_flavour_texts_flavour_twr2_rome_egypt_Ptolemaic_temple_complex_flavour"	"Great temple complexes and monuments were built and rebuilt throughout Egypt by all the Ptolemaic pharaohs as a sign of their right to rule and continued dominance. By celebrating heaven the Ptolemies could claim divine sanction for their continued rule, and give public respect to the beliefs of common Egyptians. With many Greek colonists entering Egypt, the new temples also helped bring the two peoples together as one nation. Temples to Isis and Horus were deliberately placed next to those to Hellenised gods such as Zeus Ammon and Serapis, and connections between both pantheons were clearly made for worshippers. Alexandria featured the greatest of these new complexes but other sites, such as the Philae or Thebes, were also rebuilt to suit the political and religious needs of the Ptolemies."	"True"
"building_flavour_texts_flavour_3c_palmyra_religious_baalshamin"	"Baalshamin, the Lord of Heaven, was an ancient sky god whose cult was popular among the Semitic people from Syria. It is possible that Phoenician travellers brought knowledge of the god to the city of Palmyra, where locals embraced it and elevated Baalshamin to the position of chief god in their pantheon. He, Aglibol, God of the Moon, and Malakbel, God of the Sun, were worshipped as a trinity that held deep spiritual weight among the faithful. Being a lord of heaven, Baalshamin was believed to be in full control of the weather, which changed according to his current mood. Therefore, it was important to always be on his good side if one hoped to see some rain in this arid part of the world."	"True"
"building_flavour_texts_flavour_pirates_illyrian_vidasus_flavour"	"There is debate amongst historians as to the cultural significance of the Illyrian god, Vidasus. Some argue that he was a local deity who watched over the areas around Topuska and its people. This argument is based on the fact that nearly all of the reliefs depicting Vidasus and his divine consort Thana have been discovered in and around that area. However, the proximity of these findings to temples honouring the Roman god Silvanus and his wife Diana indicate that the Romans considered the two pairs to be aspects of the same divine being. Silvanus watched over the woods, fields and flocks, ensuring the fertility of the soil and its inhabitants, making him much beloved of those who worked the land. Both Silvanus and Vidasus had a large number of altars dedicated to them in the Topuska region, so clearly they were considered to be of great importance by the local people."	"True"
"building_flavour_texts_flavour_twr2_rome_rome_Wine_Trader_flavour"	"Romans loved wine and drank it every day. The wine trade grew alongside the Empire and became a huge business. Merchants took wine from Italy, Spain, Greece, Gaul and elsewhere to all parts of the Empire using amphorae stacked in ships. Sea transport was key as it could cost less to import wine from Spain by sea than to move it by road from home-grown vineyards. At the height of the trade up to 40,000 amphorae of wine were exported annually from Italy to Gaul and it is estimated that 500,000 litres were drunk every day in Rome alone! The Forum Vinarium was, effectively, the biggest wine shop of the ancient world. Wine was made using slave labour in both the Italian countryside and conquered lands. It has to be noted that the Romans were, for much of the Empire's lifespan, favoured with a warm climate that allowed viniculture in many northern lands."	"True"
"building_flavour_texts_flavour_twr2_rome_barbarian_Reservoir_flavour"	"Water was sacred to the ancient Celts. Rivers, wells and springs were all thought to have both medical and magical properties, and were often the sites of great sanctuaries. Perhaps the most famous of these can be found in the English spa town of Bath. The ancient Celts worshipped at its hot springs and attributed them to the goddess Sulis. After the Romans invaded, they  developed the springs further, turning them into baths and building a new temple to Sulis, who they equated with their own goddess Minerva. Over 130 lead curse tablets have been discovered within the springs, and it appears that theft was a common problem even then: many of the tablets curse the unknown thieves who took property whilst its owners bathed."	"True"
"building_flavour_texts_flavour_east_herd"	"Herding is one of the original forms of basic agriculture that was disseminated around the Mediterranean in the Neolithic age. Populations that practiced herding obtained everything from food to furniture from the animals they owned, so were not tied to the land and could move freely in search of new grazing. This enabled a population to sustain itself in arid conditions unsuitable to cultivation, as well as making it resilient to climatic changes that might be devastating to a settled culture. The same mobility made herding populations famously difficult to control, especially as the habitual raids on the livestock of others led to the development of fearsome combat skills."	"True"
"building_flavour_texts_flavour_dk_nab_dhushara_flavour"	"Dhu Shara' literally meaning 'Lord of the Mountain', was the chief deity in the Nabataean pantheon. He was represented by a rectangular block of black stone upon which the blood of the unfortunate sacrificial victims was spilled. The stone altar was mounted atop a golden pedestal and the whole sanctuary glowed with gold and votive offerings. The black stone of Dhu Shara was taken to the Ka'aba and became the focus of a cult there, which persisted for many centuries, even after the rise of Islam in the region during the 7th century AD. As Hellenistic culture begun to influence the Nabataeans, they started to adopt Greek traditions, finding parity between the Greek pantheon and their own. As such, Dhu Shara gained human form, and was equated with both Zeus and Dionysus as the leader of the Nubian gods."	"True"
"building_flavour_texts_flavour_inv_ita_religious_mamers"	"As you might expect, war was central to Samnite society and the support of its governing deity was therefore paramount if the Samnites’ military endeavours were to be successful. The most important god within the Samnite pantheon was therefore ‘Mamers’, identified with the Roman Mars, god of war. Naturally, Mamers was greatly revered and worshipped, and like the Romans the Samnites practised the rite of ‘ver sacrum’ or ‘holy spring’ and superstitiously interpreted omens from the flight of birds or by inspecting the bowels of sacrificed animals. One tenth of all animals born in spring were sacrificed to Mamers. Fortunately, this didn’t include children, who were instead sent away once they reached military age and allegedly led by a sacred ox to their new homeland."	"True"
"building_flavour_texts_flavour_rome_farming_town"	"Outside of the cities of the ancient world most people made a frugal living through agriculture. Major crops included cereals such as wheat and barley, fruits such as apples, plums, peaches, cherries and always olives wherever they could be grown. Most farms were family-owned businesses but as the cities grew so did demands on the available fertile land. Despite rising prices, it became difficult for small farmers to survive. Wealthy Romans bought up vast areas creating huge estates, or latifundia, to increase production. Slave labour was brought in and water was fed through irrigation ditches supplied by small reservoirs. The writer Pliny eventually complained that large-scale industrial farming ruined Italy and her provinces."	"True"
"building_flavour_texts_flavour_twr2_rome_greek_Practice_camp_flavour"	"Training areas were a common feature in Greek settlements where every citizen was expected to play a part in warfare. These camps, forts and 'stratopedon' prepared citizens, professional soldiers and mercenaries for the realities of the battlefield. It taught them how to follow orders, form up, and move as a phalanx, and to defend themselves and each other as a cohesive unit. Details of training varied across the Hellenic world; Spartan warriors, by virtue of being a dedicated army supported by their helot slaves, could devote their entire lives to military training. In contrast, Athens required its citizens to spend two years learning the military arts, with 18 year-old conscripts having instruction in weapons and being drilled in tactics and siegecraft for attack and defence."	"True"
"building_flavour_texts_flavour_pun_greek_Theatre_Syracuse_flavour"	"The Greek theatre at Syracuse became renowned as the largest theatre in the known world, and the city itself became a cultural capital along with it. Built by order of the tyrant Hiero I, it is notable as the birthplace of comedy, courtesy of the playwright Epicharmos. Despite this, the theatre didn't become a well-known marvel until around 220BC, when Hiero II ordered it expanded to hold a potential 20,000 people, making it a cultural icon across the world. When Syracuse fell under Roman control, early Emperors modified the theatre again, removing some seats so that Roman gladiatorial games could be held."	"True"
"building_flavour_texts_flavour_twr2_rome_rome_Shrine_of_Mars_flavour"	"Mars was the second-most potent god in the Roman pantheon after his father, Jupiter. War was at the heart of Roman imperialism and its governing deity Mars was crucial to the state’s expansionist ideals. He was rightly greatly revered and worshipped. A whole month, March, was put aside for his festivals, marking the beginning of the Roman year. Father of Romulus and Remus, Mars was associated with the very birth of Rome and thus Romans saw themselves as his children. Octavian built a temple to Mars, rather than Jupiter, on the Capitol in Rome to celebrate the overthrowing of Julius Caesar’s murderers. The Roman army believed Mars marched before them, so homage had to be paid to ensure success in battle."	"True"
"building_flavour_texts_flavour_twr2_rome_dlc_nomadic_Grove_of_Agrimpasa_flavour"	"Most information about the Scythian pantheon is secondhand, and filtered through Herodotus, the Greek writer. In the case of Agrimpasa, he equated the goddess to Aphrodite Urania, an aspect of Aphrodite who was more concerned with spiritual love rather than bodily lust. In comparing goddesses he was following an intellectual, if mostly snobbish, tradition of many civilised men. This idea of 'interpretatio graeca', or 'explaining the world in Greek terms' was fine for Herodotus and his intended audience. Anything alien could be explained by Greek examples and analogues. It is difficult to know what is accurate and reasonable in his description, as opposed to material that might be Herodotus fitting into his civilised Greek world view around awkward barbarian facts. At this remove, it’s almost impossible to judge."	"True"
"building_flavour_texts_flavour_3c_rom_city_centre_GreatCollonade"	"The main street of Palmyra was a massive architectural undertaking built over the course of the 2nd and 3rd centuries AD. A magnificent forest of columns and arches, it ran from the city's western gate to the temple of Bel in the south-eastern quarter. Funds for the construction of later known as the 'Great Colonnade of Palmyra' came from wealthy individuals and trading guilds, who in fact bought the right to place a statue of themselves along with an inscription on a column of their choosing. Emperor Septimius Severus contributed to the project by building a special arch there to commemorate his triumph over the Parthians. The Great Colonnade became the axis around which the Palmyra's everyday life spun; shops and markets were spread around the columns along with theatres, baths, monuments and temples, where believers flocked for rituals and prayer."	"True"
"building_flavour_texts_flavour_pun_iberian_Endovelicus_flavour"	"Endovelicus was an Iberian deity of health and healing, revered as an oracle and chief of their pantheon. The mainly Lusitanian tribes who worshipped him received his advice and protection, their people kept safe from harm. He was said to be a god of many faces who had visited the underworld in order to gain the power of healing; people believing that, by sleeping in the god's place of worship, he would speak to them as they slept and give them advice and knowledge of the future. Altars dating to the time of the Iberians' struggle against Rome indicate Endovelicus' central position in the resistance effort. Following the Roman subjugation of the region his cult spread to the rest of the Republic, who adopted the god into their own pantheon. His following was never stronger, however, than amongst the indigenous Lusitanian and Gallaecian peoples."	"True"
"building_flavour_texts_flavour_east_town_centre"	"Spices were highly valued commodities, both for local consumption and trade with other peoples. Trade along what would become the Silk and Spice Roads began almost at the start of civilisation with the rise of farming and trade amongst Neolithic communities. It was not until Arab and Phoenician traders began trading spices and other luxury goods, such as gold, precious stones, silks and fine textiles, that fixed routes and markets began to appear. As well as spices to flavour foods, other items were traded, including those considered essential for religious rites, such as frankincense - tree resin which gives off a strong aroma when burned. Myrrh was also highly valued for its uses as a medicine and for mummification."	"True"
"building_flavour_texts_flavour_inv_nur_religion_sardus"	"‘Sardus’, known to the Nuragic peoples as ‘Sardus Pater’, or ‘Sardinian Father’, was the son of Melqart (identified as the equivalent of Hercules in the Phoenician world, including Carthage. According to myth, Sardus left Libya with an army and settled on Sardinia, gifting it his name and creating the Nuragic tribes, who worshipped him as a hero-god and one of their chief deities."	"True"
"building_flavour_texts_flavour_twr2_rome_egypt_Peripatetic_school_flavour"	"Around 335BC Aristotle founded his school of philosophy. The name derived from the words for 'colonnade', and 'to wander'. Students would gather outside the Lyceum and Aristotle would lecture as they followed him on his walk. Many of the greatest minds in Greece came to hear him, and the school’s philosophy had a great impact on Hellenic culture. Aristotle, himself a student of Plato, was reputed to wander, in spirit at least, along the colonnade after his death. The school fell into decline in the 3rd century BC, but revived after the Roman occupation."	"True"
