"building_flavour_texts_flavour_3c_rom_cult_Mithraic"	"Mithraism was a mystery cult popular throughout the Roman Empire from the 1st century BC to the 4th century AD. It drew heavily on influences from eastern belief-systems, where 'Mithra' was the Zoroastrian deity of Covenant and Oath, among other divine responsibilities. Being a mystery cult, Mithraism's secrets were revealed only to the select few, which meant that very little information has survived and even that is fragmentary at best. It is known, however, that Mithraic rituals were conducted in underground temples known as 'mithraea' and that a shared festive meal was a part of the rites. 'Mithras' - the Roman interpretation of Mithra - was often depicted carousing with a solar deity, possibly the Roman god Sol Invictus, or ritually slaying a bull. To this day, no one has been able to ascertain exactly what this symbolism represents. Mithraism's 'system of seven degrees' was a hierarchy through which devotees ascended, each level bearing a symbolic name like 'raven' or 'sun runner' - again, we are still unsure what each level represented. Why is Mithras often depicted slaying a bull\? What exactly does the statuette of a naked man with the head of a lion depict\? Each question produces a multitude of further questions and the truth is lost to time forever."	"True"
"building_flavour_texts_flavour_twr2_rome_rome_Brickmaker_flavour"	"After the Romans came, saw and conquered they generally built. Having developed brick production in Italy, they tended to build in the style of their home towns. Romans used brickwork in every public and private building, putting fine stone cladding only on the outside. It was a huge step forward from using wood and thatch, wattle and daub or massive stonework. Construction was quick and relatively easy. Above all, the bricks used for walls and the tiles used for roofing were strong and durable. The Roman army was largely responsible for spreading the use of brickwork throughout the Empire with their kilns, often stamping the bricks with a Legion’s mark. The skill was passed on to local peoples and so became the standard building method in many lands for centuries."	"True"
"building_flavour_texts_flavour_twr2_rome_rome_Horse_Corral_flavour"	"Horses enjoyed a respected position in Roman society. Bred and kept for the great sport of racing, religious sacrifice and noble military service, they were less of the working animal they became in later cultures if only because of their cost. Horses were rarely used on farms other than when their sacrificial blood was given to purify other livestock or their heads were nailed to a farm wall in hope of a harvest blessing! It was claimed that Romulus himself had a personal guard of 300 horsemen. Roman cavalry was, at first, made up of the richer classes, the equestrians or 'riding class', who could pay for their own mounts. Later, the sense of being an elite was maintained as the upper classes were favoured, and they were paid three times as much as foot soldiers. As the Empire grew, Gallic, Numidian, Spanish and Thracian horsemen were added to the ranks. The cavalry was used to scout, carry messages and, in battle, to charge, flank an enemy quickly and gain advantage at critical moments."	"True"
"building_flavour_texts_flavour_twr2_rome_rome_Slave_Trader_flavour"	"At the height of the Roman Empire, slaves were a quarter of Italy’s six million population; in Rome every third person was a slave. The slave trade was essential to Roman society as human muscle power did everything from quarrying and mining to farming and building. Slavery was a huge business and criminals, POWs and those simply abducted from their homelands were sold for their labour. Once enslaved, the unlucky individual had no rights under Roman law. The biggest market was the Graecostadium in Rome, originally specialising in the trade of Greek prisoners. Domestic servants, field hands, quarrymen, gladiators and harlots were all traded flesh from as far afield as Britain, Parthia, Carthage and Egypt. In fact, such exotic origins meant a premium price!"	"True"
"building_flavour_texts_flavour_twr2_rome_barbarian_Field_flavour"	"Not only did the Celts develop a field system that made it possible to clearly define the boundaries between farms, they also made machines that were far more advanced than those used by the Romans or the Greeks. The Celtic plough had a coulter, a sharp blade that turned the soil over on itself. This allowed farmers to work land that had previously been inaccessible to arable farming. A wide variety of crops were grown by the Celtic people, depending on the local climate and soil. For example, the Picts of Scotland were unable to grow olives and grape vines like the Gaulish tribes of the Po Valley; they relied instead on the raising of sheep for food and wool."	"True"
"building_flavour_texts_flavour_twr2_rome_greek_Oracle_of_dondona_flavour"	"Situated at the foot of Mount Tomaros, Dodona was the home of the oldest Greek oracle. Myth has it that a single black dove perched on a great oak tree at Dodona and spoke. It declared that the will of Zeus would be heard from the oak, and that the site should be a place of worship. After such a miraculous beginning, prophecy was delivered through the rustling of leaves and the songs of the doves. The oracle would interpret these sounds, and record answers to questions on lead tablets. By the 4th century BC, walls enclosed the oak tree, and a stone temple was built. A century later, a fortified refuge was built, along with other temples. Although destroyed by the Aetolians in 219BC, the Dodona was rebuilt and then finally destroyed by the Romans in 168BC."	"True"
"building_flavour_texts_flavour_3c_palmyra_religious_malakbel"	"Malakbel, was one of many solar deities prevalent in ancient religious cults. In the city of Palmyra, he was a part of the trinity that bound him to the Moon God, Aglibol, and Baal, Lord of the Gods, with the former two considered to be servants of the latter. Malakbel was Baal's messenger, which is what his name is believed to mean. Greeks equated him with Hermes, who likewise fulfilled the duties of divine courier. Additionally, he was thought to be a bringer of Spring, who displayed a fondness for plant life and domestic animals. A holy sanctuary within Palmyra, known as 'Sacred Wood' to reflect to honour the power of sun and moon over all mortal life, was dedicated to both Malakbel and Aglibol."	"True"
"building_flavour_texts_flavour_3c_rom_military_CavalryForts"	"Roman military forts mainly consisted of barracks, with some supporting buildings around them. Each one was a long, narrow building where 'contubernia' (squads of eight soldiers) were accommodated in a pair of connected rooms. Thus, a single barracks could house 80 people or more - the size of a centuria. Similar quarters were also assigned to horsemen. In the abovementioned pair of connected rooms, cavalrymen resided in the rear chamber, along with their equipment, while their mounts lived at the front. In this way, cavalrymen could not only easily care for their trusty beasts but, in case of danger, could ready themselves and ride straight out to meet threats straight away."	"True"
"building_flavour_texts_flavour_twr2_rome_eastern_Craftmans_quarter_flavour"	"Cities and towns would often have entire quarters devoted to specific trades, with workshops and markets clustered close together. The trades could be as varied as stoneworking and sculpture by masons, pottery, or the construction of artillery and siege equipment. While many siege artillery pieces would be made from local materials, specialised parts had to be made beforehand, and field artillery would always be made to march with the army. Equipment included various types of ballistae and onagers to sophisticated fire-raisers and the polybolos. Such city quarters became hubs of industry, needing all kinds of resources and support workshops to function. A ballista would require the efforts of blacksmiths, carpenters, butchers and even tanners. The last two may seem a little odd, but the weapon's power came from animal sinews. Masons or potters might also be employed to shape stone shot or make pots to carry chemical mixtures."	"True"
"building_flavour_texts_flavour_twr2_rome_rome_Cattle_Trader_flavour"	"Meat was an expensive commodity in the ancient world. Cattle trading was big business across the Roman Empire; the size of a herd was an old measure of wealth from before coinage became standardised. Most common people would only have eaten meat during religious festivals. After an animal was sacrificed, its meat was often divided up between the worshippers. Even so, demand could be high, and even the Circus Maximus was used as a holding area for beasts 'on the hoof' between religious festivals. The Forum Boarium was the biggest cattle and meat market in the city. It was still being used to graze cattle during the 19th century."	"True"
"building_flavour_texts_flavour_inv_ven_reitia"	"Although ‘Reitia’ was among the most important goddesses of the Venetic pantheon (as borne out by the large number of artefacts found bearing her name and image), her exact position within it remains obscure. We do, however, know the names of some of her aspects; ‘Reitia Pora’, was ‘the Good and Kind’, with ‘Reitia Sahnate’ being ‘the Healer’. Her name can also mean ‘the One Who Writes’, linking her to language and writing. Indeed, the Germanic word ‘wreitan’ appears to be rooted in the same word. Eventually, when Rome conquered the whole of Italy, Reitia was considered to another aspect of Juno."	"True"
"building_flavour_texts_flavour_3c_gallicemp_military"	"Recruiting legions and stuffs. (placeholder)"	"True"
"building_flavour_texts_flavour_3c_barb_agriculture"	"The tribe needs to eat, more or less. (placeholder)"	"True"
"building_flavour_texts_flavour_3c_rom_religious_SolInvictusUnique"	"It is said that when Emperor Aurelian marched against Queen Zenobia, to reclaim the lands occupied by the Palmyrene Empire, he won the Battle of Emesa due to the intervention of a supernatural force. The Palmyrenes had the advantage, as they were able to field the superior, heavy cataphracts - the fully-armoured knights of the age. These armoured horsemen scattered the Roman cavalrymen, and the outcome appeared grim. Just at that critical moment, an occurrence described as a "divine form" appeared on the battlefield and restored the morale of the fleeing Romans, rallied them in a counter attack, and enabled them to win the day. Aurelian attributed his victory to aid provided by the sun god Sol Invictus. He dedicated a great temple in honour of the deity upon his return to Rome."	"True"
"building_flavour_texts_flavour_greek_market"	"Due to the generally poor quality of soil in Greece, cities were heavily reliant on external trade for the provision of many goods needed for daily life. Most often, items passed through the hands of the Kapeloi, or traders. These individuals rented a space in the Agora, which served both as a marketplace and as a centre of public life, where trials and government took place. Due to Kapeloi's role as 'middle men', individuals such as Aristotle accused them of a parasitic existence; the comic Aristophanes played on this prejudice by portraying his enemy Cleon as a ‘sausage seller’. In reality, their importance to the city ensured its success, if not respect."	"True"
"building_flavour_texts_flavour_pirates_dacian_high_kings_hold_flavour"	"The notion of a 'high king', or a king above all other kings, is a monarchic title that originated in Celtic Ireland, and spread throughout the holds and kingdoms of barbarian feudal societies. High kings were superior to other local kings or warlords within their wider territory. In Ireland, the 'Ard-Ri' was known as ruler of the land, though whether or not his power was absolute is a matter of debate, as is how many of the Ard-Ri were real people or mythical. According to both traditions, the high kings of Ireland were seated in their hold at the Hill of Tara. The concept of a high king was prevalent in many other cultures as well. The ruler of the strongest Etruscan city states was referred to as the high king, as well as some Greek monarchs, such as the legendary Agamemnon. It was also, in many ways, no different to the Roman title of 'emperor' before the term had been officially recognised."	"True"
"building_flavour_texts_flavour_dk_nab_greek_barracks_flavour"	"The Hellenisation of the Nabataeans occurred relatively late in comparison to the regions surrounding them, not appearing in Nabataean inscriptions until the 1st century BC. At this time, during the reign of Aretas III, the Nabataeans began to embrace Hellenistic influence and ideas wholeheartedly. They began to produce silver coins in the Hellenistic style and even started to write in Greek. Aretas also brought Greek and Roman-style architecture to Petra, the Nabataean capital, along with his other new settlements. Greek influences also found their way into the Nabataean military, with some units adopting their hoplite armaments and phalanx tactics as a result."	"True"
"building_flavour_texts_flavour_twr2_rome_rome_Water_Tank_flavour"	"Water storage was a basic but essential part of life in Roman cities. Growing populations needed a constant supply of water. A reserve could be held, in case of fire or drought, in tanks placed along the aqueducts. Fire was a common threat in the ancient world. As many buildings were poorly made, watches were organised to prevent them. The Vigiles Urbani of Rome were a force consisting of armed citizens, equipped both to fight fires and patrol urban areas. They were not always successful: the great fire of AD64 burned for six days and destroyed a large part of Rome. As well as firewatching, the Vigiles were also used at night to keep civil order and stop sabotage or criminal activity."	"True"
"building_flavour_texts_flavour_twr2_rome_greek_Fishing_port_flavour"	"Fish were a staple of many ancient diets, and methods of fishing have changed relatively little over the centuries since then. Spearfishing, hook-and-line and nets date back to the Stone Age, and could support large communities. Cast nets were commonly used at coastal outcrops. Circular in shape, they were weighted with stones around the edge, and had a drawstring that allowed the full net to be closed and hauled in. A complete contrast, in terms of effort expended, was trapping: common types included woven baskets or nets for seafood, or fish weirs that made use of tidal and river currents."	"True"
"building_flavour_texts_flavour_twr2_rome_greek_Hippodrome_flavour"	"A hippodrome is a sports arena used for horse and chariot racing, with the name coming from the words 'hippos' meaning horse, and 'dromos' or course. This circus had a wide track for ten chariots to race at one time, making for exciting and dangerous races. In the hopes of even more drama the Greeks placed an altar to Taraxippus, the horse disturber, at each corner. This spirit supposedly frightened the horses at the most dangerous part of the track, causing crashes! Some hippodromes were also used for footraces. The Lykaion hippodrome shows evidence that athletes took part in races during the same festivals as the chariots. Pentathlons, boxing, wrestling and other contests also took place there."	"True"
"building_flavour_texts_flavour_pel_trader_flavour"	"Due to the generally poor quality of soil in Greece, cities were heavily reliant on external trade for the provision of many goods needed for daily life. Most often, items passed through the hands of kapeloi, or traders. Due to their role as 'middle men', individuals such as Aristotle accused kapeloi of a parasitic existence. In reality, their importance to a city ensured its success, if not respect. These individuals rented a space in the agora, which served both as a marketplace and as a centre of public life where trials and government took place. Meaning 'gathering place', the agora included market stalls, spaces for games, and platforms for public speaking."	"True"
"building_flavour_texts_flavour_twr2_rome_dlc_nomadic_Consecrated_Ground_flavour"	"Almost without exception, all religions have the concept of a holy space, a boundary between the real world and the numinous realm of the Otherworld. This was a place where the gods and ancestors could be consulted for guidance and approval, and ceremonies held to mark important, life-changing events. Such a spot was often the home to the 'soul' of a people or nation, and even the thought of its loss or despoilment was regarded with horror."	"True"
"building_flavour_texts_flavour_twr2_rome_carthage_Shrine_of_tanit_flavour"	"A mother goddess of fertility and war, Tanit was not just the consort of Ba’al Hammon but his equal and counterpart. She was associated with the ancient Ugarit gods, like Ba’al, and particularly the war goddess Anat, who is often depicted as a headhunter in battle, wading knee-deep through blood. This imagery persisted in Carthage, but Tanit was also revered as the mother of her people and as the patron of nursing. Kerkouane, a Carthaginian settlement abandoned sometime during the First Punic War, had a sanctuary dedicated to her. It featured a courtyard, surrounded by a series of columns, and mosaic floors bearing her symbol. Associated with, or serving, the sanctuary, there were rooms and houses with stone baths, with sculpted seats and arm-rests for bathers."	"True"
"building_flavour_texts_flavour_twr2_rome_greek_Water_tank_flavour"	"Used to store water and supply fountains, water tanks were an essential component of Hellenic cities. A reliable and steady source of water, stone tanks could be filled using mechanical devices such as Archimedes’ screw or by siphons, which were used in Pergamon's citadel. Many Greek inventions and innovations stemmed the harnessing of water, including the 'clepsydra', a type of clock known as a water thief. Although water clocks had been used for centuries to mark time with a controlled flow, it was Ctesibius, an Alexandrian inventor, who is supposed to have improved the design. He is also responsible for the 'hydraulis', or water organ."	"True"
"building_flavour_texts_flavour_3c_barb_agriculture_nomad"	"The horses needs to eat, more or less. (placeholder)"	"True"
"building_flavour_texts_flavour_east_tax"	"The collapsed Achaemenid Persian Empire left an enduring impression on the eastern Mediterranean in the form of its unique taxation system. Unlike most empires, Persia’s interference in its client territories was mostly limited to the collection of taxes in exchange for protection from neighbouring states. While this loose relationship enabled provincial wealth and reduced rebellions, it came at the cost of secure control. As soon as a more powerful figure, such as Alexander, appeared there was little to stop territories transferring their taxes and allegiances. This taxation system remained in place as rulers came and went, and is responsible both for the wealth of the eastern provinces and for the speed at which territorial control changed hands."	"True"
"building_flavour_texts_flavour_inv_ven_diomedes"	"Diomedes was worshipped on both sides of the Adriatic. For the Veneti, he was related to the breeding of horses, and they used to sacrifice a white horse at his sanctuary. The legend says it was here that a well-to-do man saved a wolf caught in hunters' nets. To show his gratitude, the wolf drove off a herd of unbranded horses to the stables of his saviour. These horses proved to be the superior Venetic breed that later became well known across the ancient world."	"True"
"building_flavour_texts_flavour_pirates_illyrian_armatus_flavour"	"Armatus was the god of war and, like many ancient peoples, his followers believed the best way to earn the favour of their god was through blood and sacrifice. Due to the records of the Roman historian Arrian, we have a clear picture of the Illyrian revolt against Macedon of 335BC, and the king who devised it, Cleitus the Illyrian. Realising that Alexander the Great was distracted elsewhere, he managed to convince several neighbouring states to join him in an uprising against their Greek-speaking rulers. In order to gain the favour of the Armatus, Cleitus sacrificed three girls, three boys and three rams just before the Battle of Pelion. Sadly, these offerings were not enough and despite some hard fighting the Illyrians were caught off-guard at night. Alexander led a small mobile force into their camp, slaughtering the rebels where they slept."	"True"
"building_flavour_texts_flavour_3c_rom_military_LegionaryForts"	"During its many conquests, the Roman army relied heavily on the ability to swiftly plan and construct camps for the shelter and protection of its soldiers while on the march. Since tribal barbarians never attempted to duplicate this degree of organisation, the Romans enjoyed the significant advantage of fielding armies that were better rested due to their fortified encampments. A camp's location was first carefully chosen, keeping important details such as defensibility and easy access to water in mind. Then, a special team of surveyors marked the layout, before finally the Legionaries erected the fortifications and pitched the tents. While some camps were temporary, abandoned by a Legion who was moving on, others were constantly garrisoned due to the strategic importance of their location. These were named 'castra stativa', meaning - unsurprisingly - 'permanent camp'; their fortifications were gradually augmented until they became imposing, formidable fortresses in their own right."	"True"
"building_flavour_texts_flavour_twr2_rome_dlc_nomadic_Kurgan_Field_flavour"	"Many peoples in the ancient world buried their dead kings and heroes in elaborate ceremonies, with all the trappings of a warrior to use in the afterlife. It was an accepted thing that a warrior would need horse, armour and sword in the world to come, just as he had in this one. Sometimes a man’s slaves would be killed and buried too, to serve him in the land of the dead. On the steppes, such burials were marked by large mounds, called 'kurgans' arranged along landscape features for many kilometres. The practice seems to have been very ancient indeed, and was used by many people across the steppes. These burial mounds have provided a rich archaeological treasure trove, and a glimpse into the world of the ancient steppes. Judging by the workmanship of many artifacts, these people were far from simple barbarians. Around a fifth of the burial mounds that have been excavated contain the remains of women buried with warrior grave goods, such as weapons and armour. There may well have been a kernel of truth in the Greek legends of the Amazons, a race of warrior women at the edge of the world."	"True"
"building_flavour_texts_flavour_twr2_rome_eastern_Range_flavour"	"The use of any missile weapon requires practice and discipline, particularly if the enemy are firing or fighting back. Slings, javelins and bows were common weapons, and many troops were highly skilled in their use. The Parthian shot was a famed tactic of shooting while galloping away from the enemy, hopefully encouraging the more foolish among the targets to pursue, be cut off, and cut to shreds. Skirmishers were trained to harass, delay and annoy the enemy before the battle was joined, and to keep enemies from doing the same to their own side. In the east, the compound or recurve bow was in common use: unlike the self bow which is a single piece of wood, it was made from many different layers that each added to its strength. Sinew, horn and wood were glued together to make a strong, springy whole. The dry climate helped, because compound bows need to be kept free from damp, otherwise the animal glues used to build them start to decay."	"True"
"building_flavour_texts_flavour_twr2_rome_greek_Fountain_flavour"	"Most commonly fed from subterranean aqueducts, springs or rivers, public fountains date to as early as the 6th century BC, providing accessible drinking water for the communities they served. Often carved from marble, fountains consisted of a great basin fed by bronze piping, usually with a stylised, mask-like waterspout. Animals, mythic beasts, and the gods were common designs. A fountain or pool was often the centrepiece of a courtyard or garden, and a display of power and wealth in eastern cities. Wells, springs and waterways channelled water to fill enclosed cisterns designed to reduce water loss through evaporation, which in turn fed the fountains by gravity."	"True"
"building_flavour_texts_flavour_black_sea_greek_city_centre_5_prytaneion"	"The 'prytaneion' was the name given to any seat of government in ancient Greek culture. Usually, it occupied a space in the agora, and housed the holy fire of Hestia, symbolising the life and survival of the city. The prytaneis, or democratic council met here on every day of its term, running society through numerous, rigorous meetings. The council members were fed by the state and never strayed far from the prytaneion during the day. Though they originated in Athens, prytaneis existed across the Hellenic world with varying amounts of power, some even gaining enough to become tyrannical, as happened at Miletus, the Bosporan Kingdom's home city."	"True"
