"building_flavour_texts_flavour_twr2_rome_rome_Amphitheatre_flavour"	"The word amphitheatre means 'a theatre on both sides' and they developed from Greek circular theatres as venues for open air entertainment. Used for the richer members of the audience to show off to lesser folk, and to celebrate religious festivals, an amphitheatre's main purpose was as an arena for gladiatorial games. Blood became the staple entertainment of the Roman people. Every corner of the Empire from Britain to Syria had its amphitheatres, ranging in size from small wooden structures to the great Colosseum in Rome. Here the plebeians could be entertained, and watch gladiators demonstrating the Roman virtues of courage and fortitude, and enjoy the bloodlust, spectacle and cruelty. Amphitheatres were also important to the social order: events were often free, paid for by patrician aristocrats, the wealthy, and Emperors, all hoping for public support."	"True"
"building_flavour_texts_flavour_dk_saba_marib_flavour"	"The Great Dam of Marib - just outside the Sabaean city that shares its name - was one of the grandest engineering marvels of the ancient world. From the 8th century BC until the 5th or 6th century AD, the Great Dam sustained life in the desert around Marib, the largest city in ancient southern Arabia. First constructed to catch rainwater during the monsoon for irrigation purposes, the dam was modified in height and breadth over many centuries. However, this weakened the structure, leading to more frequent breaches that were more difficult to repair on each subsequent occasion. The dam has remained unrepaired since late in the 6th century AD; it is thought that the cost of repairs was too great following the collapse of the Himyarite Kingdom earlier in the century. This state of affairs led to the mass-migration of around 50,000 people who were living in the Dhana Valley - a great movement of people by the standards of the time, and something that even warranted a mention in the Quran."	"True"
"building_flavour_texts_flavour_twr2_rome_eastern_Port_flavour"	"Many ancient civilisations relied on naval power, both mercantile and military, to maintain their empires. At its height, the Seleucid Empire reached the Persian Gulf, the Caspian Sea, and the Mediterranean, where its trade influence spread into the Black Sea beyond. Closer to home, fish were a vital food resource for many cultures, supplementing agriculture especially in arid coastal regions. In comparison to the dangers of drought and flood that could destroy crops, fish were a resource that could be relied upon whatever the weather."	"True"
"building_flavour_texts_flavour_twr2_rome_carthage_Fountains_flavour"	"Fountains and pools were often centrepieces in courtyards and gardens, a display of power and wealth in Carthage. Functional as well as decorative, they provided water and natural cooling in the desert heat. Fountains and cisterns also provided the water essential for ritual ablutions, necessary for the worship of the gods. Wells, springs and waterways would channel water to fill enclosed cisterns, which were designed to reduce water loss from evaporation, and these would then feed fountains by gravity."	"True"
"building_flavour_texts_flavour_twr2_rome_greek_Panhellenic_games_flavour"	"The Olympiad was a four year calendar cycle in Hellenistic culture marked by a series of four religious festivals. All the city-states and colonies came together to celebrate their culture, and engage in sporting contests. Foot and chariot races, javelin and discus throwing, wrestling and boxing were included. The Olympics in Elis  were the biggest festival, and honoured Zeus, the king of the gods Zeus, as did the Nemean games. Other gods were honoured with their own games: Poseidon had the Isthmian games in Corinth, while Apollo was celebrated by the Pythian games at Delphi. Despite the bellicose relationships between some states peace was declared during the festivals. The victors were rewarded only with garlands and wreaths."	"True"
"building_flavour_texts_flavour_twr2_rome_eastern_Farm_flavour"	"Agriculture in dry climes was and remains a difficult endeavour. Water and its proper use are the crucial factors: rivers and flood plains might be good for growing crops, but a flood can wash away good soil instead of renewing the land. In more arid areas, farmers are reliant on canals and qanats for irrigation, and water must be managed carefully. Good farmland is often at a premium. Farms produced wheat, barley, olives and wine, as well enabled the husbandry of cattle, goats and sheep. Despite apparently unpromising land, many eastern states, including Parthia and Persia, had a strong agricultural base."	"True"
"building_flavour_texts_flavour_twr2_rome_carthage_Shrine_of_astarte_flavour"	"Astarte was a complicated, warlike goddess and worshipped by soldiers and couples for her influence over war and love. She was most commonly depicted symbolically by a star within a circle representing the Evening Star, the planet Venus. Several creatures were also considered sacred to her, including the lion, horse and sphinx. In Carthage she was considered to have a separate role from Tanit but there was some overlap in their responsibilities. Astarte is most famously depicted as an alabaster figurine known as the 'Lady of Galera'. This small statuette is seated on a throne and flanked by sphinxes. She holds a bowl that can be filled from liquid that pours out of her breasts. An ancient Ugarit goddess worshipped by the Phoenicians, Astarte was equated to Artemis and Aphrodite by the Greeks and to Venus by the Romans."	"True"
"building_flavour_texts_flavour_twr2_rome_eastern_Slave_trader_flavour"	"Slavery was everywhere in the ancient world. Slaves were bought and traded in every town and city, their status the result of wars, kidnap, birth, poverty, or criminality. From fields to the mightiest of temples, slavery was the engine that drove everything. Interestingly, no group, nationality or tribe was considered to be automatically worthy of enslavement. Misfortune could be visited equally on almost anyone. Slaves were rarely used in battle, and so the image of slaves chained to the oars of warships is largely a product of Hollywood cinema history. Rowing required skill, not just a strong back. And only the most desperate of masters would ever give their slaves weapons and permission to kill..."	"True"
"building_flavour_texts_flavour_pel_priestess_house"	"The Hetaira of ancient Greece were, by all accounts, courtesans. More than prostitutes, however, these women were the very definition of 'sophistication'. They were educated companions as opposed to objects for sex; Hetaira had influence, paid taxes and were the only females able to attend the symposia and have opinions that were to be respected - unusual in such a male-dominated world. During the Peloponnesian War, one of the most famous Hetaira was Lais of Korinthos, who was regarded as the most beautiful woman in the known world in her day. Her clients included the Olympic champion Eubotas and the philosopher Aristippus, whose philosophies were fittingly concerned with encouraging people to seek pleasure."	"True"
"building_flavour_texts_flavour_twr2_rome_greek_Shieldmaker_flavour"	"The shield was the most important piece of armour to a Greek infantryman. The hoplon not only gave the hoplites their name but also led to the creation of the phalanx, a supremely effective fighting formation. The concave, circular hoplon was made of bronze and wood with leather strapping for the hoplite's arm. It was of similar size to many previous designs but its unique grip allowed troops to stand close and cover the next man, thus forming a solid, unyielding wall: the phalanx. The hoplon was used throughout the Hellenistic world. It was a terrible dishonour to lose a shield in battle as it was the hoplite’s talisman and symbol of being part of the greater army of his city-state."	"True"
"building_flavour_texts_flavour_east_wrestlers"	"Wrestling is a very old sport popular in Persian, Indian and Hellenic cultures, although rules and styles do vary. Bouts could be held almost anywhere, but as the sport developed specialist arenas with earth or sand floors and galleries for spectators became popular. One of the earliest depictions is a Neolithic cave painting from the Bayankhongor Province of Mongolia showing two naked men wrestling and watched by onlookers. Centuries later, Greek wrestling became popular as part of the ancient Olympiad, was taken across the ancient world by Alexander and his armies, and eventually absorbed into Roman culture."	"True"
"building_flavour_texts_flavour_twr2_rome_greek_Training_field_flavour"	"As warfare developed tactics became more organised and required disciplined training to carry out. The phalanx of hoplites was among the most intimidating battle formations: troops were trained to hold out their sarissas, or long pikes, between their overlapping hoplon shields to create an impenetrable wall. The massed ranks behind the front line added weight to the attack. Hellenistic armies used this traditional Greek tactic to great effect. In time, the phalanx developed from a manoeuvrable formation to a massive unit that could overrun anything that stood in its way. Providing its flanks were protected, and on flat ground, the phalanx was hugely effective. It could be used as the main line of attack or to lock the enemy in position while the cavalry swept round to attack the flanks and rear. However, on rough terrain or when the wings or rear of the phalanx were exposed, it proved somewhat unwieldy and vulnerable."	"True"
"building_flavour_texts_flavour_dk_saba_shams_flavour"	"Shams was the southern Arabian goddess of the sun, also worshipped as a preserver of the crops and domestic life. In addition, she was a goddess of justice, as she could see all human actions and expose injustice with her light. Oaths were often sworn in Shams' name, for she would know if they were made in bad faith. Worship of the sun goddess was performed by bowing to the east and praying at sunrise, noon and sunset and through other rituals performed in the open air or within one of her temples. It is likely that Shams was an aspect of the Mesopotamian god, Shapash or Shamash, later worshipped by the Himyarites - another short-lived Arabian kingdom that sprung up around 100BC - and the region's nomadic Bedouin tribes for centuries."	"True"
"building_flavour_texts_flavour_twr2_rome_barbarian_Loremasters_hut_flavour"	"Little is known for certain of the ways and practices of the ancient druids. Classical writers stated that these mysterious men refused to write their secrets down, preferring to pass their knowledge from generation to generation orally. The writer Diodorus Siculus was the first to discuss the idea that there were distinct roles within the druid system, and it was Strabo who divided these into three separate classes; those who studied moral philosophy were known as the 'druidai'; the diviners and specialists in the natural world were the 'o'vateis'; and the poets and singers were the 'bardoi'. The bardoi, or bards, were responsible for passing on history in poetry and song. History always included the brave deeds of warriors as well as knowledge of the gods and the natural world."	"True"
"building_flavour_texts_flavour_twr2_rome_barbarian_Bronze_workshop_flavour"	"Due to the tribal practice of making votive offerings to gods of rivers and waterways, many bronze artifacts have been discovered at the bottom of lakes and rivers all over Europe. The River Thames in London, England must have held particular significance to the local tribes as a number of bronze work pieces have been discovered on the bottom over the years. The Waterloo Helmet, a ceremonial piece with two horns, was discovered in 1868, and the Wandsworth and Battersea shields were also recovered from the river and now reside in the British Museum. Like the helmet, the Battersea Shield is thought to be a ceremonial piece as there is no evidence of damage and no sign that it was ever attached to a wooden base, which would have given it the strength it required to be battle ready."	"True"
"building_flavour_texts_flavour_twr2_rome_eastern_Heavy_horse_studs_flavour"	"Eastern cavalry had both Hellenistic and Persian influences, with the more easterly states favouring cataphract-style scale armour, in the Parthian fashion, protecting both rider and horse. As a result, the Seleucid kings that followed Alexander maintained two 1,000-man units of elite cavalry, the Hetairoi, modelled on Parthian cataphracts. Following the Alexandrian and Parthian examples, heavy cavalry were a hammer in the tactical toolbox of eastern generals, driving off their opposite numbers before outflanking and exploiting vulnerable infantry flanks. This was helped by the use of a wedge formation to drive into the enemy and break their ordered lines."	"True"
"building_flavour_texts_flavour_barb_craftsmen"	"Isolating a single form of ‘barbarian’ art in this period is nearly impossible. In a time distinguished by frequent population movements, conquests, and new trade, ideas spread and fused rapidly to create new visual styles. The Celts, for example, were actually the largest producers of Roman style pottery in the ancient world and, likewise, the abstract animal patterns that are considered typically Celtic actually originated with the Germans. However, most barbarian art was united by its focus on geometric patterns and rejection of narrative and figurative depiction."	"True"
"building_flavour_texts_flavour_twr2_rome_eastern_City_flavour"	"The cities of the ancient world were situated where resources were plentiful and could be defended. River crossings, ports and natural trade routes were ideal locations for large populations to arise. Cities developed over long periods of time, often incorporating the architecture of earlier civilisations. In 305BC, the city of Seleucia vastly expanded an existing town on the west bank of the Tigris River. In the centuries that followed it came to rival the great Hellenic cities in magnificence. Often, planned expansion was limited to high-status quarters of the city: palaces, temples and public areas. Everyone else squeezed into the available space within the walls. This led to magnificent buildings being only a stone's throw from squalid slums."	"True"
"building_flavour_texts_flavour_twr2_rome_eastern_Nobles_quarters_flavour"	"Elite infantry had a prominent role in the ancient world, often as noble companions and royal guards. Alexander’s successors had the agema and hypaspists, such as the Silver Shields who served until they were almost too old to fight. The Seleucid Empire founded its own Silver Shields, but these were an elite unit of phalangites. Over time, these elite units became professional and some, such as the nobles and mercenaries protecting the Parthian King of Kings, became royal guards living within the palace. Royal guards were not, however, always bound by tradition: the Seleucid ruler, Antiochus IV, retrained some 5,000 Silver Shields to fight in the 'Roman fashion' as legionaries."	"True"
"building_flavour_texts_flavour_3c_barb_commons_gothi_unique"	"Gothic people threatened the well-being of the Roman Empire for the first time during the 3rd century AD when they laid waste to Dacia and Thracia. Not unlike other Germanic tribes, during times of war the Gothi were led by a king holding the title 'reiks'. Famously, Reiks Cniva led crossed the Danube into Roman territory in AD 250, sacked the Roman city of Philippopolis, and slew the Emperor Decius at the Battle of Abritus. Reeling from the shock of this defeat, the Romans allowed Cniva to withdraw northwards and paid him tribute in the hope of preventing future Gothic invasions. As success of a marauding barbarian king was measured chiefly by the amount of loot he secured, one can easily imagine that Cniva's prestige and authority grew immensely from this point onwards."	"True"
"building_flavour_texts_flavour_3c_palmyra_citycentre_GreatColonnade"	"The main street of Palmyra was a massive architectural undertaking built over the course of the 2nd and 3rd centuries AD. A magnificent forest of columns and arches, it ran from the city's western gate to the temple of Bel in the south-eastern quarter. Funds for the construction of later known as the 'Great Colonnade of Palmyra' came from wealthy individuals and trading guilds, who in fact bought the right to place a statue of themselves along with an inscription on a column of their choosing. Emperor Septimius Severus contributed to the project by building a special arch there to commemorate his triumph over the Parthians. The Great Colonnade became the axis around which the Palmyra's everyday life spun; shops and markets were spread around the columns along with theatres, baths, monuments and temples, where believers flocked for rituals and prayer."	"True"
"building_flavour_texts_flavour_grain_chain"	"Along with water, food is one of the basic human needs. When a population’s staple diet is bread, being able to effectively manage its production is an essential skill. In the ancient world, common threats such as warfare, flooding or drought could ruin a harvest. By storing excess grain from successful harvests a nation not only ensured its own safety, but also enabled it to assist others – making grain a powerful diplomatic tool. Consequently, control of its granaries was often the issue at the centre of internal power struggles. This is vividly demonstrated by the discovery of model granaries buried along with their owners to demonstrate the deceased’s agricultural power."	"True"
"building_flavour_texts_flavour_twr2_rome_eastern_Water_canals_flavour"	"Canals were a common feature of regions without major waterways or where the annual flow was insufficient to supply farms and communities with the water needed to sustain life. Whatever the source, water often needed to be carried great distances to reach the people, animals and farmland that depended on it. As a precious commodity in hot climates, water control was a matter of vital importance. Reservoirs were used to store water for particularly dry times. Eventually, sophisticated water channelling systems were developed and carefully graded to manage flow. Once the water had reached its destination, sluices directed the water to the surrounding farms."	"True"
"building_flavour_texts_flavour_dk_minor_spice"	"In ancient times, the kingdoms of southern Arabia and the Horn of Africa were the major suppliers of frankincense to the Mediterranean world. The so-called ‘Incense Route’ started in the southernmost part of the Arabian Peninsula, in a region known to the Greeks as ‘Eudaemon Arabia’ (‘Elevated Arabia’), beginning in Marib and Gherrea and passing through Qataban and Ma'in before reaching Nabataean Petra and beyond. It also served as a connection between India and the Mediterranean super-powers. Trade along the route was very lucrative and Arabia flourished as a result, with some of its cities becoming extremely wealthy in the process. Unfortunately, with success, envy follows inevitably, and so the Arabian cities became targets for many great conquerors, including Alexander. However, no one managed to capture them during their heyday, although most eventually fell to other powers by the end of the 2nd century BC, with the discovery of a direct sea route to India. Once Greeks and Romans began to bypass its land routes, southern Arabia’s wealth and power slowly but steadily declined. The Kingdom of Saba was one of the first to collapse, giving way to the Himyarite Kingdom, while Nabataea lasted longer through Hellenisation and alliance with the burgeoning Roman Empire."	"True"
"building_flavour_texts_flavour_twr2_rome_germanic_Grove_of_thunaraz_flavour"	"Literally meaning thunder, Thunaraz was one of the gods of the sky. He is very similar to the Norse god Thor and governed storms. He was best known for his incredible strength and for wielding a heavy hammer in battle as he rode his chariot across the heavens. Thunaraz was not inclined to get involved with politics and the lives of men as Teiwaz and Wodanaz did, but was seen as a great protector. He was the most popular god among the common German people and was especially worshipped by farmers and rural folk who depended on his gifts of rain for good harvests. These farmers were also the warriors of a barbarian army in times of war, and Thunaraz in his aggressive ways was a great inspiration to them. His power was seen in its purest form in lightning: a magical force that struck from the sky with great destructive power. Today his name lives on in English as the fifth day of the week, Thursday."	"True"
"building_flavour_texts_flavour_twr2_rome_eastern_Blacksmith_flavour"	"If one worker built both the ancient and modern worlds, it is the blacksmith. Tools of bronze and later iron enabled land to be cultivated, ships to be built, stone to be quarried, and wars to be fought with greater and more terrible savagery than ever before. Blacksmiths were ubiquitous: every village and town of note had a smithy turning out anything the community needed. Smithing also encouraged trade, as the tin needed for bronze was not always a local resource. This is what led the Phoenicians to sail all the way to distant Britain: they were looking for a reliable, and plentiful, source of tin. It was the move from bronze to iron that gave warriors an edge in combat, often quite literally. In the hands of a strong man, an iron sword could cleave through bronze armour and weaponry with suitably unfortunate results for its target."	"True"
"building_flavour_texts_flavour_3c_east_water_paradise_garden"	"The concept of a garden created for the purposes of aesthetic pleasure was present in Persian culture from the days of the Achaemenids and further developed by the Sassanid dynasty once they wrested control from the Parthians. Conceptually, the garden was a walled enclosure designed to please - the whole world in a bubble, where magnificent plant life flowered amidst sparkling fountains and one could walk along the winding pathways in search of solitude or relaxation. In Avestan, the language of the Zoroastrian holy scripture, the word for such a garden is 'pairidaeza', the origin of the English word 'paradise'. Thus, the Persians were able to create paradise on Earth with their own hands."	"True"
"building_flavour_texts_flavour_inv_ita_military_tents"	"When they were recruited for military service, Samnite soldiers had to swear a secret oath of obedience, referred to as the ‘war oath’. New warriors were sent to the temple to take the oath in small groups. It was a common occurrence for some in the first group to refuse and try to turn away, so they were instantly slain, ensuring little resistance from groups that followed. Where temples were not present, the Samnites would swear their oath in linen tents."	"True"
"building_flavour_texts_flavour_twr2_rome_eastern_Spice_trader_flavour"	"Spices were highly valued commodities, both for local consumption and trade with other peoples. Trade along what would become the Silk and Spice roads began almost at the start of civilisation with the rise of farming and trade amongst Neolithic communities. It was not until Arab and Phoenician traders began trading spices and other luxury goods, such as gold, precious stones, silks and fine textiles, that fixed routes and markets began to appear. As well as spices to flavour foods, other items were traded, including those considered essential for religious rites, such as frankincense. Traded for over 5,000 years, this tree resin gives off a strong aroma when burned. Myrrh was also valued for its uses as a medicine and for embalming mummies."	"True"
"building_flavour_texts_flavour_lumber_chain"	"Wood has been a staple of life and trade for as long as humans have cut down trees. In the ancient world wood and charcoal were the foremost fuels, with timber also being used extensively in construction, transport, warfare, furniture-making and even the arts. The early design of mortise and tenon joinery was found in Egyptian furniture from 2500BC and spread throughout Europe and the Middle East. Although stone was used in many advanced cultures for construction, wood remained the basic building block for many peoples. Nothing surpassed it if you wanted to go to sea. Boat and ship building developed throughout the ages and timber supplies were crucial when establishing a navy."	"True"
"building_flavour_texts_flavour_twr2_rome_rome_Fishing_Port_flavour"	"Seafood has always been important around the Mediterranean. The sea could be guaranteed to feed everyone even when crops failed. Fish was also important to the Romans for garum, a fish sauce that they added to many meals to give them extra pep and flavour. Garum, however, may not sound all that appetising to many modern diners: it was made from the salted intestines of fish, left to ferment for many months. The exact flavour of a particular garum depended on the fish used, and the herbs added during fermentation and bottling in amphorae. The varied and flavoursome garum trade was actually quite widespread and important in the Roman world. Troops expected garum to be available to season their food, even if they were on duty in far Britannia! As well as being a tasty, if not essential, addition to Roman meals, garum was also used as a medicine for all kinds of problems although, given the chief ingredients, it was probably most used as a cure for constipation! Even so, garum was not universally liked: Seneca, the Roman stoic philosopher, hated the filthy stuff even though his family came from a garum-making region of Hispania."	"True"
