"building_flavour_texts_flavour_twr2_rome_celts_Grove_of_andraste_flavour"	"Andraste was a warrior goddess and patron of the Iceni tribe. Accounts written by Dio Cassius talk of a pre-battle ritual performed by the queen of the Iceni, Boudicca, during her war against the Roman occupation of Britannia. After encouraging her people to stand against the invaders, Boudicca released a hare from the folds of her dress. The crowd waited with bated breath to see the direction in which the animal ran, as it would predict the outcome of the battle. On this occasion the omens were good, and Boudicca thanked the goddess Andraste for watching over her people in their time of need. The Romans eventually associated this powerful local deity with their own goddess of victory, Victoria."	"True"
"building_flavour_texts_flavour_twr2_rome_carthage_Hadast_flavour"	"A hadast or city was often established over centuries building on, or borrowing from, the remains of older cultures, and incorporating them into the new whole. They were often positioned to control, defend and exploit resources, fresh water, river crossings and natural ports, trade routes, or to take advantage of defensible hills or spurs of land. Rarely was an entirely new city founded: Carthage was the most famous and called 'Qart-hadast' which means only 'new city'. Supposedly founded by Phoenician colonists led by the Queen Dido, Carthage rose to power following Tyre’s collapse and the end of Phoenician power. Its position on the Mediterranean coast, and proximity to Sicily, gave it powerful command of maritime trade."	"True"
"building_flavour_texts_flavour_dk_ara_caravanserai_flavour"	"Caravanserais are inns located along the most important trade routes of the Achaemenid Royal Road, an ancient highway that stretched from Sardis to Susa, where travellers could rest and recover from their long journeys. Typically, a caravanserai was a building with a square or rectangular walled exterior, with a single wide portal to permit large carriages to enter. The courtyard was almost always open to the sky and its inner walls were outfitted with stalls, bays, niches and chambers to accommodate the merchants, their animals and merchandise. As well as providing a safe place to rest, Caravanserais supported the flow of commerce, culture and information from Asia and Africa into southeastern Europe."	"True"
"building_flavour_texts_flavour_twr2_rome_rome_Public_Forum_flavour"	"The forum was the beating heart of any Roman community. Originally an open market, it developed from a selling space to become the theatre for all important civic business: oration, gladiatorial contests, games, trials, executions and triumphal processions by returning armies. It was even used for elections. The original Forum in Rome was built on drained marshland in one of the oldest sections of the city. It grew into a hive of bustling trade with several huge buildings surrounding the public square. Government offices stood alongside cattle markets as the whole of Roman society rubbed shoulders as they traded, debated and socialised. Everywhere the Romans went they built new forums as essential meeting places and centres of commerce."	"True"
"building_flavour_texts_flavour_twr2_rome_greek_Brick_maker_flavour"	"There were two main techniques of brickmaking in the ancient world. The old fashioned way was to make sun-dried moulded mud or clay bricks of various sizes. This was developed in Asia Minor around 7500BC and then used across Greece and Egypt. However drying in the sun caused problems with the final product. It was best done in spring and autumn, as during summer bricks would dry too quickly on the outside, but not the inside, giving little strength. Sun drying also took time; some preferred their bricks to be at least five years old before they were put to use. The more advanced method of kiln baking was developed later. Baked bricks, or 'testa', found in Greek and Egyptian lands are usually dated after the Roman conquest. In fact, prior to being conquered the Greeks maintained the use of stone for city walls and major buildings; brick was mainly used for the houses of the poorer classes."	"True"
"building_flavour_texts_flavour_twr2_rome_egypt_Shrine_of_zeus_ammon_flavour"	"Zeus Ammon was a joining together of three gods in one. Amun was originally a deity in Thebes, who was eventually seen as being one with the ancient sun-god Ra, the two becoming Amun-Ra. To the Greek colonists in Egypt, Amun-Ra was an aspect of Zeus, or 'Zeus Ammon'. As such, he was worshipped across the Greek world, even as far away as Sparta and some Libyan colonies. Alexander the Great was seen as the liberator of Egypt, and was heralded as the 'son of Amun' by the oracle of the Siwa oasis, due to his victory over the Achaemenids at the Battle of Issus in 333BC. He publicly acknowledged his own divine status and called Zeus Ammon his father, a useful bit of propaganda for any world conqueror. The tradition of divine descent was well established for Pharaohs, and Alexander’s Ptolemaic successors kept the claim as an aid to their own legitimacy."	"True"
"building_flavour_texts_flavour_twr2_rome_greek_Herding_ground_flavour"	"Animal husbandry was important in the Hellenic world, as both manufacturing and trade increased. Animals such as goats and sheep were the most common livestock, but cattle were reared where resources and land would permit. Cattle were prized not simply for their meat, but as beasts of burden and for their hides. In contrast, horses were highly valued as mounts and their breeding was limited to the nobility and wealthy landowners that could afford to set aside land. Thessaly, with its ample plains, was well regarded for its horses; Thessalian cavalry had a proven reputation in Alexander the Great's army."	"True"
"building_flavour_texts_flavour_twr2_rome_carthage_Shrine_of_eshmun_flavour"	"Principally worshipped as a healing deity, Eshmun was also a protector and the guardian of the Phoenician city of Sidon. He was also associated with spring and the renewal of life. Temples to Eshmun, such as the great complex near Sidon, had stone water channels and great basins to allow worshippers to carry out purifying ablutions before any rites. Votive offerings were left in the cisterns and pools as thanks for the gift of healing or in the hope of securing Eshmun’s favour. The story of Eshmun’s origin is a little gory, and gentlemen of a nervous disposition should look away now. Eshmun was originally a mortal man, and his beauty captivated and entranced the goddess Astarte. She pursued him relentlessly, determined to take him as a lover. In order to escape her advances, and in a rather permanent way, Eshmun castrated himself. With an axe. Unfortunately for all concerned, he died from the wound. The grief-stricken Astarte brought him back from the dead, and made him a god, so his axe work didn’t have the desired outcome after all."	"True"
"building_flavour_texts_flavour_pel_bronze_workshop"	"The discovery of bronze precedes classical antiquity by thousands of years. The first bronze alloy has been dated to 4500BC and its use spread rapidly throughout China and Iran before spreading west. The 'Bronze Age' was essentially a transitional period during which the world became a more civilised culture, with the implementation of tools through smelting, the creation of tin alloys, and the development of writing. Although the Bronze Age gave way to the Iron and Classical Ages, bronze remained widely used despite being more difficult to make and requiring more skill to work than iron and its alloys. However, the use of bronze eventually declined as it took a costly master craftsman to make good weaponry from it. Wrought iron was much cheaper and easier to use, despite generally only being 'strong enough' prior to the development of steel."	"True"
"building_flavour_texts_flavour_twr2_rome_eastern_Outskirts_flavour"	"With settled populations growing, and the demands for farmable land increasing, nomadic tribesmen were forced to abandon their wanderings. Staying in one place meant that farming and husbandry skills had to change and develop. Communities had to unite to build and maintain irrigation systems, allowing settled farmers to use their land, now their property, to the fullest even after the seasonal rains had gone."	"True"
"building_flavour_texts_flavour_pun_iberian_Ataegina_flavour"	"Second only to Endovelicus in the Iberian pantheon, Ataegina was the goddess of fertility, rebirth and nature, and so was associated most commonly with springtime. Revered as the goddess of resurrection and regeneration of all things, Ataegina caused the rebirth of the seasons and every year revived the fruits of the land. This association with the natural cycle is thought to be why idols of goats, and perhaps actual animal sacrifices, were offered up in Ataegina's name. She was mainly worshipped in the most southerly parts of the Iberian peninsula and chiefly by those tribes with Celtic connections. Also, the general lack of temple remains found dedicated to her suggests that shrines to the goddess were built in natural spaces away from settlements and have simply eroded away in the intervening time. Ataegina is often linked to her Greek counterpart, Persephone, who is associated with the cycle of spring as well as the underworld."	"True"
"building_flavour_texts_flavour_inv_etr_town"	"Similar to the Greek poleis, Etruscan society was centred around a few large city-states, from which all territorial, economic and political initiatives were decided. The Etruscan model lent itself to the Latin words ‘methlum’, meaning ‘district’ and ‘spura’, meaning ‘city’, and indeed it is believed that, initially, Rome was an Etruscan city which later overthrew its kings and became a republic. For sound defensive reasons, Etruscan cities were frequently built on hills and featured relatively high walls. In terms of their street plans, there was a north-south axis with one or more east-west streets crossing it. It is possible that the Etruscans were among the first people to use such a grid system when laying out a city, which was done via a ritual known to the Romans as ‘ritus etruscus’; they later adopted the same system for building their temporary military forts and encampments."	"True"
"building_flavour_texts_flavour_pel_storage_flavour"	"Preserved food was an important part of ancient diets and often the only way to ensure food supplies through harsh winters. One way of preventing it from going off is by smoking it, whereby meat or fish is hung over smouldering wood chippings, usually of oak or alder. Smokehouses were also used to store the cured food for the winter months ahead. Aside from smoking, salting and pickling were common methods of preservation. As the salt draws the water from the food it also brings out the bacteria, slowing the oxidation process by which it goes rancid."	"True"
"building_flavour_texts_flavour_twr2_rome_rome_Manipular_Barracks_flavour"	"The greatness of Rome's army lay in training, tactics and the spirit of the people. Before the Second Samnite War in 315BC the Romans fought as a phalanx. As they suffered heavy defeats on difficult terrain a more manoeuvrable maniple system was adapted from the Samnites' tactics. Three divisions replaced the phalanx in battle: the young hastati in the front, the experienced principes as the main line and lastly the veteran triarii at the rear. This tactical system served Rome well until new enemies and new economic realities weakened it. Consul Gaius Marius made dramatic changes when he reformed the whole Roman army, creating what is now seen as the 'classic' Roman Legion as the basic battle force. His system proved extremely effective and was adopted by successive generations of leaders. It was the Marian Legions that went on to conquer the known world..."	"True"
"building_flavour_texts_flavour_twr2_rome_greek_Levy_camp_flavour"	"After the age of heroes, when fighting had been about individual valour and battles a brawl rather than a planned encounter, armies were organised into disciplined units. With conflicts between the city-states on the rise, and threats from the outside world, the Greeks created the first hoplites around 700BC. These were free citizens, fighting as infantry who provided their own armour and weapons. There was no standard equipment and these soldiers carried shields and armour emblazoned with family symbols handed down over generations. However, the name 'hoplite' derived from the one piece of equipment they did have in common: the hoplon shield. This circular shield was held so as to protect not only the bearer but also the man to his left. As a single mass, hoplites moved in the famous phalanx formation, marching towards the enemy as one solid wall."	"True"
"building_flavour_texts_flavour_inv_rom_industry_bronze_mint"	"Around 390BC, it is believed that a flock of geese kept in Juno's sanctuary on the Capitoline Hill saved Rome by warning of the impending Gallic invasion. Later, the Roman general and consul Marcus Furius Camillus built a temple on the hill in gratitude for that warning. The first Roman mint was built adjacent to the temple and the coins it produced depicted the head of Juno Moneta. In early Republican times, bronze was yet to be overtaken by iron, and was still established as a common medium of exchange; most commodities were bought and sold by 'bronze and balance'. The bronze coins were stamped with Juno's face as, following the geese's warning, she was considered the protector of money and guardian of wealth."	"True"
"building_flavour_texts_flavour_twr2_rome_egypt_Shrine_of_isis_flavour"	"Isis was a mother and wife goddess: wife to Osiris, ruler of the dead, and mother of Horus, the god of the sky and war. Hers is a tragic story, with her husband brutally murdered and dismembered by his brother Set, but ultimately triumphant as she brings her beloved Osiris (mostly) back from the dead. As an agent of rebirth and mother, she was a goddess of both fertility and protection; many revered her as a patron. Under the Ptolemaic dynasty and later, under Roman occupation, the cult of Isis thrived. This partly stemmed from the belief that it was her tears for the fallen Osiris that caused the Nile to rise with such reliable regularity. Her greatest temples were located in the Nile delta and at the island complex of Philae, although the cult later spread through the Roman Mediterranean. It is also possible to perceive a distant echo of Isis and her son Horus in some stylised portrayals of the Virgin Mary and baby Jesus."	"True"
"building_flavour_texts_flavour_twr2_rome_greek_Shrine_of_zeus_flavour"	"After the Titan Kronos was overthrown by his children, Zeus, Hades and Poseidon, the three usurpers drew lots to divide up the spoils of the universe. Poseidon was given mastery of the seas; Hades received the underworld; Zeus gained control of the sky and the air. The earth, Gaia, was to be shared between them. In addition, Zeus was made King of the Gods on Mount Olympus. Much mortal effort was put into honouring Zeus, and he had more than 150 epithets to describe his powers and responsibilities. He was the Thunderer, for example, who controlled storms and lightning, so it was a foolish man indeed who got on the wrong side of Zeus, for he risked destruction. On the other hand, many were desperate to claim a connection to him. Despite his marriage to Hera Zeus fathered many children with other goddesses and mortals, the most famous being Herakles, known as Hercules by the Romans. During the classical period it was quite the fashion for Hellenic ruling houses to claim partial-divinity by descent from one of Zeus’ many bastards or, preferably, Herakles himself."	"True"
"building_flavour_texts_flavour_twr2_rome_greek_Recruiting_ground_flavour"	"In eastern Hellenistic states there was a limit to the number of Greek recruits available, and so local populations and mercenaries were used. After Alexander, leaders valued quantity over quality and some amassed huge armies of up to 70,000 men with only a small portion of Greek origin. Further west, Hellenistic states were caught up in conflicts that depleted their numbers, making mercenaries essential to continued warfare. In 227BC Cleomenes III of Sparta made 5000 free men citizens and allowed some slaves to buy their freedom so that he had more potential recruits. When Philip V of Macedon suffered huge losses he chose to reorganise his kingdom. During peacetime, he redistributed the population and was able to leave a large army to his son, Perseus."	"True"
"building_flavour_texts_flavour_3c_barb_religious_Fairguneis"	"Literally meaning 'thunder', 'Thunaraz' was a Germanic God of the Sky, with similarities to the Norse god Thor in that he governed storms. Best known for his incredible strength and for wielding a heavy hammer in battle as he rode his chariot across the heavens, Thunaraz was not inclined to get involved with the politics and lives of men as Teiwaz and Wodanaz did, but was seen as a great protector. He was the most popular god among the common German people and was commonly worshipped by farmers and rural folk, who depended on his gifts of rain for good harvests. As the Germanic tribes, although sometimes confederated together, were never organised into a standing army, their farmers were also their warriors during times of war. Thunaraz, in all his aggressive glory, was therefore a great inspiration to them. His power was seen in its purest form as lightning: a magical force that struck from the sky with great destructive power. Today, Thunaraz's name lives on in the English language as the fifth day of the week, 'Thursday' - literally 'Thor's Day'. His Gothic aspect was called 'Fairguneis', which might share common etymology with the later Slavic God of Storms, 'Perun'."	"True"
"building_flavour_texts_flavour_inv_etr_port"	"The Etruscans conducted trade not only with their fellow cities on the Apennine Peninsula, but also with contemporary Mediterranean civilisations such as the Greeks, Phoenicians and other eastern cultures. The Etruscans were noted for their iron exports, which they exchanged for ivory from Egypt, amber from the Baltic, and pottery from Greece and Ionia; fine Greek pottery in particular was very highly valued. The Etruscans’ strong maritime presence brought them a longstanding reputation for piracy, especially among Greeks. From the records of the time, there is little evidence to suggest that the Etruscans pirated more than any other people, but their control over a significant part of the Mediterranean is indisputable. Naturally, such actions brought Etruria into conflict with the major naval power of the age, Carthage, necessitating a treaty regarding exclusive areas of operation, signed around 509BC. This treaty made both powers stronger and led them to co-operate to defend their mutual interests against the Greek fleet. Later on, once Syracuse emerged as a dominant trading power, the Sicilian-based Greeks inflicted a major defeat on the Etruscans at the Battle of Cumae, in 474BC. Around a century later, Dionysius I of Syracuse destroyed many of the Etruscan ports, leading to a decline in wealth for the previously extremely-rich Etruscan city-states."	"True"
"building_flavour_texts_flavour_inv_etr_administration"	"Most Etruscan city-states changed their governmental style from monarchies to oligarchical democracies around the 6th century BC. Despite this, the government essentially remained a theocracy, because the Etruscans were united by a common religion. Surviving Etruscan texts indicate that there were large numbers of magistrates led by a ‘zilach’, who was their chief. Each city-state was part of a confederation that met at the ‘Shrine of Voltumna’  once a year to discuss political and military matters. It was during these gatherings that the confederation would choose its head, given the title ‘Zilach Mechi Rasnal’."	"True"
"building_flavour_texts_flavour_black_sea_greek_religious_zeus_5_pergamon"	"The sprawling Acropolis at Pergamon was one of its most notable landmarks. Containing sanctuaries to numerous deities, theatres, royal palaces and various entertainment centres, it was a hub of activity for the local and visitor alike. At the foot of its upper part was one of the finest pieces of monumental architecture in the ancient world, the Great Altar of Pergamon. Commissioned by the Attalid king Eumenes II in the 2nd century BC, it is believed to have been dedicated to Zeus, and adorned with frieze bas-reliefs across its facade depicting the Gigantomachy; war between the Gods and Giants. Other friezes depicted the life of Telphus, son of the hero Heracles and the founder of Pergamon."	"True"
"building_flavour_texts_flavour_twr2_rome_eastern_Wrestling_arena_flavour"	"Wrestling is a very old sport and popular in Persian, Indian and Hellenic cultures, although rules and styles do vary. Wrestling bouts could be held almost anywhere, but as the sport developed specialist arenas with earth or sand floors and galleries for spectators became popular. One of the earliest depictions of wrestling is a Neolithic cave painting from the Bayankhongor Province of Mongolia showing two naked men wrestling, watched by onlookers. Centuries later, Greek wrestling became popular as part of the ancient Olympiad, and would eventually be absorbed into Roman culture and taken across the ancient world by Alexander and his armies."	"True"
"building_flavour_texts_flavour_3c_rom_admin_ProcuratorVilla"	"Within the Roman Empire, a 'procurator' was the state official responsible for financial affairs, food supplies, and industry. Inside Imperial provinces, i.e. where the Empire's forces were stationed, a procurator was subordinate to the provincial legate. Smaller provinces were sometimes governed by a procurator, who also had a contingent of troops at his disposal. These men were generally auxiliaries recruited from among the local populace. The infamous Pontius Pilate, was believed to have been the procurator of Judaea until an archaeological discovery in 1961 revealed that in actual fact he held the title 'praefect'."	"True"
"building_flavour_texts_flavour_rome_theatre"	"The design of the Roman theatre was largely dependent on the Greek original. While initial versions were erected in wood for the purpose of just one performance, their increasing popularity led to official recognition in the form of monumentalised free standing structures. Surviving Roman plays are nearly all reworks of Greek tragedy and comedy with an increased focus on music and dance to appeal to the more spectacle orientated Roman audience. The social status of the theatre is hard to discern as, although writers and orators often condemned it as an immoral corrupter of the rabble, evidence suggests that performances were regularly attended and enjoyed by scholars and emperors alike."	"True"
"building_flavour_texts_flavour_inv_ita_mamers"	"As you might expect, war was central to Samnite society and the support of its governing deity was therefore paramount if the Samnites’ military endeavours were to be successful. The most important god within the Samnite pantheon was therefore ‘Mamers’, identified with the Roman Mars, god of war. Naturally, Mamers was greatly revered and worshipped, and like the Romans the Samnites practised the rite of ‘ver sacrum’ or ‘holy spring’ and superstitiously interpreted omens from the flight of birds or by inspecting the bowels of sacrificed animals. One tenth of all animals born in spring were sacrificed to Mamers. Fortunately, this didn’t include children, who were instead sent away once they reached military age and allegedly led by a sacred ox to their new homeland."	"True"
"building_flavour_texts_flavour_twr2_rome_greek_Hamlet_flavour"	"Based on agriculture, fishing, trade, or mining small communities supported the growth of Greek city-states and the later Hellenic empires, providing every raw material needed. Villages only happen where there is something worth exploiting, and the best placed ones soon grow into larger towns. In the Greek world, such settlements could be as varied as the hamlets of the Spartan perioikoi, who helped keep the helots enslaved inside the state and acted as intermediaries with the outside world, to the "thousand golden cities" of Bactria which thrived on agriculture and flourishing trade in Asia Minor."	"True"
"building_flavour_texts_flavour_twr2_rome_celts_Grove_of_gobannus_flavour"	"Gobannus was the Celtic god of smiths, holding a high position within the Celtic pantheon. Smiths were thought to possess Otherworldly powers because of their work with fire and metal, so it is not surprising that their patron was also held in high regard. Depictions of Gobannus found in Britain show a bearded man wearing a belted tunic and conical cap, standing over his anvil with a pair of tongs in one hand and a hammer in the other. Perhaps the most famous record of this smith god is also a testament to the skill of those who worshipped him; a zinc tablet found in Bern, Switzerland, was considered a forgery for many years before it was eventually discovered that the tablet was in fact not zinc but an alloy of the metals which were deposited on the sides of furnaces."	"True"
