"unit_description_historical_texts_text_dk_nab_nabatean_heavy_archers"	"Massed in large numbers, eastern archers can inflict heavy casualties, and the composite bows they carry afford them greater range, accuracy and power than many of their western counterparts. Constructed from a combination of wood, sinew and animal horn, the composite bow was far more effective than the traditional wooden or 'self' bow. As its core offered greater flexibility, allowing the archer to draw its string back further and achieve a great range and power, the composite bow could find a target up to 35 metres away and pierce chainmail armour. Requiring great strength and stamina to use well, the composite bow demanded respect, care and attention. As military campaigns were often fought during the summer and autumn months, archers could rest their weapons during the winter - reconditioning the bodies before restringing and tensioning for future use."	"True"
"unit_description_historical_texts_text_3c_Pal_Palmyrene_Palace_Guard"	"Palmyra had limited choice when it came to a source of strong warriors, but the available candidates were nevertheless of high quality; King Odaenathus had raised an army of heavily-armoured troops from among his bodyguard and the nearby tribes, who were employed as a mobile force of cataphractii and horse archers. Infantry was also important to Palmyra's military, since northern Arabia had many forts and castles in defensible ravines, intended to repel the raids of neighbouring tribes. Only the strongest cavalrymen were selected to be part of the royal palace guard. Clad in lamellar armour and equipped with Iranian-style swords and daggers, the Palace Guards were among the toughest eastern warriors."	"True"
"unit_description_historical_texts_text_Aux_Socii_Equites_Extraordinarii_Long"	"The equites extraordinarii were drawn from amongst the Socii, allied non-citizens who provided most of the early Republic's cavalry. Up to a third of allied cavalry could be selected to join the equites extraordinarii. As there were typically two or three times the number of Socii than Roman cavalry, a consular army of two Legions could have some 1,800 Socii cavalry, of which at least 600 would be considered part of the elite equites extraordinarii. By tradition, Roman cavalry was habitually deployed on the right flank, while the equites extraordinarii were sent to the left. This imbalance was famously exploited by Hannibal at the Battle of Cannae in 216BC, when the Carthaginian cavalry under Hasdrubal routed the weaker Roman cavalry while the crack Numidian light cavalry waylaid their Socii allies, such was the difference in troop quality. Following the Marian Reforms, and the Allied Wars of 90-88BC, the Socii were reduced to nothing; as full citizens they were absorbed by the regular Roman Legions."	"True"
"unit_description_historical_texts_text_3c_Savaran_Generic"	"The Savaran were a wide-ranging cavalry division under the Sassanid Empire, fielding horsemen from light skirmishes and horseback archers to heavy cataphracts. They were generally drawn from nobility, with the highest posts marked for those from the House of Sassan, and those of Parthian descent. They used a variety of weapons; the Parthian spear being the most famous, but also lances, swords, maces and axes. Sassanid cavalry was born out of the need for a highly-mobile military force that could potentially fight a war on two fronts and make use of the eastern steppes, particularly against the infantry-heavy forces of the western powers of the age."	"True"
"unit_description_historical_texts_text_Rom_Legatus"	"Traditionally, the rank of Legatus was given to Roman generals in command of a Legion. Deputies to the commander-in-chief, these officers accompanied the Dux or Imperator on expeditions and were hand-picked from the Senatorial class. They had great experience in the field and possessed exceptional military skill; they could even replace the commander if he was killed.  A Consul would have several Legati with him, often his friends and family. As aristocrats, Legati would also take home a share of the spoils from any campaign. Pompey had fifteen Legati accompany him on campaign in Asia Minor. During the Imperial era, the rank 'Legatus Legionis' was given to Legion commanders selected by the Emperor, although with Senatorial approval. A 'Legatus propraetor' was a Senator or ex-Consul acting as a regional governor, and could command several Legions at once."	"True"
"unit_description_historical_texts_text_Bar_Screaming_Women_Long_Bri"	"Unlike their 'civilised' counterparts, barbarian women had power within their societies, and were not to be crossed. On the battlefield, they tended the wounded, brought supplies forward, and inspired courage. With a strong sense of personal honour, they called down the gods' curses and swore vengeance on anyone who wronged them. Although without formal positions in tribal politics, in some societies a woman could still inherit the influence of her husband or father, and this could be used to take terrible vengeance. Boudicca, the queen of the Iceni from eastern Britannia, is the prime example of a powerful woman - the revolt she started threatened to drive the Romans from Britain."	"True"
"unit_description_historical_texts_text_inv_italian_natives"	"Before Rome's ascension and eventual conquest of Italy, it shared the peninsula with others, such as the Etruscans and Samnites. These various petty kingdoms, cities and tribes often fought each other, but also united against common external threats. It was as the Etruscans waned and Greek influence fell away that the Romans began steadily accumulating land and power. Their conquest of the Apennine Peninsula was possible due to the levied troops of every tribe absorbed into the early Roman Republic. Conflict was common in Italy - most tribes went to war during the summer months, to raid neighbouring settlements for riches and resources. Rome made the most of these warlike tribesmen, drawing soldiers from their ranks in exchange for citizenship and social status within the growing Republic. The earliest example of Rome's alliances with neighbouring states was the Foedus Cassianum, with the surrounding Latin city-states shortly after the overthrow of the Roman monarchy in 510BC. The terms were simple and effective: mutual defence for both parties, based on equal contribution to an annual military levy under Roman command."	"True"
"unit_description_historical_texts_text_dk_ara_caravan_guard"	"The Arabian Peninsula was not a state, but a land occupied by inter-related tribes and powerful families. The nomadic Bedouin raised sheep and traded goods across the desert, while farmers were settled around the oases. The camel helped the nomadic tribes to grow in power, and the variety among the tribes produced many different fighting styles, but infantry nevertheless remained important in Arab armies. Although unarmoured slingers were fast and effective skirmishers, and Arabs also prided themselves on their close-combat skills. Traditionally, they fought as raiders looking for loot rather than conquest. Raids or 'razzias' brought honour to the victors, as well as the spoils of livestock and goods for their tribes. Conflicts were usually small in scale and casualties were largely avoided, as a fighting retreat in the face of great odds was not considered shameful. After the conquest of Egypt, Rome had to cross the Arabian Peninsula in order to secure the lucrative trade with India, but the Romans never fully conquered the desert or the desert peoples."	"True"
"unit_description_historical_texts_text_3c_Germanic_Hurlers"	"The young people of the Germanic tribes grew up throwing the stones found on the river beds of northern Europe, giving them a natural advantage when applying the skill to combat. Rocks and stones were in ready supply so, whilst spears may have needed repair after a battle, slingers were always well provisioned. Poor people of low status, both in society and subsequently in battle, would typically take up position behind veteran warriors, protecting them from enemy attacks. In return, the veterans would use their shields to safeguard those behind them as they unleashed their rain of missiles. Slingshot could be an effective weapon against close enemy formations or cavalry."	"True"
"unit_description_historical_texts_text_Rom_Gladiators_Long"	"Gladiators were usually slaves, condemned criminals or prisoners of war but others did enter the arena. Those with debts or a lust for glory could sell themselves as gladiators, and soldiers who had given ground might be sent to the arena as punishment. A gladiator's life was arduous and brutal, even before fighting in the games. Trainees could, and would, be killed in practice if they fought beneath their abilities, as a way of encouraging the others. The ludus, the training ground and home of gladiators, was run by a lanista, and within its walls his word was law. Outside the arena he was considered to be on the bottom rung of society; some Roman cemeteries did not allow the bodies of lanistas to be buried inside their walls, even. Having said that, there was also a peculiar glamour about their business and some were famed amongst games fans as the men who owned and trained gladiators - the sports stars of the Roman world."	"True"
"unit_description_historical_texts_text_3c_Ger_Germanic_Pikes"	"Once use of the pike in battle had spread to the west, it was adopted by many of the barbarian tribes. As an extension of the popular 'shield wall' formation, emergent barbarian pike tactics had similarities to the phalanx combat favoured by the Hellenic states before the rise of Rome. However, tribal pike troops fought far more defensively than the Greeks, especially with the advent of heavy cavalry such as lancers and their supplanting of the more traditional barbarian infantry charge with brutal shock tactics. Gradually, pikes became a popular defensive choice all over northern Europe; the Norsemen used them in a similar, circular formation of around 1000 men in a tightly-packed mass, designed to stop enemy cavalry charges dead in their tracks. This also likely gave rise to the later ‘schiltron’ or ‘shield troop’ formation commonly used by Scottish medieval armies."	"True"
"unit_description_historical_texts_text_dk_saba_camel_lancers"	"Camels have a number of advantages over horses: although notorious for their questionable temperament, they can be docile when handled correctly and are less nervous than horses. As desert creatures, camels also have greater stamina and can endure long periods without water. This advantage offered a certain strategic flexibility to commanders, as long treks in arid conditions could then be undertaken. When faced by conventional cavalry, the size and odour of camels caused horses to rear-up and back away in a fight. The invention of the north Arabian saddle in the 4th century BC made effective control considerably easier; the steady, elevated position of the saddle enabled an archer to scan the battlefield and pick his targets off with some ease."	"True"
"unit_description_historical_texts_text_inv_etruscan_military"	"The Etruscans, like the other eminent Greek and Latin peoples, had a strong military tradition. Like most other ancient societies, the Etruscans conducted their campaigns during the summer months, when the climate and weather were favourable to do so. Mainly, they raided neighbouring settlements, defended themselves against conquest attempts, and combated piracy. Warfare was considered an effective economic benefit - successful military efforts yielded strategic resources, prestige goods, and slaves. Prisoners were highly valued, to be ransomed back to their families at a high price or sacrificed to honour fallen leaders, such as those made by Achilles for Patroclus. The tombs of wealthy Etruscans were filled with shields, spears, swords, crested helmets and bronze armour, indicating their status in life. In cases where their equipment was damaged, representative sculpture was buried instead. The robust spear points and wide blades found in Etruscan grave sites resemble early Roman weaponry, showing their extensive adoption of the Etruscans' ways of war."	"True"
"unit_description_historical_texts_text_dk_kush_african_war_elephants"	"The now-extinct African forest elephants were smaller than the Indian variety. At around two to two and a half metres in height, they were an imposing beast capable of causing panic in enemies unused to facing them in battle. Having fought Syracusan elephants in Sicily in 278-276BC, the Carthaginians captured and tamed the local elephants rather than importing larger specimens from India. The Carthaginians did, however, hire Indian experts to form the most powerful elephant corps of the period. At Bagradas River in 255BC, the Carthaginian elephants caused many casualties, leaving the Romans fearful of battling the creatures for many years afterwards."	"True"
"unit_description_historical_texts_text_Eas_Persian_Light_Archers_Long"	"Very few Persians were professional soldiers and, apart from the earlier elite Achaemenid Immortals and some mercenary hoplites, none were formally trained or drilled. Instead, troops were levied by rich land owners as an obligation during times of war. Levied infantry included slingers, archers and javelin throwers, all wearing little armour but some with shields for protection. As might be expected due to the local terrain, cavalry was an important component in an eastern army, and several types were raised. Lighter cavalry wore iron or bronze scale armour over a tunic; these mounted warriors carried javelins and a sword but had no shield. Horse archers were used to wear down infantry with fast, ruthless attacks. Heavy cavalry included a royal bodyguard. The Parthians, and later the Sassanid Persians, developed all-over horse armour to protect their valued steeds as well as the fearsome cataphract warriors. These were as armoured as any late medieval knight."	"True"
"unit_description_historical_texts_text_3c_Jovianii"	"Everything in the Roman Empire was structured, often to extremes. Even the highest echelons of the military had internal hierarchy. The defence of the Emperor, for instance, was broken into tiers, with the Jovian and Herculian units established as the most senior of the Imperial guards. The 'Herculiani' were named after the Roman divine hero Hercules, known for his strength and epic adventures. The Herculiani and Joviani were potentially raised from the sister Legions Legio V Iovia and Legio VI Herculia, stationed in the province of Pannonia Secunda. These two Legions, like their Herculiani successors, were charged with defending the Emperor's personal residence."	"True"
"unit_description_historical_texts_text_3c_Persian_Generic"	"The Persian war machine differed greatly from that of the west. Gone was the reliance on a backbone of columns and infantry; instead, the eastern empires fielded heavy cataphracts, drawn from the nobility, as their main strength. These powerful shock troops were complimented by horse or camel archers, to harry the enemy and keep them under pressure. On foot, the Persians fielded light spearmen levies supported by an elite division of archers to back the cavalry and rain death upon the enemy. Also, the cataphracts were often aided by the hammer-blow of the terrifying elephant corps, upon which great importance was placed due to its magnificent power."	"True"
"unit_description_historical_texts_text_Eas_Median_Cav_Long"	"The Median people were once the rulers of an expansive kingdom spanning central Persia to Asia Minor, seizing the opportunity to create a unified Median state after the collapse of the Neo-Assyrian Empire in 605BC. The Median Kingdom endured until 505BC when the Persian king Cyrus the Great conquered its lands and formed the Achaemenid Empire. Under the Achaemenids, the Median people were considered prestige citizens, with equal status to their Persian kin. They held power as government officials, generals and as 'satraps' or governors. In battle, the Medes were known for the extraordinary agility of their horsemen, which they used against the crumbling Assyrian Empire, outmatching their enemy's skilled cavalry with superior mounted archers."	"True"
"unit_description_historical_texts_text_3c_Cal_Caledonian_Spear_Wall"	"During the 1st and 2nd centuries AD, barbarian raiding parties essentially consisted of foot soldiers armed with whatever weapons or tools they could find. As contact with Rome increased, the armament and tactics that raiders employed slowly developed alongside it. When Julius Agricola encountered the Caledonii in battle in AD 84, the red-haired Celtic warriors used large swords and short shields to knock away arrows and javelins whilst charging. After defeat at Agricola's hand, and later to Septimius Severus, the Caledonii discovered that the swift cavalry flanking manoeuvres used against them worked extremely well and, although considered a cowardly tactic, a spear wall enabled them to withstand and counter a mounted onslaught."	"True"
"unit_description_historical_texts_text_3c_Kurdish_Archers"	"The origins of the Kurds are oft-speculated. One tale suggests they are the children of the Djinn, seraphic servants of King Solomon who remained on earth after their lord's death. Another legend states that the Kurds were founded by Melik Kurdim, a follower of Noah, after the biblical flood. Whatever their origins, the Kurds were first noted as mercenary slingers for the Seleucid Empire and Parthia. They are not referred to as 'Kurds', however, until the time of the Sassanids, when the founder of the empire, Ardashir, battled the Kurds and their leader, Madig. Their loyalty was fluid; they provided military support for both Rome and the Sassanids throughout antiquity, depending on which power was in overall control of their homelands at the time."	"True"
"unit_description_historical_texts_text_3c_Grivpanvar"	"Grivpanvar, from the Middle Persian term for 'neck guard', were elite units that originated in the late Parthian Empire, but were fully adopted by the Sassanids. They were similar in many ways to the cataphracts - both horse and rider were heavily armoured and used as shock troops, smashing through enemy lines to soften forces for the rest to exploit. The Grivpanvar employed the Kontos; a long, wooden cavalry lance. Heliodorus claimed that the strength of the charge, combined with the length and weight of the spear, could impale two men at once."	"True"
"unit_description_historical_texts_text_Bac_Scale_Thorax_Hoplites_Long"	"Scale armour was common throughout the cultures of the ancient world. As the name suggests, it looked like fish scales, and was made from overlapping rows of small scale-shaped plates, attached to one another or to a backing layer of leather or padding. Scale armour was flexible and relatively easy to produce. Depending on local resources, all kinds of scales were made, including bronze, iron, leather, and hide, with horn being the most common. Because it was made from smaller pieces woven together, scale armour could be easily repaired. Before the Marian Reforms of 104BC, Republican Romans used the 'lorica squamata', a shirt of metal scales sewn onto a fabric backing. Cavalry also made use of scale armour: Scythian, Sarmatian and Parthian cataphracts were covered from head to toe in scale armour, as were their mounts."	"True"
"unit_description_historical_texts_text_3c_Assault_Hexareme"	"As the centuries passed, naval tactics and needs changed across the Mediterranean. There was a move towards larger ships, which was partly an expression of dynastic or national power. These 'polyremes' - a term meaning many-oared - were not suitable for ramming work in battle. In practice, many of them had no more oars than smaller ships; what they had were more rowers per oar than smaller ships. A Roman hexareme or Greek hexeres had a couple of banks of oars with three men per oar, and appeared to be a larger version of a smaller ship. Even so, thanks their strong construction and tremendous weight, they were slow moving and largely incapable of the quick turns needed to take advantage of enemy mistakes. Instead, their wide decks and plentiful carrying capacity made them excellent fighting platforms for infantry or artillery. Boarding or long-range bombardment were the methods used to defeat the enemy; naval warfare had come full-circle in terms of fighting methods, even if the ships used had grown significantly."	"True"
"unit_description_historical_texts_text_dk_nab_nabatean_noble_cavalry"	"The Nabataeans, although in dire relations with the Seleucids, borrowed many Hellenistic practices. As their empire expanded, the Seleucids tried to fold many nearby territories into it, looking to put a hand on the lucrative trade routes of southern Arabia as well. In the numerous military engagements between the two states, the Nabataeans developed the need to copy the greater disciplined, better structured Hellenistic way of fighting. They also used captured gear and although they were bitter rivals, admired the Greeks for their culture and civilisation. Most famous of these encounters are the Antigonid–Nabataean confrontations in 312BC. In the first instance, Antigonus appointed one of his officers, Athenaeus to pillage Petra. He did so successfully, as the defenders were away trading during the night of the raid. Not only was their stock captured, but also families, to be traded as slaves. However, the Nabataeans quickly realised the situation and were able to hunt down the 4,600-strong army and almost wipe it out, with only a few dozen escaping. Athenaeus was not among the survivors."	"True"
"unit_description_historical_texts_text_dk_kush_royal_kushite_archers"	"From their position on the Nile, the Kushite Nubians profoundly influenced the world around them. They have an impressive history from their tribal beginnings, through their time as part of the New Kingdom of Egypt to the rise of their own empire, when the kingdom – or Kush – extended across large tracts of southern Egypt. They repelled multiple Roman advances, and even survived the sacking of their capital during the 1st century BC. Though their kingdom declined in late antiquity, the Kushites remained a geopolitical and military force to be reckoned with and were never absorbed into the Roman Empire. They were famed for their formidable archers, with man and bow working as one."	"True"
"unit_description_historical_texts_text_Ara_Camel_Spear_Long"	"Camels, both dromedaries and Bactrians, were used by the eastern empires of the ancient world. Their pungent natural odour disorientated and frightened horses, and made sure they were valued as light shock cavalry. Over time, their use spread west across northern Africa and, reputedly, there was a detachment in Emperor Claudius’ conquest of far Britannia. Like other light cavalry they carried spears, and sometimes javelins, to harass and chase off enemy light cavalry, infantry and skirmishers. Their real strength came from the qualities of their camels, which allowed them to patrol arid areas without stopping so often to rest and water the beasts. Historically, the first recorded use of camels in battle was between Shalmaneser III of Assyria and the 'Twelve Kings at Qarqar' in 853BC. Widespread use does not seem to have begun until much later, as demonstrated by the hasty formation of camel corps by Cyrus the Great for the Battle of Thymbra in 547BC."	"True"
"unit_description_historical_texts_text_Gre_Pike_Long"	"A tightly formed phalanx of sarissa-armed infantry presented an almost impenetrable wall of spear points, especially to cavalry. The sarissa itself was a two-handed spear or pike, between four and seven metres long, and was adopted by the armies of Philip II, Alexander the Great, and the Successors that followed them. With an iron tip and a bronze butt-spike which provided balance and could be dug into the ground to bolster a defensive stance, it was an effective weapon for mass combat. When advancing in close order against the enemy, each man would occupy a square roughly a metre to a side, with the sarissas of the first five ranks projecting beyond the phalanx. On the defensive the phalanxes would close up, locking together with each man resting his shield on the man in front for greater stability. Such formations sacrificed manoeuvrability, leading to their main weakness on their flanks and rear. Philip II’s employment of the sarissa, and this new Macedonian-style phalanx, developed from earlier hoplite warfare. There is some debate as to whether his wounding by either an Illyrian or Thracian long spear, which killed his mount, may have influenced the sarissa's introduction."	"True"
