"unit_description_historical_texts_text_dk_kush_kushite_royal_guard"	"From their position on the Nile, the Kushite Nubians profoundly influenced the world around them. They have an impressive history from their tribal beginnings, through their time as part of the New Kingdom of Egypt to the rise of their own empire, when the kingdom – or Kush – extended across large tracts of southern Egypt. They repelled multiple Roman advances, and even survived the sacking of their capital during the 1st century BC. Though their kingdom declined in late antiquity, the Kushites remained a geopolitical and military force to be reckoned with and were never absorbed into the Roman Empire. They were famed for their formidable archers, with man and bow working as one."	"True"
"unit_description_historical_texts_text_dk_kush_slave_slingers"	"Slavery was widespread in the ancient world. References can be traced back to the Babylonian Code of Hammurabi. The ambitious construction projects of the day, as well as the custom of enslaving war captives, were some of the reasons for the large slave population many states kept at the time. The Greek city-states, for instance, depended heavily on slave labour. Having had all their rights confiscated, slaves were considered the property of their owners and could be sold as such. In Egypt, slaves who worked within the royal households could be executed and laid next to their mummified masters in the burial chamber, to serve them in the afterlife. Slaves were widely-used by the Romans as well. As the Roman Empire expanded, slaves from all over the known world poured into the Apennine Peninsula. The more educated ones became tutors, some were sold into prostitution and some became trained gladiators. Spartacus, one such gladiator of Thracian descent, famously led a bloody revolt in 73BC, threatening Rome itself at one point, before being killed in battle."	"True"
"unit_description_historical_texts_text_Gre_Mob_Long"	"Throughout history the mob has played its part in the rise and downfall of kings and politicians: a many-headed beast to be tamed or inflamed. The Greek democracies and the Roman Republic were shaped by the perceived will of the people. This was never more evident than when a mob took to the streets, seeking vengeance, to overthrow tyranny, or to protect themselves from aggressors. Ill-equipped - armed only with tools or whatever makeshift weapon was to hand - what they lacked in skill at arms was made up for by their righteous anger and superior numbers. Against such violence, even regular troops could be overwhelmed in the confined space of a city. Mobs were no respecters of status: the great Epirot king, Pyrrhus, having seized the throne of Macedon was attempting to put down unrest in its subject city of Argos. Facing a mob, he was knocked down by a roof tile thrown by an old woman and momentarily stunned, giving an Argive soldier the chance to behead him on the spot."	"True"
"unit_description_historical_texts_text_Pel_Kilikian_Javelinmen_Long"	"Kilikia, in the southwest corner of Asia Minor, was one of the most fertile plains in the region and, as such, was strategically vital to the Achaemenid Empire who, under Cyrus the Great, conquered Kilikia in 540BC. The province remained an Achaemenid satrapy, exercising a degree of independence from Persia in exchange for its ultimate loyalty. Kilikia's strategic importance lay not just in its fertile plains, but in the great highway that ran through the centre of its lands, descending from the Anatolian plateau and through the narrow mountain passes known as the Cilician Gates to Syria and Persia beyond. In many ways, it could be said that Kilikia was the Persian gateway to Asia Minor; it was certainly defended fiercely. Ultimately the Kilikians sided with Cyrus the Younger when revolting against their Persian masters, only to be put down by Artaxerxes."	"True"
"unit_description_historical_texts_text_Ita_Campanian_Cav_Long"	"From the 8th century BC, when Greeks settlers established trading posts along Italy’s eastern seaboard in the vicinity of modern-day Naples, the region of Campania was part of Magna Graecia. It remained so, a stalwart of Hellenistic civilisation, until its aggressive Samnite neighbours began to migrate from their mountainous homelands, displacing the Greek culture and language prevalent there. In a land famed for its sweeping landscapes - ideal for the breeding of strong horses - the emergent Campanian nobility developed their renowned cavalry. Carrying heavy javelins for skirmishing and swords for melee, they used speed, agility and flexibility of tactics to inflict damage on more heavily armed, and therefore slower moving, opponents. Following the Samnite Wars with Rome, around the beginning of the 3rd century BC, Campanians provided the basis of the Socii cavalry attached to Roman Legions. Well-trained in their people’s equestrian traditions, they were highly valued horsemen and greatly respected warriors."	"True"
"unit_description_historical_texts_text_Thr_Cav_Long"	"Homer, Greece’s greatest poet, praised the Thracians as “a race of horsemen”. The Thracians bred horses for racing and later improved the breed for warfare. Their horses were said to be larger and sturdier than those of the nomadic tribes to the north, and generally considered a match for most large Greek and Persian war horses. As cavalrymen, Thracians favoured speed and mobility above armour, making them well suited for tribal warfare of raids and skirmishing. When fighting as mercenaries and allies they were the perfect swift skirmishers for harassing enemies, often to the point of defeat and death, pelting a foe with javelins as they rode around at high speed."	"True"
"unit_description_historical_texts_text_dk_nab_nabatean_axe_warriors"	"The Arabian Peninsula was not a state, but a land occupied by inter-related tribes and powerful families. The nomadic Bedouin raised sheep and traded goods across the desert, while farmers were settled around the oases. The camel helped the nomadic tribes to grow in power, and the variety among the tribes produced many different fighting styles, but infantry nevertheless remained important in Arab armies. Although unarmoured slingers were fast and effective skirmishers, and Arabs also prided themselves on their close-combat skills. Traditionally, they fought as raiders looking for loot rather than conquest. Raids or 'razzias' brought honour to the victors, as well as the spoils of livestock and goods for their tribes. Conflicts were usually small in scale and casualties were largely avoided, as a fighting retreat in the face of great odds was not considered shameful. After the conquest of Egypt, Rome had to cross the Arabian Peninsula in order to secure the lucrative trade with India, but the Romans never fully conquered the desert or the desert peoples."	"True"
"unit_description_historical_texts_text_3c_Ger_Horse_Hewers"	"On ancient battlefields, unconventional tactics often led to victory through their ingenuity and the resultant confusion they caused among the enemy, and there are few quite as unconventional as horse hewing. The first account of 'horse-stabbing' was made by Caesar during his long years spent conquering Gaul. He recounts the effectiveness of this tactic, which broke his horsemen and terrified their steeds. He was so impressed that, upon their defeat, he drafted horse hewers into his army and used them on future campaigns. From guerrilla units, they were converted into full regiments and became a useful tool against all manner of cavalry, even the heavily-armoured eastern cataphracts."	"True"
"unit_description_historical_texts_text_Ger_Sword_Masters_Long"	"Whereas German tribes often fought in a more ordered, organised manner than the Celts, they sometimes adopted their neighbours’ weapons and equipment, either through battle or trade. Celtic armour found its way onto the backs of privileged German warriors, while double-edged longswords were another example of creeping Celtic influence. An iron sword was a prestigious possession, so those who carried them were either of noble blood or were veteran followers. By following a noble, warriors were duty-bound to show dedication and valour. If he fell in combat, the noble’s men were expected to fight to the death. Anyone who survived such a battle was disgraced. Some hanged themselves, unable to live with the shame and dishonour of outliving their battle-lord."	"True"
"unit_description_historical_texts_text_Ara_Tribes_People_Long"	"The Arabian Peninsula was not a state, but a land occupied by inter-related tribes and powerful families. The nomadic Bedouin raised sheep and traded goods across the desert, while farmers were settled around the oases. The camel helped the nomadic tribes to grow in power, and the variety among the tribes produced many different fighting styles, but infantry nevertheless remained important in Arab armies. Although unarmoured slingers were fast and effective skirmishers, and Arabs also prided themselves on their close-combat skills. Traditionally, they fought as raiders looking for loot rather than conquest. Raids or 'razzias' brought honour to the victors, as well as the spoils of livestock and goods for their tribes. Conflicts were usually small in scale and casualties were largely avoided, as a fighting retreat in the face of great odds was not considered shameful. After the conquest of Egypt, Rome had to cross the Arabian Peninsula in order to secure the lucrative trade with India, but the Romans never fully conquered the desert or the desert peoples."	"True"
"unit_description_historical_texts_text_Gre_Bronze_Shield_Pike_Long"	"An elite phalanx of pikemen, the Bronze Shields were modelled on their hoplite forebears and, subsequently, the Alexandrian pike reforms. Their most distinctive feature, and the one which gave them their name, was their bronze shield, emblazoned with the name of their king. Although fighting in the style of Alexandrian phalangites, they probably wore a uniform of Persian origin. This would include a reinforced cuirass of scales or stiffened linen, bronze helm, and probably a patterned tunic and trousers. Their main weapon was the sarissa, a pike of up to 22 feet in length. As this required both hands, a neck strap in addition to a loop over their left arm would support their heavy bronze shields. In close order, phalanxes, such as the Bronze Shields, presented an impenetrable wall to the front, pushing back or pinning an enemy so that it could then be flanked and broken by cavalry."	"True"
"unit_description_historical_texts_text_Rom_Plebs_Long"	"Rome’s wisest rulers appeased the mob when they became unruly, but the cleverest leaders turned them against their rivals; the plebeians always had the power to make or break the mighty. Julius Caesar was particularly adept at manipulating the plebs, and his power remained even in death. At his funeral, the grieving crowd hurled their belongings onto his pyre: the fire raged out of control and damaged the Forum. Grief soon turned to anger and the mob attacked the houses of Brutus and Cassius, two of Caesar’s assassins. They had sensibly fled the city, so the plebs contented themselves with looting rather than lynchings."	"True"
"unit_description_historical_texts_text_Gre_Hellenic_Royal_Cav_Long"	"The Hellenistic kings who succeeded Alexander recruited their royal cavalry guard in the image of Alexander’s famed Companion cavalry. Similarly equipped, they carried the Macedonian 'xyston' lance, a two-handed thrusting spear of around four metres in length. They led their royal cavalry in the same heroic style as Alexander, setting an example at the head of the charge. Whilst besieging Sparta in 272 BC, Pyrrhus of Epirus learned of the death of his son. Channelling his grief and anger, he charged his cavalry headlong into a unit of elite Spartan infantry. Toppled from his horse, Pyrrhus fought hand-to-hand against the odds and survived to tell the tale. This approach to frontline combat meant he was held in great regard by his men, but eventually led to his death. Caught in melee in the narrow streets of Argos, where he had come to curb unrest, Pyrrhus was stunned by a tile thrown from a roof and then beheaded by an Argive soldier before he could recover."	"True"
"unit_description_historical_texts_text_Afr_Garamantian_Warriors_Long"	"The Garamantians were a Saharan people who created an empire based on the slave trade, and used a sophisticated network of irrigation tunnels for their water supplies. This vital water supported cattle and wheat farming, enabling the Garamantians to dominate much of Saharan and sub-Saharan Africa. At times, their expansion threatened Carthage and Ptolemaic Egypt, who also prized their fierce warriors as mercenaries. A reliance on slaves and freemen of low birth, much like the Spartans, enabled the Garamantians to develop a skilled military elite famed for their horsemanship and four-horse chariots. Unfortunately, as the water ran out, so did the fortunes of the Garamantians. Unable to support their towns and territories, their military power dwindled; they could no longer get the slaves they needed to secure more water."	"True"
"unit_description_historical_texts_text_Ita_Mob_Long"	"Throughout history the mob has played its part in the rise and downfall of kings and politicians: a many-headed beast to be tamed or inflamed. The Greek democracies and the Roman Republic were shaped by the perceived will of the people. This was never more evident than when a mob took to the streets, seeking vengeance, to overthrow tyranny, or to protect themselves from aggressors. Ill-equipped - armed only with tools or whatever makeshift weapon was to hand - what they lacked in skill at arms was made up for by their righteous anger and superior numbers. Against such violence, even regular troops could be overwhelmed in the confined space of a city. Mobs were no respecters of status: the great Epirot king, Pyrrhus, having seized the throne of Macedon was attempting to put down unrest in its subject city of Argos. Facing a mob, he was knocked down by a roof tile thrown by an old woman and momentarily stunned, giving an Argive soldier the chance to behead him on the spot."	"True"
"unit_description_historical_texts_text_3c_Aux_Numidian_Javelinmen"	"Numidia had a fierce warrior tradition, partly due to the bitter feuding and internal warfare between the eastern Massylii and western Masaesylis. While the Numidians were famed as cavalrymen, their infantry forces were also quite effective. The historian Suetonius mentions that there were 'Numidian Legions' - a term normally reserved in Roman writings to describe Roman troops - when passing comment on Julius Caesar’s speech about Juba’s march to aid Scipio before the Battle of Thapsus in 46 BC. This suggests that some Numidians were fighting in the Roman style, and were possibly equipped in the same manner. The Numidians also adopted other tactics and war gear, such as the thureos-style shield and hoplite-like spears."	"True"
"unit_description_historical_texts_text_dk_ara_armoured_camel_spearmen"	"Camels have a number of advantages over horses: although notorious for their questionable temperament, they can be docile when handled correctly and are less nervous than horses. As desert creatures, camels also have greater stamina and can endure long periods without water. This advantage offered a certain strategic flexibility to commanders, as long treks in arid conditions could then be undertaken. When faced by conventional cavalry, the size and odour of camels caused horses to rear-up and back away in a fight. The invention of the north Arabian saddle in the 4th century BC made effective control considerably easier; the steady, elevated position of the saddle enabled an archer to scan the battlefield and pick his targets off with some ease."	"True"
"unit_description_historical_texts_text_Ibe_Skirm_Long"	"The Romans called Iberian skirmishers 'caetrati' after their 'caetra'-style shields; there are no records of what, if anything, the Iberians fighting in this style called themselves. The caetra was a small, round, wooden buckler no more than sixty centimetres across. The central handgrip and protruding metal boss meant that it could be used both defensively for protection and offensively to punch enemies in close combat. An experienced skirmisher would, of course, try to stay out of hand-to-hand combat as much as possible, and rely on his javelins to kill the enemy from a safe distance."	"True"
"unit_description_historical_texts_text_Gre_Spartan_Pike_Long"	"When Cleomenes III succeeded his father, Leonidas II, as King of Sparta in 235BC, he attempted to return Sparta to its former glory, reintroducing the traditional Spartan military system to bolster the city’s dwindling population, even raising some perioikoi to full citizenship. He also improved the weapons and battle tactics of his existing forces, equipping his hoplites with long sarissa pikes, replacing the shorter hoplite spears that had been used for the last 500 years. The Spartan army that took to the battlefield after his reforms was comprised largely of citizen recruits well-versed in the tactics that had dominated Greek warfare since the rise of Macedon 100 years before. Its Macedonian-style phalanx was employed with some success, as Cleomenes’ forces initially countered the rising power of the Achaean League, but they were eventually defeated at Sellasia in 222BC. Cleomenes fled to Egypt, where he was eventually forced into taking his own life after a failed coup to conquer Alexandria."	"True"
"unit_description_historical_texts_text_Ger_Spear_Levy_Long"	"Spearmen were the lifeblood of German tribal forces. Brought up on the traditions of feasting and raiding, they craved the opportunity to prove themselves against a worthy enemy. Having scant regard for the dangers that lay ahead, whipped into frenzy by chant and song, and armed with bone-tipped spears and javelins, the ferocity of their initial attack was both feared and renowned. The 'Furor Teutonicas', as it was labelled by the Romans, did not resemble the disorganised mass favoured by the Celts. Instead, the Germans attacked in ordered columns or in a wedge formation, known as the 'boarhead'."	"True"
"unit_description_historical_texts_text_Eas_Syrian_Heavy_Archers_Long"	"Massed in large numbers, eastern archers can inflict heavy casualties, and the composite bows they carry afford them greater range, accuracy and power than many of their western counterparts. Constructed from a combination of wood, sinew and animal horn, the composite bow was far more effective than the traditional wooden or 'self' bow. As its core offered greater flexibility, allowing the archer to draw its string back further and achieve a great range and power, the composite bow could find a target up to 35 metres away and pierce chainmail armour. Requiring great strength and stamina to use well, the composite bow demanded respect, care and attention. As military campaigns were often fought during the summer and autumn months, archers could rest their weapons during the winter - reconditioning the bodies before restringing and tensioning for future use."	"True"
"unit_description_historical_texts_text_Egy_Nubian_Spear_Long"	"Considered by some modern archaeologists to be the birthplace of civilisation itself, the ancient kingdom of Nubia lay between Egypt and modern-day central Sudan. Although much of the country was inhospitable desert, the tributaries of the Nile that flowed through it had fertile valley basins and it was there that Nubian culture flourished. As well as being a crucial water source, the Nile was the main trade route to Egypt for African ivory, animals, incense and other exotic riches. Living in such close proximity to the great river, the Nubians became excellent sailors, which ensured their nation's wealth through trade. Being Egypt’s neighbour, Nubia also became, at times, its greatest enemy, and the population were often enslaved and used as soldiers. In 750BC, Nubians even managed to conquer Egypt, and ruled for one hundred years - such was the deep rivalry that existed between the two. Consisting mainly of mercenaries, Nubian armies were famed for their aggression and fearlessness on the battlefield. Nubian archers even defeated the Romans, and their spearmen fought both against and alongside Ptolemaic armies. Eventually, the greatest threat to Nubia came not from war, but from the humble camel. Its introduction in the 2nd century AD greatly increased the power of nomadic desert tribes, lessening the importance of the Nile as a trade route. Subsequently, the kingdom went into decline."	"True"
"unit_description_historical_texts_text_inv_ballista"	"According to Diodorus, the 'katapeltikon' or catapult was invented under the patronage of Dionysius I, tyrant of Syracuse, in 399BC. The weapon was not the result of a stroke of inventive genius, instead being inspired by an earlier mechanical weapon called the 'gastraphetes'. In its original form, the gastraphetes consisted of a powerful composite bow mounted transversely on a stock and resembling the later crossbow. Its stock had two crucial parts: the syrinx, to which the bow of the weapon was fixed, and the diostra, a shorter board that could slide back and forth. The end of the diostra was in turn attached to a claw for pulling back the bowstring, with a trigger to release it again. Machines such as this were known to the Greeks before the invention of the katapeltikon, but didn't replace the composite bow with a pair of torsion springs, considered to be a major design improvement. Dionysius is said to have fielded "catapults of all kinds", using them to great effect in his siege of Motya in 397BC. By the time of Alexander, in the latter part of the 4th century BC, catapults were a regular feature of Hellenistic armies."	"True"
"unit_description_historical_texts_text_Gre_Sarissa_Cav_Long"	"An early form of lance-like spear, most commonly associated with Hellenic cavalry, the xyston measured three and a half to four and a half metres in length. Consisting of an iron spear tip on a wooden shaft, the weight of the head was offset, like many Greek spears, by a bronze butt-spike. This may have helped with balance and in the hands of a skilled rider may have meant only one hand was required, as seen in the famous Alexander Mosaic from Pompeii. As most bronze alloys are heavier than iron this may have been possible, as the xyston’s balance point was towards the butt-spike. However, whether such lances were as effective when used one-handed, both in terms of force and accuracy, is debatable."	"True"
"unit_description_historical_texts_text_3c_Pal_Hamian_Archers"	"The Romans were met with little resistance when they invaded Syria under Pompey's leadership. The city of Hama fell to Rome in 63 AD and its 500 garrisoned Hamian bowmen were subsequently turned into a specialised auxiliary regiment. Stationed in Britannia, far from their native valleys in the Middle East, the Hamians were sent to protect the remote Roman province from barbarian raiders. These crack archers served several purposes. Undoubtedly an excellent defensive unit, they were able to shoot accurately over a considerable distance. As part of the local garrison, they undoubtedly participated in the construction of Hadrian's Wall and were also responsible for supplying the Roman army with meat and game, using their excellent skills to bring down prey for food."	"True"
"unit_description_historical_texts_text_Eas_Kartli_Axemen_Long"	"These fierce axemen came from the ancient Georgian kingdom of Kartli, a region that sat on the divide between east and west. The kingdom of Kartli remained mostly independent until its association with both Pontus and Armenia led it into direct conflict with Rome during Pompey’s eastern campaigns. They were then treated as a subject state, eventually becoming formally allied to Rome following the disputes between Emperor Hadrian and Pharasmanes, the king of Kartli. Kartli did supply axemen as both mercenaries and auxiliaries to the Romans. In battle these axemen used one-handed axes that could inflict horrible wounds, and carried round shields. They also wore helmets, scale shirts and, later, chainmail. They were, by the standards of the day, rather well equipped."	"True"
"unit_description_historical_texts_text_dk_saba_royal_camel_archers"	"Camels have a number of advantages over horses: although notorious for their questionable temperament, they can be docile when handled correctly and are less nervous than horses. As desert creatures, camels also have greater stamina and can endure long periods without water. This advantage offered a certain strategic flexibility to commanders, as long treks in arid conditions could then be undertaken. When faced by conventional cavalry, the size and odour of camels caused horses to rear-up and back away in a fight. The invention of the north Arabian saddle in the 4th century BC made effective control considerably easier; the steady, elevated position of the saddle enabled an archer to scan the battlefield and pick his targets off with some ease."	"True"
