"unit_description_historical_texts_text_dk_nab_scythed_chariots"	"Heavy scythed chariots developed during the Greco-Persian Wars as a response to armoured infantry and the phalanx. Although many cultures used them, the original idea was probably Persian or Indian. Others took up the idea, and Mithridates VI of Pontus had some success using scythed chariots against Bithynia during the Battle of the River Amnias in 89BC, at the start of the First Mithridatic War. They relied on their momentum and axle-mounted blades to break enemy lines, creating weak points to be exploited by cavalry. Even if the chariot horses instinctively veered off at the last moment, the long axle blades would carve an opening. If any still stood, there was a good chance confusion and panic in the survivors would set in. Both the horses and drivers eventually had quite heavy armour, reminiscent of later cataphract cavalry. When fighting against scythed chariots, the simplest thing to do was open ranks and allow them to pass through, before quickly closing up again. However, the introduction of the long sarissa countered their effectiveness somewhat better."	"True"
"unit_description_historical_texts_text_dk_num_african_elephants"	"The now-extinct African forest elephants were smaller than the Indian variety. At around two to two and a half metres in height, they were an imposing beast capable of causing panic in enemies unused to facing them in battle. Having fought Syracusan elephants in Sicily in 278-276BC, the Carthaginians captured and tamed the local elephants rather than importing larger specimens from India. The Carthaginians did, however, hire Indian experts to form the most powerful elephant corps of the period. At Bagradas River in 255BC, the Carthaginian elephants caused many casualties, leaving the Romans fearful of battling the creatures for many years afterwards."	"True"
"unit_description_historical_texts_text_dk_saba_sabaean_spearmen"	"The warriors of the Sabaean region were light infantry, cavalry and archers, and fought as mercenaries and auxiliaries for the Roman Empire. Dressed desert-fashion, they were entirely familiar with and comfortable in arid places. This was secondary however, to their reputation as mostly-reliable fighters, of far more worth than ordinary citizens or levies. This was due to the independence that the Sabaean kingdom maintained from the 8th century BC to AD275. This record was based on military might as well as diplomacy and the spice trade including frankincense and myrrh. Never conquered by Rome, Sabaean warriors still found work as mercenaries and auxiliaries in Roman service."	"True"
"unit_description_historical_texts_text_3c_Scatha_Shadows"	"A powerful warrior woman and a legendary general, Scatha or Scáthach is a major character in the mythological Ulster Cycle. Known as 'the Shadow' and 'the Warrior Maid', colour plates have been discovered that depict Scatha teaching Cú Chulainn of Ulster the many ways of battle, and even gifting him the "friendship of her thighs" near the end of his training! Naturally, with such an auspicious start, Cú Chulainn goes on to become a legendary figure in his own right. It is notable that the Celtic martial arts were usually taught by women, some believing that the teachers were also priestesses, and that they conferred additional powers to their chosen students when in battle."	"True"
"unit_description_historical_texts_text_inv_venetian_horse"	"The Veneti were considered to be excellent horse-breeders widely known for producing the strongest and fasters mares in ancient Italy. Venetic horses were greatly sought-after by the Greeks; they famously won the Olympic Games for Leon of Sparta in 440BC. Dionysius of Syracuse wanted to repeat this success himself, buying Venetian horses for a four-horse chariot race during the Olympic Games in 388BC. Diodorus of Sicily reported that several four-horse teams raced for Syracuse, and were far superior to the other contenders due to their swiftness. In Veneti society, Horses played an important role, as attested to by the horse cemeteries found around the ancient cities of Patavium, Altinum and Atria. Wild horses living on the slopes of the Alps were incorporated into domestic herds by the able Veneti horse-breeders, which enabled them to cultivate their stables and in turn, their reputation and social status. Several Venetic inscriptions mention the word 'ekuperatis', which means 'master of the horse' and perhaps refers to commerce, warfare, nobility, or all of the above."	"True"
"unit_description_historical_texts_text_Ste_Sarmatian_Royal_Lancers_Long"	"The Sarmatians were a western group of steppe peoples, and occupied the area north of the Black Sea, bordering Dacian and Germanic lands. They roamed this region as they pleased, and had a fierce reputation as cavalrymen almost without equal. They were feared by the Greeks, and often worked as mercenaries or allied themselves to the Dacians. The Sarmatians were always horse archers, but their cavalry gradually adopted heavier and heavier armour as the centuries passed, eventually wearing as much armour as the famed cataphracts of the east. Even the horses wore full suits of scale armour. The riders kept their fearsome bows even as they became magnificent shock cavalry. With each man carrying a kontos, a long two-handed lance, they could smash through almost any enemy foolish enough to stand against them."	"True"
"unit_description_historical_texts_text_dk_kush_kushite_bowwomen"	"From their position on the Nile, the Kushite Nubians profoundly influenced the world around them. They have an impressive history from their tribal beginnings, through their time as part of the New Kingdom of Egypt to the rise of their own empire, when the kingdom – or Kush – extended across large tracts of southern Egypt. They repelled multiple Roman advances, and even survived the sacking of their capital during the 1st century BC. Though their kingdom declined in late antiquity, the Kushites remained a geopolitical and military force to be reckoned with and were never absorbed into the Roman Empire. They were famed for their formidable archers, with man and bow working as one."	"True"
"unit_description_historical_texts_text_Ste_Saka_Noble_Armour_Lancers_Long"	"The Saka, as they were called by the Persians, were a steppe people who lived and died by their horsemanship. As in all warrior societies, the heaviest armour was reserved for use by the nobility of the tribes, and Saka nobility could be deadly indeed. As a people, they showed little inclination to bow to any outsider. In 512BC, King Darius the Great attempted to subdue the Saka, and marched into their steppe lands.  It did him little good. The tribes avoided open battle, and raided whenever and wherever they pleased. Alexander the Great, almost two centuries later, eventually lured the Saka into battle at Jaxartes in 329BC. Even though Alexander won, he recognised that he could not tame them and released all his Saka prisoners in exchange for an oath to end their depredations. The Saka kept their word."	"True"
"unit_description_historical_texts_text_Mer_Ger_Spearwomen_Long"	"There are several legends from the ancient period concerning the exploits of Germanic female warriors. Womens' graves have also been found to contain spears, shields, and daggers, indicating that they may have fought alongside their men on the battlefield, rather than in a purely defensive capacity when their settlements were attacked. It was certainly common for women to have status and power within Germanic tribal society; they were able to inherit them following the death of their fathers or husbands, and could even demand divorce following an unsuccessful match. In common with the traditions of their Celtic neighbours, the opinion and judgement of Germanic priestesses and female elders was also highly respected by all."	"True"
"unit_description_historical_texts_text_3c_Pal_Scythed_Chariots"	"Although many cultures used scythed chariots, the original idea was probably Persian or Indian. They relied on their momentum and axle-mounted blades to break enemy lines, creating weak points that could then be exploited by cavalry. Even if a chariot's horses instinctively veered off at the last moment, the long axle blades would carve an opening. If anyone in the enemy line was still standing, there was a good chance confusion and panic in the survivors would set in. Eventually, both the horses and drivers had quite heavy armour, reminiscent of later cataphract cavalry. When fighting against scythed chariots, the simplest thing to do was open ranks and allow them to pass through, before quickly closing up again, which was a tactic Alexander famously used at Gaugamela. However, the introduction of the long sarissa spear countered their effectiveness somewhat better - the chariot drivers could be skewered long before their deadly scythes reached the frontline."	"True"
"unit_description_historical_texts_text_inv_rom_rorarii"	"Rorarii' were lightly armed, early Republican units equipped with spears, javelins and light helmets, but without body armour. Like the heavier-armed and armoured Triarii veterans they most likely supported, rorarii were the army's reserves, only to be used in dire emergencies where both the hastati and principes had begun to waver. This three-line approach was the standard Roman formation until Gaius Marius' extensive military reforms during the 1st century BC, in which each soldier became an all-purpose 'legionary', with standardised state-issued equipment, training, pay and pension quickly transforming the Romans into the state-of-the-art super-soldiers of the ancient world."	"True"
"unit_description_historical_texts_text_Ger_Wodanaz_Spears_Long"	"Wodanaz is, in many ways, the all-encompassing Germanic god. Worshipped throughout the tribes, known as Odin within Norse mythology and thought to be the equivalent of Mercury from the Roman pantheon, all-powerful Wodanaz inspired German warriors as the bringer of victory. It was he who stood in judgement over a conflict; he who would ultimately decide the victor. Any warrior who fell in battle automatically joined the war god’s own army. Wodanaz also carried a mighty spear, and those men with the strength and status to carry larger thrusting spears fought in his image. A German warrior would routinely call upon the gods in preparation for battle, his shield brought close to the mouth to amplify and deepen the sound, further intimidating the enemy."	"True"
"unit_description_historical_texts_text_dk_num_armoured_numidian_spearmen"	"Numidia had a fierce warrior tradition, partly because the eastern Massylii and western Masaesyli had a history of bitter feuding and internal warfare. They took, and changed, sides in the Punic Wars to suit their own agendas, only emerging as a single state after the cataclysmic Battle of Zama in 202BC. The defeat of Carthage allowed the Numidians to expand their lands, eventually leading to the Jugurthine War of 112-105BC against Rome. Numidia’s king, Jugurtha, was only defeated when he was betrayed by his father-in-law, Bocchus. While the Numidians were famed as cavalrymen, their infantry forces were also quite effective. The historian Suetonius mentions that there were Numidian 'legions', a term reserved for Roman troops, when passing comment on Julius Caesar’s speech regarding Juba’s march to aid Scipio before the Battle of Thapsus in 46BC. This suggests that some Numidians were fighting in the Roman style, and were possibly equipped in the same manner. The Numidians also adopted other tactics and war gear, such as the thureos-style shield and hoplite-like spears."	"True"
"unit_description_historical_texts_text_3c_Cal_Highland_Archers"	"In the cold northern lands of Britannia, food was scarce and most physically-able Celts hunted for their tribe's chief source of sustenance. Using longbows mostly made of yew, they became proficient at trapping and ambushing their prey. Even though archery was considered cowardly within a way of battle that favoured the heroic (but often suicidal) charge above all else, when war came to the Celtic lands hunters did not abandon their ranged weapons. While not as strong as regular melee fighters, along the hills and within the dense forests, marksmen had the advantage against the slow-moving Roman Legions. This irregular, guerrilla warfare used by the Caledonii was particularly suited to highland archers, who picked off their targets before retreating into dense woodland where it was unlikely they would be followed."	"True"
"unit_description_historical_texts_text_dk_nab_armoured_desert_hoplites"	"The Nabataeans, although in dire relations with the Seleucids, borrowed many Hellenistic practices. As their empire expanded, the Seleucids tried to fold many nearby territories into it, looking to put a hand on the lucrative trade routes of southern Arabia as well. In the numerous military engagements between the two states, the Nabataeans developed the need to copy the greater disciplined, better structured Hellenistic way of fighting. They also used captured gear and although they were bitter rivals, admired the Greeks for their culture and civilisation. Most famous of these encounters are the Antigonid–Nabataean confrontations in 312BC. In the first instance, Antigonus appointed one of his officers, Athenaeus to pillage Petra. He did so successfully, as the defenders were away trading during the night of the raid. Not only was their stock captured, but also families, to be traded as slaves. However, the Nabataeans quickly realised the situation and were able to hunt down the 4,600-strong army and almost wipe it out, with only a few dozen escaping. Athenaeus was not among the survivors."	"True"
"unit_description_historical_texts_text_Cel_Galatian_Noblemen_Long"	"The fierce and proud Galatians dominated central Anatolia and eastern Phrygia. Having splintered from the migrating Celts following Brennus’ invasions of Macedon and Greece in 279BC, three tribes, the Tectosages, Tolistobogii and Trocmi, moved through Thrace and crossed the Bosporus into Asia Minor. They came as allies of Nicomedes of Bithynia and secured a victory for him in a dynastic struggle against his brother. After a brief and inconclusive war between Nicomedes and the Seleucid king, Antiochus, the Galatians settled down to stay. Their territory was split between the three tribes, each maintaining its own capital, but with a council at Drynemeton, a sacred grove of oaks near the Tectosages’ capital at Ancyra. Ruled by a military aristocracy, the Galatians left the indigenous Cappadocian people in control of their own towns and lands in return for tithes. Galatian mercenaries were highly prized and respected by Greek, Roman and Seleucid commanders. In fact, the personal bodyguard of the Ptolemies of Egypt consisted of Celtic mercenaries, and it is highly likely that these men came from Galatia."	"True"
"unit_description_historical_texts_text_Afr_Tribal_Slingers_Long"	"Slingers were common in ancient armies. Slings are ancient weapons, dating back to Palaeolithic times. In comparison to bows, they were easy to make and had a greater effective range. Constructed from braided flax, hemp or rushes, a sling has a cradle where the shot is placed. One end has a finger-loop, while the other has a knot or strip giving a firm handhold. The slinger puts his middle finger through the loop and holds the knotted end with his thumb and forefinger. After whirling the shot in the sling it is released with a flick of the wrist. Quick to fire and reload, the sling was widely hated by those on the receiving end. Shot varied from stones collected in rivers to shaped lumps of clay and lead; lead shot could fly over 400 metres. Such missiles were sometimes inscribed with comments such as “Catch!” or “Take that!” Shot was difficult to see in flight, and although it lacked the penetrating power of an arrow it could easily break bone or stave-in armour at short ranges. Famously, the Roman Consul Paulus was killed by a slinger early in the disastrous Battle of Cannae."	"True"
"unit_description_historical_texts_text_Rom_Praetorian_Cav_Long"	"The word 'praetorian' comes from the elite guards of the Praetor, the commanding general. Founded in the 6th century BC, the cohors praetoria consisted of the hand-picked infantry or cavalry who guarded their general and his command tent. At first, they were recruited exclusively from among Roman citizens, but later other Latin peoples were allowed to join. The praetorians enjoyed prestigious status in the Roman army and, when Augustus came to power, they were the only soldiers allowed inside Rome. Augustus anticipated that they could be used politically as well as militarily, something of a gamble for the new Emperor, as he was keen to assert the Republican nature of his regime. Barracked just outside Rome, the praetorians were charged with keeping order during all public events. Later, as the Imperial bodyguard, they served in military campaigns only when the Emperor himself was present. This happened frequently as later Emperors emerged from the ranks of the army during the 1st century AD."	"True"
"unit_description_historical_texts_text_3c_Celtic_Levy"	"Levies could be quickly mustered, outfitted and turned into an army, whether citizens or subjects. Usually commanded by nobles or local dignitaries, levies supplemented the elite professional soldiers; the king would order his subordinates to muster troops and gather at an appointed time and place. These noblemen brought their households, attendant warriors, and levies. Over time there was a gradual move away from citizen and subject recruits to professional standing armies and a greater use of mercenaries. Both classes were formerly levies who saw warfare as a career rather than a duty. In turn, this opened the way for promotion on merit rather than birth, creating armies loyal to generals rather than the old social order."	"True"
"unit_description_historical_texts_text_3c_Aux_Thracian_Generic"	"There were some forty tribes of Thracians, who shared a common language and culture and inhabited a vast area north of the Greek lands. They were seen as war-loving, rebellious, rambunctious, and bad enemies, yet good allies in a fight. Many leaders dreaded a time when the Thracians would be united under a single leader and sweep southwards. Such a turn of events never happened, but Thracians could be found across much of the European world fighting as mercenaries, often specialising as skirmishers and light troops. The forward curving rhomphaia, with its razor-sharp blade and long handle, could lop off limbs in the hands of a skilled user, and Thracians were certainly skilled in its use. The most famous Thracian 'general' of all never actually fought an action in Thrace or in command of a Thracian army; he was Spartacus, the commander of the last great slave rebellion against Rome between 73 and 71 BC."	"True"
"unit_description_historical_texts_text_3c_Aux_Numidian_Cavalry"	"Numidian tribesmen were raised with horses from an early age, riding bareback without a bridle and controlling their horses by tapping the beasts between the ears with a stick. Numidian cavalry were supremely agile, skirmishing with assured expertise before swinging around to escape as rapidly as they had arrived. Wearing only a thin tunic, they carried javelins and small wicker shields. Their horses, ancestors of the Berber horse, were small and well adapted for speed over long distances. Harassing tactics, while rarely decisive, were extremely frustrating to less mobile enemies, but not so useful against heavier types of cavalry. Described as "by far the best horsemen in Africa" by the historian Livy, their strength was recognised by Rome as a great military asset."	"True"
"unit_description_historical_texts_text_3c_Rom_Legionary_Cavalry"	"By recruiting horsemen from Iberia, Gaul, Numidia and Thrace, Roman cavalry adapted to accommodate the army's changing needs and resources. Each Legion originally included 300 equites and 600 to 900 socii, so a typical consular army fielded between 1800 and 2400 horsemen. However, in order to cope with the demands of a growing empire, there was a gradual shift away towards using cavalry from outside the Italian peninsular. As equites became legionary officers and the socii citizens, cavalry recruits from Italy became scarce. By the time of Caesar’s Gallic campaigns the Legions relied almost exclusively on allied cavalry. Equipment changed little during this period; the spear and chainmail adopted by the equites, and probably influenced by the Celts, came full-circle with the recruitment of Gallic cavalry. Nevertheless, helmet and shield styles changed and the small, round shield of the equites, via the Galatians of Asia Minor, gradually became the versatile 'thureos'."	"True"
"unit_description_historical_texts_text_Rom_Polybolos_Long"	"The polybolos was a repeating bolt thrower developed from the ballista and scorpion. A chain mechanism drew, loaded and released bolts from a gravity-fed magazine as quickly as a handle could be turned. Supposedly invented by Dionysius of Alexandria, the polybolos was quite a complex machine: as the operator turned a windlass handle, the bow was tensioned as a launching shuttle pulled back, an arrow dropped into place, and finally a catch was released to fire the machine. The process repeated as long as the operator worked. All he needed was a loader to keep the magazine filled. Efficient and deadly, the polybolos had the greatest rate of fire of all ancient war machines."	"True"
"unit_description_historical_texts_text_Cel_Gallo_Thracian_Long"	"In the century following their settlement at Tylis in northern Thrace, the remnants of Brennus' great Celtic migration did more than simply raid and pillage the surrounding territories. Over the years, a natural absorption of cultural ideas and military techniques occurred due to the Celts' close proximity to their Thracian neighbours. Inevitably, this process was strengthened by inter-marriage, eventually producing a new generation of Gallo-Thracian warriors. These men, the product of two such distinct martial cultures, were steeped in the best elements of each. As such, they fought as heroic swordsmen in the Celtic tradition, yet were instilled with the stealth and swift-footedness of the finest Thracian skirmishers. This combination of strengths ensured that to face the Gallo-Thracians in battle was an extremely dangerous proposition for any would-be foe."	"True"
"unit_description_historical_texts_text_Ibe_Lusitani_Nobles_Long"	"The Lusitani were an Iberian tribe, renowned for producing light skirmish warriors. They, along with other Iberians, presented a distinct and unpleasant challenge to Roman arms; Lusitani were even present among Hannibal’s ranks at the Battle of Cannae in 216BC. During the Roman incursions into Iberia between 155-139BC the Lusitani resisted, particularly once they had been lied to by, and subsequently massacred on the orders of, Servius Sulpicius Galba, the Praetor of Rome’s Iberian forces. He had convinced the Lusitani to give up their arms, and then had them slaughtered by his Legions. Seeking revenge, the Lusitani went on to fight a bitter guerrilla war against the invaders."	"True"
"unit_description_historical_texts_text_Ill_Tribesmen_Long"	"Although called Illyrians by Greeks and Romans, these seafaring people from the Adriatic coast were actually not a single nation or tribe. The Greeks first had dealings with them during the Bronze Age, and the name was then applied to everyone in the area. The Illyrians were actually several petty, and not-so-petty, kingdoms that warred with each other when not fighting Greeks or their Macedonian neighbours. The Illyrians could not be lightly dismissed as barbarians: under powerful warlords such as Bardyllis, king of the Dardanians, they conquered Macedon and installed a puppet ruler in 393BC. It was Phillip II and Alexander the Great who eventually ended Illyrian interference in their affairs. The Illyrians were also pirates, and terrorised the Adriatic for centuries; this was what eventually prompted their subjugation by the Romans."	"True"
"unit_description_historical_texts_text_Ibe_Tribesmen_Long"	"Like many warriors, Iberian tribesmen were stubborn beyond all reason in defence of their gods, homes, lands and honour. Even when cornered, surrounded and beyond all hope, defeat was not an idea that could be entertained for a moment. In fact, rather than accept the shame of defeat they were known to kill themselves. Possibly they also hoped to deny the enemy the glory of having killed them. Some warriors went into battle carrying vials of quick-acting poison, carefully extracted from a variety of buttercup. All Strabo, the Greek historian described the poison as “…a herb that is nearly like parsley and painless…”, he was not being terribly accurate. Like all poisons, it hurt, and it caused the user’s face to contort into a horrid, sardonic grin before death came. This morbid, mocking expression unnerved enemies, even Romans, who were convinced that the smiling corpses were mocking their foes from the afterlife."	"True"
