"unit_description_historical_texts_text_Gre_Levy_Pike_Long"	"Throughout the civilised world, levies formed the backbone of armies. Drawn from the ordinary citizens or subjects, they were in a tradition that, in Greece at least, began with the hoplite warfare of the city-states. What levy pikemen lacked in fighting skills when compared to professionals and mercenaries, they made up for in numbers. Equipped with sarissas, or long pikes, these levy phalanxes were a formidable wall of spear points. Initially, the citizen-levies of Greek city-states were expected to provide their own arms and equipment. As time passed, however, the citizen army developed into a more organised body for which arms and equipment were provided by the state. At the same time, personal loyalty to an individual general or king replaced old-fashioned civic duty."	"True"
"unit_description_historical_texts_text_Rom_Ballista_Long"	"At close targets, a ballista could be aimed effectively but accuracy came at a cost in range; it could fire around 500 metres. The machine used two torsion springs with levers inserted into twisted ropes made from animal sinew, giving incredible power for its size. Firing either solid shot or bolts, it was equally effective against infantry or cavalry, but could also be deployed to destroy light fortifications during sieges. Originally developed by the Greeks around 400BC, and based on the oversized Oxybeles composite bow, ballistae were widely used by many cultures of the period, including the Romans. Later Roman versions included adjustable caps that enabled crews to quickly alter the tension of each sinew bundle to provide balance and therefore improve accuracy."	"True"
"unit_description_historical_texts_text_Rom_Evocati_Cohort_Long"	"After a Roman legionary had finished up to 25 years in the army, he could be asked back to join the 'evocati', the ranks of 'those who are called'. Usually affiliated to their old commander or re-enlisting at the bequest of a particular Consul in times of need, veterans were afforded great respect and honour because of their previous service. As examples to the common soldier, they were often immediately promoted to centurion and given a pay rise. Crucially, veterans were exempt from the mundane and laborious tasks of legionary life such as digging latrines, building roads or making camp. During the civil war all sides called on old soldiers to swell their ranks and provide much needed experience, Pompey persuading a large number of evocati to join him against Julius Caesar by promising them promotion and more money to return. The veteran 'Praetorians of the Evocati Augusti' were held in especially high regard."	"True"
"unit_description_historical_texts_text_Gre_Thureos_Spears_Long"	"Light Greek infantry, the thureophoroi developed around the early 4th century BC, and straddled the gap between the phalanx and the skirmishing peltasts. Named after the thureos, their large oval shields, they were more heavily armoured than the traditional Thracian and Greek peltast. Able to both skirmish and form up as a phalanx, they were used to guard the flanks and protect other light troops. Their shield, normally made from wood and covered with leather, had a central handgrip that was protected by a vertical spine and a metal boss-like strip, and may have been inspired by Celtic or Roman shields of the time. Like the longer sarissa, the spears used by the thureophoroi had a weighted butt-spike to provide balance, but this also allowed them to throw javelins, if so equipped, by jamming their spears into the ground. Able to fulfil a variety of roles, thureophoroi were common amongst both citizen and mercenary units of the Greek city-states until they were eclipsed by the Macedonian phalanxes of Phillip II and Alexander the Great."	"True"
"unit_description_historical_texts_text_dk_saba_desert_spearmen"	"The Arabian Peninsula was not a state, but a land occupied by inter-related tribes and powerful families. The nomadic Bedouin raised sheep and traded goods across the desert, while farmers were settled around the oases. The camel helped the nomadic tribes to grow in power, and the variety among the tribes produced many different fighting styles, but infantry nevertheless remained important in Arab armies. Although unarmoured slingers were fast and effective skirmishers, and Arabs also prided themselves on their close-combat skills. Traditionally, they fought as raiders looking for loot rather than conquest. Raids or 'razzias' brought honour to the victors, as well as the spoils of livestock and goods for their tribes. Conflicts were usually small in scale and casualties were largely avoided, as a fighting retreat in the face of great odds was not considered shameful. After the conquest of Egypt, Rome had to cross the Arabian Peninsula in order to secure the lucrative trade with India, but the Romans never fully conquered the desert or the desert peoples."	"True"
"unit_description_historical_texts_text_dk_nab_nabatean_swordsmen"	"The Arabian Peninsula was not a state, but a land occupied by inter-related tribes and powerful families. The nomadic Bedouin raised sheep and traded goods across the desert, while farmers were settled around the oases. The camel helped the nomadic tribes to grow in power, and the variety among the tribes produced many different fighting styles, but infantry nevertheless remained important in Arab armies. Although unarmoured slingers were fast and effective skirmishers, and Arabs also prided themselves on their close-combat skills. Traditionally, they fought as raiders looking for loot rather than conquest. Raids or 'razzias' brought honour to the victors, as well as the spoils of livestock and goods for their tribes. Conflicts were usually small in scale and casualties were largely avoided, as a fighting retreat in the face of great odds was not considered shameful. After the conquest of Egypt, Rome had to cross the Arabian Peninsula in order to secure the lucrative trade with India, but the Romans never fully conquered the desert or the desert peoples."	"True"
"unit_description_historical_texts_text_dk_num_gaetuli_tribesmen"	"Drawn from a vast area and numerous tribes, the warriors of sub-Saharan Africa were unsurprisingly diverse in appearance and culture. They all possessed long and rich warrior traditions, such as the Numidians, the Nubians and their descendants who ruled Kush, and Aksum. Despite tribal differences, weapons and equipment differed only in detail: spears, javelins, bows and short swords were favoured. Relatively little armour was worn, but some tribes did employ wicker, wood or hide shields. Adornments and decorations varied greatly and some groups sported war paint. Aethiopians in Persian service were known for painting themselves chalk white on one side and vermillion on the other, and using spears and bows of palmwood. Fighting as allies and mercenaries for Carthage, Persia, and the eastern Successors, tribesmen could be found throughout Africa and Asia Minor."	"True"
"unit_description_historical_texts_text_inv_iolei"	"The Iolei were an ancient Nuragic tribe who lived on the island of Sardinia during the Bronze and Iron Ages. According to legend, recorded by Greek historians, their name can be traced back to Iolaus, a hero, who led the sons of Heracles to Sardinia and founded a colony there. The Sardinian people were content to live quietly in peace, keeping to the mountainous regions in central Sardinia, building nuraghe and subsisting on agriculture, animal husbandry  and fishing. However, around 900BC Phoenicians began sailing to Sardinia, establishing trade routes and relations with local merchants. As Carthage grew and set its sights on conquest and empire-building, an expedition was launched in 540BC against the Iolei, led by Malco. The expedition failed, as the Sardinians used guerrilla warfare - their skill with the bow and knowledge of the arduous terrain drove the Carthaginians from the island. Subsequent invasions of Sardinia, first by Mago in 509BC (as a response to Iolean attacks on coastal cities) and later by his brother Hamilcar. Eventually, the onslaught proved too great and the Sardinians were overcome. Coastal Sardinia was occupied by Carthage, but the Nuragic people remained unconquered, retreating into the island's central mountain range. According to Strabo, the Iolei were never truly subjugated, even following the rise of the Roman Empire."	"True"
"unit_description_historical_texts_text_Aux_Ita_Socii_Equites_Long"	"These equites were drawn from amongst the Socii, allied non-citizens who provided most of the early Republic's cavalry. As there were typically two or three times the number of Socii than Roman cavalry, a consular army of two Legions could have some 1,800 Socii cavalry, of which at least 600 would be considered part of the elite equites extraordinarii. By tradition, Roman cavalry was habitually deployed on the right flank, while the Socii equites were sent to the left. This imbalance was famously exploited by Hannibal at the Battle of Cannae in 216BC, when the Carthaginian cavalry under Hasdrubal routed the weaker Roman cavalry while the crack Numidian light cavalry waylaid their Socii allies, such was the difference in troop quality. Following the Marian Reforms, and the Allied Wars of 90-88BC, the Socii were reduced to nothing; as full citizens they were absorbed by the regular Roman Legions."	"True"
"unit_description_historical_texts_text_Rom_Onager_Long"	"Named after the wild ass with a dangerous kick, the onager catapult had a mighty kick all of its own, as crews quickly discovered. Although not accurate, it could hurl extremely heavy missiles over significant distances. Its throwing arm was pushed through a twisted bundle of animal sinew, held in a solid wooden frame. Pulled back, the tension in the sinew held an incredible amount of power until the arm snapped forwards and the deadly cargo was launched. The arm smacked into the frame, and it was this impact on every shot that made the entire machine lurch about unpredictably. An area-attack weapon, the onager was best suited to siege work, but it could be fired against tightly packed units of troops as well. The missiles launched could be as varied as rocks, clay pots filled with incendiary mixtures, and even dead bodies to spread disease and despair. Severed heads were gruesomely fired into besieged towns from time to time, as a warning of what was to come. Easily constructed from timber, the onager was used throughout the ancient world."	"True"
"unit_description_historical_texts_text_3c_Cal_Caledonian_Heroic_Riders"	"The Celtic people believed that many supernatural creatures and spirits roamed the world around them, and that people could earn their favour or incur their wrath through their actions. Celtic hunters never dared to hunt without their deities' blessings, offering payment of domestic animals and heeding natural portents and signs. Oft-times, the most adept hunters were also the best riders; they aspired to be as powerful and fearsome as the Wild Hunt, the gods' sky-borne hunting party of legend. In battle, they saw the enemy as nothing more than prey to be chased and captured or killed. As relentless as bloodhounds and as fast as the whistling wind, they never gave up the Hunt unless death intervened."	"True"
"unit_description_historical_texts_text_Gre_Cimmerian_Heavy_Archers_Long"	"From the same root as the Thracian tribes, but ruled by a military elite of Iranian descent, the Cimmerians founded a kingdom of Greek colonies centred on Panticapaeum. Displaced from the steppes by their Scythian neighbours, some Cimmerians also migrated south of the Black Sea, settling in Cappadocia. Prosperous and wealthy traders, the Hellenistic world turned a blind eye to the Cimmerian tyrant kings, the import of vital wheat, fish and slaves outweighing Greek sensibilities. At their height, around 700BC, the Cimmerians had been mercenary allies of the Assyrians, and their armies had conquered Colchis, Iberia and Phrygia. With the migration of the Scythian tribes the fortunes of their empire dwindled, but their elite warriors continued to be valued as mercenaries. Their style of warfare was a mixture of Thracian, Iranian and Scythian influences, and principally focused on cavalry and chariots."	"True"
"unit_description_historical_texts_text_Eas_Noble_Blood_Cav_Long"	"Like the Companion cavalry of Macedon, these elite horsemen from the lands of Parthia and Pontus were recruited from among the nobility and social elite. Gradually they developed into a permanent and professional bodyguard force. Following both Hellenic and Persian traditions, they were armed with lances and armoured in a similar fashion to their Macedonian counterparts, but their mounts were armoured in eastern style. This gave their charges extra weight and meant that they were not only a counter to other cavalry forces, but could also be sent into the flanks of densely-packed infantry. The eastern influence also meant that the nobles were quite at home using the bow, as they had spent their formative years hunting from horseback."	"True"
"unit_description_historical_texts_text_Gre_Helot_Javelinmen_Long"	"An unfree class of non-citizens within Sparta's zone of control, the helots were slaves in most respects. Agricultural labourers, they worked the rich valleys of Eurotas and Pamisos, on which Laconia and Messenia were situated, and were forced to give up half of their produce to the Spartan elite. In addition, helots would also be assigned to Spartan citizens as household servants. Sometimes pressed into military service, helots would be employed as peltasts, and in some cases gained their freedom through such service. Following an earthquake in 464BC which devastated Sparta and possibly claimed as many as 20,000 lives the helots, mainly from Messenia, revolted alongside the perioikoi of Aithaia and Thouria. Cruel and bitter treatment of the helots by their Spartan overlords intensified after this event, and may have led to the tradition of the autumnal krypteia. A declaration of war against the helots made by the ephors, during the krypteia members of the Spartan agoge could prove their skill as warriors. Armed only with a knife, they were expected to live off the land whilst sanctioned to spy on, steal from, and kill the helots. However, this worked both ways, as any young Spartan caught by the helots could be beaten to death for allowing his capture."	"True"
"unit_description_historical_texts_text_dk_kush_shotel_warriors"	"Originating in ancient Ethiopia, the shotel is a curved sword, similar to the Near Eastern scimitars. Its curve, however, is much more prominent with an almost semi-circular shape. They were also used differently. Abyssinian warriors, fighting behind large shields, did not use fencing techniques. Instead, the shotel's main purpose was not to cut and slice; it was used to hook mounted warriors off their rides as well as to reach behind the enemy's shield when fighting on foot. Unlike the Afar guile, the shotel's upper edge is unsharpened and can be used braced against the swordsman's shield for strength. Collectively the shotel and the other Ethiopian swords are known as Han'e."	"True"
"unit_description_historical_texts_text_Gre_Beehive_Onager_Long"	"Named after the wild ass with a dangerous kick, the onager catapult had a mighty kick all of its own, as its crews quickly discovered. Although not accurate, it could hurl extremely heavy missiles over significant distances. Its throwing arm was pushed through a twisted bundle of animal sinew fixed into a solid wooden frame. Pulled back, the tension in the sinew held an incredible amount of power until the arm snapped forwards and the deadly cargo was launched. At this point, the arm smacked into the frame, and it was this impact from every shot that made the entire machine lurch unpredictably. An area-attack weapon, rather than a deadly-accurate one, the onager was best suited to siege work, but could also be fired against tightly packed units of troops. It could be used to launch a variety of missiles: rocks, clay pots filled with incendiary mixtures or stinging animals such as bees, and even dead bodies to spread disease and despair. Somewhat gruesomely, severed heads were fired into besieged towns from time to time as a warning of what was to come. Easily constructed from timber, the onager became a popular weapon throughout the ancient world."	"True"
"unit_description_historical_texts_text_Gre_Peltasts_Long"	"These skirmishers were named for their small crescent-shaped leather or wicker shields or 'peltai'. It was a common habit to name troops for their shield style in the Greek world. They wore little or no armour and carried three javelins. After harassing the enemy by flinging javelins, they would hastily retreat before any counter-charge or flanking move could be carried out. As armies developed and tactics became more complex, peltasts were expected to take part in hand-to-hand combat: with such expectation they were given stiffened linen cuirasses and short swords. They were still expected to use javelins, but could then join in the close fighting. Eventually, peltasts even exchanged their characteristic shield for the  heavier thureos. Their name and battlefield function remained unchanged."	"True"
"unit_description_historical_texts_text_dk_saba_merc_maas_gat_marauders"	"The warriors of the Sabaean region were light infantry, cavalry and archers, and fought as mercenaries and auxiliaries for the Roman Empire. Dressed desert-fashion, they were entirely familiar with and comfortable in arid places. This was secondary however, to their reputation as mostly-reliable fighters, of far more worth than ordinary citizens or levies. This was due to the independence that the Sabaean kingdom maintained from the 8th century BC to AD275. This record was based on military might as well as diplomacy and the spice trade including frankincense and myrrh. Never conquered by Rome, Sabaean warriors still found work as mercenaries and auxiliaries in Roman service."	"True"
"unit_description_historical_texts_text_dk_num_armoured_numidian_riders"	"Numidian tribesmen were raised with horses from an early age, riding bareback without a bridle and controlling their horses by tapping the beasts between the ears with a stick. Numidian cavalry were supremely agile, skirmishing with assured expertise before swinging around to escape as rapidly as they had arrived. Wearing only a thin tunic, they carried javelins and small wicker shields. At Cannae, the highpoint of Carthaginian military success, Hannibal’s right wing consisted of 3,500 Numidian cavalrymen. The Numidians attacked the Romans' allied cavalry and chased them from the field before returning to smash into the rear of the Roman lines. Considered the elite of the Carthaginian army during the Second Punic War, the Numidians' defection before the Battle of Zama arguably led to Scipio’s victory over Hannibal in the final stages of the conflict."	"True"
"unit_description_historical_texts_text_inv_lucanian_tribe"	"The Lucanians are an ancient Italic tribe from the southern Italian region of Lucania. Oscan in origin, they are said to have migrated from the Apennine mountains, driving away or assimilating the indigenous tribes of Oenotrians, Chones and Lauternoi. In terms of their appearance and culture, the Lucanians were quite similar to the Samnites, wearing similar triple-disc armour and large, bronze belts over their tunics in battle. Lucanian tribes were warlike in nature; their forces fought their Greek neighbours on more than one occasion, against the Italiote League and Taras. According to Diodorus' chronicles, Lucanian warriors also participated in the wars between Dionysius I of Syracuse and the Greeks of southern Italy, joining the tyrant's forces as mercenaries. Rome also fought the Lucanian tribes, albeit late in the 4th century BC, during the Samnite Wars."	"True"
"unit_description_historical_texts_text_Gre_Spartan_Youths_Long"	"Toughened by years of training within the agoge, Spartan youths were moulded into warriors from the age of seven, becoming 'paidiskoi', or Spartan reserves, in their later teenage years. Separated from their mothers, the first stage of their training was the 'paides', in which they lived communally in one of the Spartan syssitia mess halls. Here they trained and exercised together, learning from their elders, and were purposefully underfed to toughen and accustom them to hunger, and teach them resourcefulness. This extended to depriving them of clothing too, providing only their red cloak each year. This taught the boys to steal, for which they were severely punished if caught, but for being caught, not for stealing from the helot slave population. At eighteen, they became paidiskoi, joining the army as reservists for two years. Armed with the hoplite spear and hoplon, and armoured in cloth, they would support the older Spartan men in battle. A chosen few would also be inducted into the krypteia, a secret organisation that were expected to spy on, steal from and kill the helots. Seen as both a test of ability and a necessary means of keeping the helots submissive, a declaration of war against the helots was made each autumn, effectively legalising the krypteia’s activity."	"True"
"unit_description_historical_texts_text_3c_Aux_Iberian_Cavalry"	"The Iberians harboured a great deal of respect for horses, even worshipping them as divine creatures. In times of war the horse had previously played a minor role, but gradually progressed from a symbol of prestige, and s noble warrior’s ride to the battlefield, to becoming a major presence in the battle itself. Blessed with horses of great quality, Iberian cavalry grew to become one of the most potent weapons of the ancient world. Their horses were as fast and nimble as the renowned Numidian steeds, and having been trained to cope with the rough terrain of the Iberian Peninsula, were hardy beasts also. This combination of fine mounts and dextrous riders enabled Iberian cavalry to establish themselves as mercenaries sought after by Rome."	"True"
"unit_description_historical_texts_text_dk_ara_slingers"	"Slingers were common in ancient armies. Slings are ancient weapons, dating back to Palaeolithic times. In comparison to bows, they were easy to make and had a greater effective range. Constructed from braided flax, hemp or rushes, a sling has a cradle where the shot is placed. One end has a finger-loop, while the other has a knot or strip giving a firm handhold. The slinger puts his middle finger through the loop and holds the knotted end with his thumb and forefinger. After whirling the shot in the sling it is released with a flick of the wrist. Quick to fire and reload, the sling was widely hated by those on the receiving end. Shot varied from stones collected in rivers to shaped lumps of clay and lead; lead shot could fly over 400 metres. Such missiles were sometimes inscribed with comments such as “Catch!” or “Take that!” Shot was difficult to see in flight, and although it lacked the penetrating power of an arrow it could easily break bone or stave-in armour at short ranges. Famously, the Roman Consul Paulus was killed by a slinger early in the disastrous Battle of Cannae."	"True"
"unit_description_historical_texts_text_Ibe_Guerilla_Warriors_Long"	"Rather than face an enemy in battle, where they would likely be outnumbered and defeated, guerrilla warriors carried out hit-and-run attacks, using high ground, sabotage, and ambush techniques to weaken enemy positions. Knowledge of the local terrain is essential in guerrilla warfare. Iberians were certainly well-suited to such tactics, having developed their skills through centuries of inter-tribal feuding. The Greek historian, Diodorus, said the following about Iberian guerrillas: “for those that are young and pressed with want, but yet are strong and courageous, get together upon the tops of the mountains, and furnish themselves with arms; and having made up a considerable body, make incursions into Iberia, and heap up riches by thieving and robbery; and this is their constant practice in despite of all hazard whatsoever; for being lightly armed, and nimble of foot, they are not easily surprised"."	"True"
"unit_description_historical_texts_text_Ibe_Onager_Long"	"One of the simplest forms of one-armed catapult, the onager relied on twisted skeins of animal sinew which provided the power to hurl either rocks or shot. Inaccurate but powerful, it was an effective siege engine against buildings and fortifications, but was of far less use on the battlefield unless firing into massed infantry ranks. First mentioned by Philon of Byzantium in his treatise ‘Mechanics’, the onager had a sling-like cradle attached to a firing arm. This arm was inserted and twisted to propel its shot through torsion. As the firing arm was released, the sling-like cradle would unhook, firing the projectile. A padded beam was incorporated into the housing frame to restrain the arm. Larger machines could require as many as eight or ten crewmen, and the incredible recoil meant that they could not be easily or safely mounted on walls or towers. Quickly constructed wherever wood was readily available, onagers soon became a staple of ancient siege warfare."	"True"
